publishedAt,title
2024-11-21 19:45:03+00:00,"Nvidia Shares Dip as Q3 Results Beat Expectations, but Guidance Disappoints After reporting fiscal third-quarter earnings that topped expectations, Nvidia (NVDA, Financials) shares dipped in extended trading on Wednesday; investors wanted more action from the chip giant.
Nv Nvidia noted that demand for Blackwell chips will exceed supply for several quarters into fiscal 2026"
2024-11-21 19:46:27+00:00,Intel Corporation (INTC) Secures Major Grants Amid US Push to Boost Chip Production  
2024-11-25 09:15:29+00:00,"Intel Corporation (INTC) to Sell Folsom Campus as Part of Cost-Cutting Amid Struggles to Regain Chip Leadership We recently compiled a list of the 14 AI Stocks on Wall Street's Radar. In this article, we are going to take a look at where Intel Corporation (NASDAQ:INTC) stands against the other AI stocks that a We recently compiled a list of the 14 AI Stocks on Wall Street’s Radar. In this article, we are going to take a look at where Intel Corporation (NASDAQ:INTC)..."
2024-11-25 15:40:00+00:00,"US Government to Trim Intel Chips Funds: Will it Hurt INTC Stock? <ul><li>The US government is considering reducing Intel's federal chips grant under the CHIPS and Science Act from $8.5 billion to less than $8 billion, reportedly due to Intel's $3 billion contract  With the government deciding to reduce the funding, it appears Intel has fallen down the pecking order."
2024-11-27 15:03:57+00:00,"49-Year-Old Makes $5,180 a Month in Dividends With 'Helps Me Sleep at Night' Portfolio – Top 10 Stocks You Can't Miss Benzinga and Yahoo Finance LLC may earn commission or revenue on some items through the links below.Investors invest in dividends to increase wealth and balance out their growth portfolios to hedge a Investors invest in dividends to increase wealth and balance out their growth portfolios to hedge against risks. Dividend stocks have proved their mettle..."
2024-11-28 13:36:31+00:00,Intel (INTC) Faces Uncertainty: QUALCOMM Walks Away from Acquisition Deal  
2024-12-02 14:00:14+00:00,"Intel CEO Pat Gelsinger retires after tumultuous tenure leading the chip giant Intel (INTC) announced Monday that CEO Pat Gelsinger retired on Sunday, stepping down from his post leading the company and a spot on the company's board of directors.
Gelsinger joined the company i Intel CEO Pat Gelsinger retired over the holiday weekend, leaving the tech giant with new leadership amid the pivotal AI transition."
2024-12-02 14:16:07+00:00,"Intel just ousted CEO Pat Gelsinger as it struggles to compete in the AI era Yahoo is using AI to generate takeaways from this article. This means the info may not always match what's in the article. Reporting mistakes helps us improve the experience.Generate Key Takeaways
I Intel (INTC) announced Monday that chief executive officer Pat Gelsinger is retiring from the company and has stepped down from its board of directors."
2024-12-02 14:52:39+00:00,"Intel CEO Pat Gelsinger pushed out following tumultuous tenure leading the chip giant Intel (INTC) announced Monday that CEO Pat Gelsinger retired effective Dec. 1 and stepped down from the company's board of directors. Gelsinger led aggressive efforts to turn around the troubled US c Intel CEO Pat Gelsinger retired over the holiday weekend, leaving the tech giant with new leadership amid the pivotal AI transition."
2024-12-02 18:13:09+00:00,"Intel CEO Pat Gelsinger Retires, Co-CEOs Named Intel Corp. (INTC, Financials) announced that co-CEOs David Zinsner and Michelle Johnston Holthaus would succeed Pat Gelsinger, who will retire on Dec. 1. Gelsinger also left Intel's board. INTC stoc Intel CEO Pat Gelsinger has retired, effective Dec. 1."
2024-12-02 19:07:32+00:00,"A record number of CEOs are heading for the exits — here's why The end of the holiday weekend added two fresh examples of a historic shift on Wall Street: More CEOs than ever are heading for the exits. Over the past 24 hours, the leaders of chipmaker Intel (INTC More exacting boards, a winner-take-all market, and higher capital costs are making it harder for CEOs to keep their jobs."
2024-12-03 11:00:20+00:00,"Pat Gelsinger and Carlos Tavares had the same big problem: Morning Brief This is The Takeaway from today's Morning Brief, which you can sign up to receive in your inbox every morning along with:
<ul><li>The chart of the day
</li><li>What we're watching
</li><li>What we So far, 2024 is pacing to have a record number of CEOs out of a job. This week, two big ones — from Intel and Stellantis — illustrated a key point: It's hard..."
2024-12-03 11:56:55+00:00,"Stock market today: S&P 500, Nasdaq futures hold just short of records with JOLTS on deck US stock futures drifted near all-time highs on Tuesday as investors waited for fresh jobs data and Fedspeak to cement or dent growing hopes for interest-rate cuts.
Futures on the S&amp;P 500 (ES=F) The focus is on JOLTS jobs data and Fedspeak to cement or dent growing hopes for interest-rate cuts."
2024-12-03 13:00:39+00:00,"AMD history: Beyond the Ticker Over the past five decades, Advanced Micro Devices, or AMD (AMD), has become a staple of the tech industry.
Let's take a closer look at the semiconductor company's biggest moments with Beyond the Ti Over the past five decades, Advanced Micro Devices, or AMD (AMD), has become a staple of the tech industry. Let's take a closer look at the semiconductor..."
2024-12-03 14:35:48+00:00,"Stock market today: S&P 500, Nasdaq drift near record levels with JOLTS data on deck US stocks drifted near all-time highs on Tuesday as investors waited for fresh jobs data and Fedspeak to cement or dent growing hopes for future interest rate cuts.
The S&amp;P 500 (^GSPC) and the t The focus is on JOLTS jobs data and Fedspeak to cement or dent growing hopes for interest-rate cuts."
2024-12-03 16:23:05+00:00,"Stock market today: Dow, S&P 500 slip after key jobs data shows surprise rebound in openings US stocks traded mixed on Tuesday as investors digested fresh jobs data and waited for new Fedspeak to cement or dent growing hopes for future interest rate cuts.
The S&amp;P 500 (^GSPC) fell about  The focus is on JOLTS jobs data and Fedspeak will cement or dent growing hopes for interest rate cuts."
2024-12-03 16:23:05+00:00,"Stock market today: Nasdaq drifts near records while S&P 500, Dow fall following key jobs data US stocks traded mixed on Tuesday as investors digested fresh jobs data and waited for new Fedspeak to cement or dent growing hopes for future interest rate cuts.
The S&amp;P 500 (^GSPC) fell about  The focus is on JOLTS jobs data and Fedspeak will cement or dent growing hopes for interest rate cuts."
2024-12-03 18:18:21+00:00,"Intel should leave the foundry business: Analyst on CEO departure Intel (INTC) CEO Pat Gelsinger suddenly retired from his chief executive role at the chipmaker over the weekend. Gelsinger began working at Intel as its chief architect in the 1980s, going on to act  Intel (INTC) CEO Pat Gelsinger suddenly retired from his chief executive role at the chipmaker over the weekend. Gelsinger began working at Intel as its..."
2024-12-04 19:42:27+00:00,"Intel’s CEO shakeup puts foundry plans, CHIPS Act cash at risk Intel (INTC) is in crisis. The company forced out CEO Pat Gelsinger on Monday, its stock price is down more than 50% on the year, and the grand plan to add third-party semiconductor manufacturing to  Intel's CHIPS Act funding could disappear if the company ditches its plans to expand its manufacturing footprint."
2024-12-05 13:00:18+00:00,"Investors Lose $383.2 Billion On These 10 Giant Losers This Year Everyone wants to talk about their big S&amp;P 500 winners this year. Don't expect to hear much about their losers.
XNOW PLAYINGBeating The Market: How To Find Outperforming StocksBut there are plen Everyone wants to talk about their big S&P 500 winners this year. Don't expect to hear much about their losers."
2024-12-05 21:29:47+00:00,"Apple shares hit new all-time intraday and closing highs In Nasdaq trading today, shares of Apple Inc. (AAPL) rose $0.03, or 0.01%, to $243.04, a new all-time closing high. Apple’s intraday high was also set today at $244.54.
Apples 52-week low stands at  In Nasdaq trading today, shares of Apple Inc. rose to hit a new all-time closing high. Apple’s all-time intraday high was set on…
The post Apple shares hit new all-time intraday and closing highs appeared first on MacDailyNews."
2024-12-06 07:03:00+00:00,"IntelがASMLの元CEOとマイクロチップ・テクノロジーの暫定CEOを取締役会に追加、前CEOは一体何を間違えたのか？ 2024125IntelASMLCEOCEO
Intel Appoints Semiconductor Leaders Eric Meurice and Steve Sanghi to Board of Directors :: Intel Corporation (INTC)
https://www.intc.com/news-events/press-releases/detail/17 2024年12月5日、IntelはASML社の元会長・元CEOであるエリック・モーリス氏と、マイクロチップ・テクノロジー社の会長兼暫定CEOであるスティーブ・サンギ氏を取締役に任命したと発表しました。Intel Appoints Semiconductor Leaders Eric Meurice and Steve Sanghi to Board of Directors :: Intel Corporation (INTC)https://www.intc.com/news-events/press-rele…"
2024-12-06 10:45:28+00:00,"These 2 Chip Stocks Are Set to Capitalize on Intel's CEO Crisis Investors don't seem to know what to do with Intel's (NASDAQ: INTC) recent CEO announcement.The ailing chipmaker issued a press release before markets opened on Monday saying that CEO Pat Gelsinger,  Investors don't seem to know what to do with Intel's (NASDAQ: INTC) recent CEO announcement.
The ailing chipmaker issued a press release before markets opened on Monday saying that CEO Pat Gelsinger, who had run the company for nearly four years, retired effe…"
2024-12-06 17:11:15+00:00,"Intel Shakes Up Board With ASML And Microchip Technology Veterans Amid CEO Transition Intel Corporation INTC has appointed semiconductor industry veterans Eric Meurice and Steve Sanghi to its board of directors, the company announced Thursday, as it navigates through significant leade Intel Corporation INTC has appointed semiconductor industry veterans Eric Meurice and Steve Sanghi to its board of directors, the company announced Thursday, as it navigates through significant leadership transitions and market challenges.
What Happened: The …"
2024-12-06 18:21:13+00:00,Intel Corp (INTC) CEO Exit Signals Uncertain Future Amid Ongoing Structural Challenges  
2024-12-06 20:18:50+00:00,"In ousters at Intel and Stellantis, the boards were at fault for acting too late Gus Carlson is a U.S.-based columnist for The Globe and Mail.If there is anything surprising about the high-profile departures of CEOs at Intel INTC-Q and Stellantis STLA-N this week, it isnt that th Gus Carlson is a U.S.-based columnist for The Globe and Mail.
If there is anything surprising about the high-profile departures of CEOs at Intel INTC-Q and Stellantis STLA-N this week, it isn’t that they were sent packing – it’s that it took their boards so l…"
2024-12-06 21:40:09+00:00,"Apple shares hit new all-time intraday high In Nasdaq trading today, shares of Apple Inc. (AAPL) declined $0.20, or 0.01%, to close at $242.84. During the session, Apple set a new all-time intraday high of $244.63.
Apples 52-week low stands a In Nasdaq trading today, shares of Apple Inc. rose to hit a new all-time closing high. Apple’s all-time intraday high…
The post Apple shares hit new all-time intraday high appeared first on MacDailyNews."
2024-12-07 07:55:04+00:00,"Intel Co. (NASDAQ:INTC) Receives $30.04 Consensus Target Price from Analysts Intel Co. (NASDAQ:INTC – Get Free Report) has received a consensus rating of “Reduce” from the thirty-one brokerages that are currently covering the stock, Marketbeat Ratings reports. Five equities r Intel Co. (NASDAQ:INTC – Get Free Report) has received a consensus rating of “Reduce” from the thirty-one brokerages that are currently covering the stock, Marketbeat Ratings reports. Five equities research analysts have rated the stock with a sell rating, tw…"
2024-12-09 11:10:44+00:00,"Intel should have focused on AI rather than chipmaking, TSMC founder says According to Morris Chang, the founder of Taiwan Semiconductor Manufacturing Co, Intel should have focused on artificial intelligence instead of trying to become a contract chipmaker. Chang made this Intel should have focused on artificial intelligence rather than trying to become a contract chipmaker, the founder of Taiwan Semiconductor Manufacturing Co ..."
2024-12-09 13:24:00+00:00,"Apple, Nvidia, and Microsoft are America's best-managed companies right now, report says In This Story
Apple (AAPL-0.08%
) is the best-managed company in the U.S., according to a new ranking by The Wall Street Journal.
Of 250 companies, Nvidia (NVDA-1.81%
) came in second, followed b Apple (AAPL) is the best-managed company in the U.S., according to a new ranking by The Wall Street Journal.Read more..."
2024-12-09 21:18:48+00:00,"Apple shares hit new all-time intraday and closing highs In Nasdaq trading today, shares of Apple Inc. (AAPL) rose $3.91, or 1.61%, to $246.75, a new all-time closing high. Apple’s intraday high was also set today at $247.24.
Apples 52-week low stands at  In Nasdaq trading today, shares of Apple Inc. rose to hit a new all-time closing high. Apple’s all-time intraday high was set…
The post Apple shares hit new all-time intraday and closing highs appeared first on MacDailyNews."
2024-12-10 00:01:07+00:00,Intel Corporation (INTC): A Bull Case Theory  
2024-12-10 15:59:22+00:00,"Nvidia Rebounds From Key Level After China Probe Scare, Buy Point Still In Play; Is Nvidia A Buy Now? Nvidia (NVDA) rattled investors Monday after news of an antimonopoly probe by Chinese regulators. But the stock found support at the 50 day moving average and is rebounding on Tuesday. That means tha Nvidia stock rebounded from the 50-day moving average after falling over 2% amid news of a China probe on Monday."
2024-12-10 17:01:03+00:00,"Google stock pops as company unveils new quantum chip Google's stock rose 4% after the company announced a breakthrough in quantum computing with its new chip, Willow, which can solve complex mathematical equations much faster than classical supercomput Google said that a math equation that would take a classical supercomputer longer than the whole history of the universe to solve takes only five minutes using a quantum computer powered by its new chip Willow."
2024-12-10 21:20:30+00:00,"Apple shares hit new all-time intraday and closing highs In Nasdaq trading today, shares of Apple Inc. (AAPL) rose $1.02, or 0.41%, to $247.77, a new all-time closing high. Apple’s intraday high was also set today at $248.21.
Apples 52-week low stands at  In Nasdaq trading today, shares of Apple Inc. rose to hit a new all-time closing high. Apple’s all-time intraday high was set…
The post Apple shares hit new all-time intraday and closing highs appeared first on MacDailyNews."
2024-12-12 10:22:35+00:00,"NVIDIA Crushes Rivals: Secures Unprecedented 90% of GPU Market in Q3 2024 In a historic turn, Nvidia (NVDA, Financial) has once again taken the top spot, with a whopping 90% of the global GPU market share in Q3 2024. This dominance, says Jon Peddie Research (JPR) mascot, i AMD and Intel Struggle as NVIDIA Hits Historic GPU Market Share Domination"
2024-12-12 21:20:55+00:00,"Apple shares hit new all-time closing high In Nasdaq trading today, shares of Apple Inc. (AAPL) rose $1.47, or 0.60%, to $247.96, a new all-time closing high. Apple’s intraday high was set on December 11, 2024 at $250.80.
Apples 52-week low  In Nasdaq trading today, shares of Apple Inc. rose to hit a new all-time closing high. Apple’s all-time intraday high was set…
The post Apple shares hit new all-time closing high appeared first on MacDailyNews."
2024-12-13 00:19:26+00:00,"Intel's CEO Was Ousted Leaving The West In Dire Need Of Foundry Fortification (Rating Downgrade) Analysts Disclosure:I/we have no stock, option or similar derivative position in any of the companies mentioned, and no plans to initiate any such positions within the next 72 hours. I wrote this art Examine Intel's challenges, including the resignation of its CEO and the potential sale of Intel Foundry Services. Learn more about INTC stock here."
2024-12-13 07:56:44+00:00,"Equities Analysts Set Expectations for Intel Q2 Earnings Intel Co. (NASDAQ:INTC – Free Report) – Zacks Research decreased their Q2 2026 earnings per share estimates for Intel in a report released on Monday, December 9th. Zacks Research analyst R. Departmen Intel Co. (NASDAQ:INTC – Free Report) – Zacks Research decreased their Q2 2026 earnings per share estimates for Intel in a report released on Monday, December 9th. Zacks Research analyst R. Department now anticipates that the chip maker will post earnings per…"
2024-12-13 16:54:56+00:00,"Why AMD Is a Much Stronger Investment than Intel (INTC) I used to be bullish on semiconductor designer and manufacturer Intel (INTC), but following the boards decision to remove the CEO, Im left uncertain about the companys future. Instead, semiconductor  I used to be bullish on semiconductor designer and manufacturer Intel (INTC), but following the board’s decision to remove the CEO, I’m left uncertain about ..."
2024-12-13 17:50:58+00:00,"Why AMD Is a Much Stronger Investment than Intel (INTC) In This Article:I used to be bullish on semiconductor designer and manufacturer Intel (INTC), but following the boards decision to remove the CEO, Im left uncertain about the companys future. Instead In This Article:
I used to be bullish on semiconductor designer and manufacturer Intel (INTC), but following the board’s decision to remove the CEO, I’m left uncertain about the company’s future. Instead, semiconductor designer AMD (AMD) is firing on all cyli…"
2024-12-13 21:38:38+00:00,"Apple shares hit new all-time closing high In Nasdaq trading today, shares of Apple Inc. (AAPL) rose $0.17, or 0.07%, to $248.13, a new all-time closing high. Apple’s intraday high was set on December 11, 2024 at $250.80.
Apples 52-week low  In Nasdaq trading today, shares of Apple Inc. rose to hit a new all-time closing high. Apple’s all-time intraday high was set…
The post Apple shares hit new all-time closing high appeared first on MacDailyNews."
2024-12-14 07:33:06+00:00,"What is Zacks Research’s Forecast for Intel FY2025 Earnings? Intel Co. (NASDAQ:INTC – Free Report) – Zacks Research reduced their FY2025 EPS estimates for shares of Intel in a research note issued on Monday, December 9th. Zacks Research analyst R. Department n Intel Co. (NASDAQ:INTC – Free Report) – Zacks Research reduced their FY2025 EPS estimates for shares of Intel in a research note issued on Monday, December 9th. Zacks Research analyst R. Department now expects that the chip maker will earn $0.22 per share for…"
2024-12-14 08:34:43+00:00,"Rep. Mike Kelly Sells Intel Co. (NASDAQ:INTC) Stock Representative Mike Kelly (R-Pennsylvania) recently sold shares of Intel Co. (NASDAQ:INTC). In a filing disclosed on December 12th, the Representative disclosed that they had sold between $1,001 and  Representative Mike Kelly (R-Pennsylvania) recently sold shares of Intel Co. (NASDAQ:INTC). In a filing disclosed on December 12th, the Representative disclosed that they had sold between $1,001 and $15,000 in Intel stock on November 8th. The trade occurred i…"
2024-12-14 10:00:00+00:00,"OpenAI launches canvas, Cohere's compact model, and more fundraising: This week's AI launches Ayar Labs, a startup that developed the first in-package optical I/O solution to replace electrical I/O in AI training and inferencing chips, announced a $155 million Series D funding round this week Each week, Quartz rounds up product launches, updates, and funding news from artificial intelligence-focused startups and companies.Read more..."
2024-12-14 22:38:01+00:00,Get Paid to Wait with Intel Stock (INTC) Put Options  
2024-12-15 01:31:59+00:00,"Get Paid to Wait with Intel Stock (INTC) Put Options In This Article:As investors surely already know, bellwether Intel Corp (INTC) has become the black sheep of the semiconductor family. Late to the game in shifting from CPUs to GPUs, Intel has lost i In This Article:
As investors surely already know, bellwether Intel Corp (INTC) has become the black sheep of the semiconductor family. Late to the game in shifting from CPUs to GPUs, Intel has lost industry leadership to Nvidia (NVDA) and long-term competito…"
2024-12-15 20:10:24+00:00,Intel (INTC) Faces Critical Juncture: 18A Chip Technology Could Determine Future of Manufacturing Operations  
2024-12-16 04:53:53+00:00,"Opened an attachment from a fake invoice email, password manager accessed Within about 5-10 minutes of opening the attachment, I shut the laptop down. (It was not connected to the internet tonight while the FRST scan was running). Malwarebytes would not start a scan, neith Opened an attachment from a fake invoice email, password manager accessed - posted in Virus, Trojan, Spyware, and Malware Removal Help: Within about 5-10 minutes of opening the attachment, I shut the laptop down. (It was not connected to the internet tonight …"
2024-12-16 04:56:26+00:00,"Opened an attachment from a fake invoice email, password manager accessed Within about 5-10 minutes of opening the attachment, I shut the laptop down. (It was not connected to the internet tonight while the FRST scan was running). Malwarebytes would not start a scan, neith Opened an attachment from a fake invoice email, password manager accessed - posted in Virus, Trojan, Spyware, and Malware Removal Help: Within about 5-10 minutes of opening the attachment, I shut the laptop down. (It was not connected to the internet tonight …"
2024-12-16 11:00:00+00:00,"Why Intel's Foundry May Be Set For A Comeback LONDON, UNITED KINGDOM - NOVEMBER 14: The Intel logo is seen outside a pop-up store on Oxford Street ... [+] on November 14, 2024 in London, United Kingdom. (Photo by Leon Neal/Getty Images)
Getty I Intel’s next-gen 18A fabrication process technology is almost ready to roll out, and the company also appears to be a key beneficiary of regulatory support under the T..."
2024-12-16 13:45:00+00:00,"Some Of This Year’s Big Losers Look Good To Me Intel CEO Pat Gelsinger resigned under pressure in December. He is shown here speaking in June. ... [+] (Photo by I-HWA CHENG/AFP via Getty Images)
AFP via Getty Images
As each year draws to a clos Most years, I find one or two stocks among the biggest losers that I think are worth buying. This year there are three — Intel, Moderna and Walgreens Boots Alliance."
2024-12-16 21:12:29+00:00,"Apple shares hit new all-time intraday and closing highs In Nasdaq trading today, shares of Apple Inc. (AAPL) rose $2.91, or 1.17%, to $251.04, a new all-time closing high. Apple’s intraday high was also set today at $251.38.
Apples 52-week low stands at  In Nasdaq trading today, shares of Apple Inc. rose to hit a new all-time closing high. Apple’s all-time intraday high was also set today…
The post Apple shares hit new all-time intraday and closing highs appeared first on MacDailyNews."
2024-12-17 21:17:09+00:00,"Apple shares hit new all-time intraday and closing highs In Nasdaq trading today, shares of Apple Inc. (AAPL) rose $2.44, or 0.97%, to $253.48, a new all-time closing high. Apple’s intraday high was also set today at $253.81.
Apples 52-week low stands at  In Nasdaq trading today, shares of Apple Inc. rose to hit a new all-time closing high. Apple’s all-time intraday high was also set today…
The post Apple shares hit new all-time intraday and closing highs appeared first on MacDailyNews."
2024-12-18 14:15:00+00:00,"Quantum Computing Market Infused with Artificial Intelligence Poised for Significant Usage & Growth PALM BEACH, Fla., Dec. 18, 2024 (GLOBE NEWSWIRE) -- FN Media Group News Commentary - Quantum computing is a revolutionary technology in computer science that utilizes the principles of quantum mechan PALM BEACH, Fla., Dec. 18, 2024 (GLOBE NEWSWIRE) -- FN Media Group News Commentary - Quantum computing is a revolutionary technology in computer science that utilizes the principles of quantum mechanics to process information. Unlike classical computers that …"
2024-12-18 19:39:59+00:00,"On-silicon real-time AI compute governance from Nvidia, Intel, EQTY Labs <ul> Introducing the AI Integrity Suite — a first-of-its-kind toolset for creating verifiable provenance and governance for AI data, models, and agents."
2024-12-18 19:39:59+00:00,"On-silicon real-time AI compute governance from Nvidia, Intel, EQTY Labs <ul><li>Breakthrough provides the first-ever certificates of authenticity and compliance for independent verification of AI training, inference, and benchmarks at runtime.
</li></ul><ul><li>The solu Introducing the AI Integrity Suite — a first-of-its-kind toolset for creating verifiable provenance and governance for AI data, models, and agents."
2024-12-19 21:57:23+00:00,"Can Intel's foundry business help it catch up to TSMC in 2025? Intel (INTC) stock has had a difficult 2024, with shares falling roughly 60% year-to-date. As investors turn to 2025, Yahoo Finance Senior Reporter Yasmin Khorram and Reporter Laura Bratton sit down  Intel (INTC) stock has had a difficult 2024, with shares falling roughly 60% year-to-date. As investors turn to 2025, Yahoo Finance Senior Reporter Yasmin..."
