publishedAt,title
2024-12-20 13:00:18+00:00,"How innovation died at Intel: America's only leading-edge chip manufacturer faces an uncertain future and lawsuits Intel's (INTC) fall from grace seemed to happen all at once. Shares of the once iconic chipmaker plummeted 60% in 2024. The company posted the biggest loss in its 56-year history in its latest quarte Amid struggles to turn itself around, exclusive interviews with Intel executives and industry analysts reveal missed opportunities, poor decision making, and..."
2024-12-20 13:32:26+00:00,"How innovation died at Intel as it faces an uncertain future as America's only leading-edge chip manufacturer Intel's (INTC) fall from grace seemed to happen all at once.Shares of the once iconic chipmaker plummeted 60% in 2024. The company posted the biggest loss in its 56-year history in its latest quarter Intel's (INTC) fall from grace seemed to happen all at once.
Shares of the once iconic chipmaker plummeted 60% in 2024. The company posted the biggest loss in its 56-year history in its latest quarterly earnings report. Its market cap has dropped 80% since 20…"
2024-12-20 20:02:00+00:00,"CEOs left their companies in droves this year, setting a new record In This Story
We may be witnessing peak CEO exodus, according to a new report, which found that more chief executive officers have left their roles in 2024 than in any other year over the past few d We may be witnessing peak CEO exodus, according to a new report, which found that more chief executive officers have left their roles in 2024 than in any other year over the past few decades.Read more..."
2024-12-20 21:19:43+00:00,"Apple shares hit new all-time intraday and closing highs In Nasdaq trading today, shares of Apple Inc. (AAPL) rose $4.70, or 1.87%, to $254.46, a new all-time closing high. Apple’s intraday high was also set today at $255.00.
Apples 52-week low stands at  In Nasdaq trading today, shares of Apple Inc. rose to hit a new all-time closing high. Apple’s all-time intraday high was set…
The post Apple shares hit new all-time intraday and closing highs appeared first on MacDailyNews."
2024-12-21 01:17:54+00:00,"How innovation died at Intel: America's only leading-edge chip manufacturer faces an uncertain future Skip to comments.
How innovation died at Intel: America's only leading-edge chip manufacturer faces an uncertain futureYahoo Finance ^
 | 20 Dec, 2024
 | Laura Bratton and Yasmin Khorram
Posted o Intel's (INTC) fall from grace seemed to happen all at once. Shares of the once iconic chipmaker plummeted 60% in 2024. The company posted the biggest loss in its 56-year history in its latest quarterly earnings report. Its market cap has dropped 80% since 20…"
2024-12-21 14:27:31+00:00,"Intel Corporation (INTC) Shortlists Buyout Firms for Altera Unit, Valued Up to $12 Billion  "
2024-12-22 09:02:53+00:00,"M&T Bank Corp Has $28.70 Million Holdings in Intel Co. (NASDAQ:INTC) M&amp;T Bank Corp trimmed its position in shares of Intel Co. (NASDAQ:INTC – Free Report) by 10.0% during the 3rd quarter, according to its most recent Form 13F filing with the Securities and Exchang M&T Bank Corp trimmed its position in shares of Intel Co. (NASDAQ:INTC – Free Report) by 10.0% during the 3rd quarter, according to its most recent Form 13F filing with the Securities and Exchange Commission. The fund owned 1,223,125 shares of the chip maker’…"
2024-12-24 11:00:47+00:00,"Nvidia dominated 2024 big-time. Next year? Plenty of challenges. Nvidia (NVDA) has had the kind of year most companies can only dream of.
Its revenue and stock price soared thanks to prescient investments in artificial intelligence technologies that are paying of Nvidia dominated 2024, and 2025 is looking just as good. But there's turbulence on the horizon."
2024-12-25 12:20:15+00:00,Jim Cramer Says Intel Corporation (INTC)’s Balance Sheet Is ‘Something That Looks Like A Nightmare’  
2024-12-26 21:44:55+00:00,"Apple shares hit new all-time intraday and closing highs In Nasdaq trading today, shares of Apple Inc. (AAPL) rose $0.82, or 0.32%, to $259.02, a new all-time closing high. Apple’s intraday high was also set today at $260.09.
Apples 52-week low stands at  In Nasdaq trading today, shares of Apple Inc. rose to hit a new all-time closing high. Apple’s all-time intraday high was set…
The post Apple shares hit new all-time intraday and closing highs appeared first on MacDailyNews."
2024-12-27 09:32:00+00:00,"2024 in Review 2024 was an unbelievable year for the S&amp;P 500 up 28% YTD. The index constituents’ average and median returns are 15.7% and 11.8%, respectively. Altogether, this years index returns dwarf the long 2024 was an unbelievable year for the S&P 500 up 28% YTD. The index constituents’ average and median returns are 15.7% and 11.8%, respectively. Altogether, this year’s index returns dwarf the long-term average S&P 500 return of 7.9% since 1928. […]
The post 2…"
2024-12-27 10:30:40+00:00,"Intel Stock Downside Of $10? Microchip and Intel logo displayed on a phone screen are seen in this multiple exposure illustration ... [+] photo taken in Krakow, Poland on April 10, 2023. (Photo by Jakub Porzycki/NurPhoto via Get The surge in demand for GPU chips for AI applications - an area where Intel has a relatively limited presence - has also hurt."
2024-12-27 10:30:57+00:00,"Intel (NASDAQ:INTC) Shares Up 1% – What’s Next? Intel Co. (NASDAQ:INTC – Get Free Report)’s stock price rose 1% during trading on Wednesday . The stock traded as high as $20.40 and last traded at $20.40. Approximately 29,884,023 shares were traded Intel Co. (NASDAQ:INTC – Get Free Report)’s stock price rose 1% during trading on Wednesday . The stock traded as high as $20.40 and last traded at $20.40. Approximately 29,884,023 shares were traded during mid-day trading, a decline of 52% from the average d…"
2024-12-27 15:35:00+00:00,"Escalating US-China Trade War to Hurt These Tech Stocks in 2025 The ongoing US-China trade war has intensified, with technology being a primary battleground. What began as a tussle over trade imbalances has evolved into a strategic clash over technological suprem The escalating US-China tech war presents a formidable challenge for U.S. semiconductor companies like NVIDIA, Micron, Intel and Qualcomm."
2024-12-28 11:01:58+00:00,"Intel (NASDAQ:INTC) Shares Up 1% – Here’s Why Intel Co. (NASDAQ:INTC – Get Free Report) shot up 1% on Thursday . The company traded as high as $20.65 and last traded at $20.60. 11,289,452 shares changed hands during trading, a decline of 82% fro Intel Co. (NASDAQ:INTC – Get Free Report) shot up 1% on Thursday . The company traded as high as $20.65 and last traded at $20.60. 11,289,452 shares changed hands during trading, a decline of 82% from the average session volume of 61,630,883 shares. The stock…"
2024-12-29 10:00:00+00:00,"Investing.com's stocks of the year Investing.com -- 2024 has been a year of significant market shifts, with some companies soaring to new heights while others faced significant headwinds. Investing.com has compiled a list of some of t Investing.com's stocks of the year"
2024-12-29 19:10:04+00:00,"Jim Cramer on Intel Corporation (INTC): ‘Better Than Ever. Don’t Worry About It’ We recently published an article titled Jim Cramer's Bold Predictions About These 15 AI Stocks. In this article, we are going to take a look at where Intel Corporation (NASDAQ:INTC) stands against th We recently published an article titled Jim Cramer’s Bold Predictions About These 15 AI Stocks. In this article, we are going to take a look at where Intel..."
2024-12-30 13:04:53+00:00,"Short Interest in Intel Co. (NASDAQ:INTC) Decreases By 7.3% Intel Co. (NASDAQ:INTC – Get Free Report) saw a significant decrease in short interest during the month of December. As of December 15th, there was short interest totalling 105,180,000 shares, a decr Intel Co. (NASDAQ:INTC – Get Free Report) saw a significant decrease in short interest during the month of December. As of December 15th, there was short interest totalling 105,180,000 shares, a decrease of 7.3% from the November 30th total of 113,440,000 sha…"
2024-12-30 14:07:44+00:00,"Vulnerability Summary for the Week of December 23, 2024 The CISA Vulnerability Bulletin provides a summary of new vulnerabilities that have been recorded in the past week. In some cases, the vulnerabilities in the bulletin may not yet have assigned CVSS s High Vulnerabilities

<table>

<tr>
<th>PrimaryVendor -- Product</th>
<th>Description</th>
<th>Published</th>
<th>CVSS Score</th>
<th>Source Info</th>
</tr>



<tr>
<td>1000 Projects--Attendance Tracking Management System </td>
<td>A vulnerability was found…"
2024-12-30 16:40:01+00:00,"Intel's Stock Falls 3% On Weak Performance and Product Delays Shares of Intel Corporation (INTC, Financial) dropped 3% on Monday as investors are growing concerns over its long-term strategy, and leadership is primarily responsible for this. The company was rec Intel's Struggles Persist: Stock Declines on Weak Performance and Product Delays"
2024-12-31 15:43:47+00:00,"Stock Market Today: Dow Jones Bounces Modestly; Tesla Gains As Some Of Year's Top Winners Fall (Live Coverage) The Dow Jones Industrial Average rose 0.4% in early trades Tuesday, and other indexes also rose as investors sought to end the year on a high note.The S&amp;P 500 and the Nasdaq are trying to break a The Nasdaq is headed for a 30% gain for the year."
2024-12-31 17:28:42+00:00,"Is Intel stock done going down? In This Article:Intel's stock (INTC) will enter 2025 in the penalty box, with an uncertain timeline for when it may return to the rink.Shares of Intel have plunged 60% year to date, badly lagging the In This Article:
Intel's stock (INTC) will enter 2025 in the penalty box, with an uncertain timeline for when it may return to the rink.
Shares of Intel have plunged 60% year to date, badly lagging the 29% advance for the Nasdaq Composite (^IXIC). Meanwhile, …"
2024-12-31 17:39:52+00:00,"Is Intel stock done going down? Intel's stock (INTC) will enter 2025 in the penalty box, with an uncertain timeline for when it may return to the rink.Shares of Intel have plunged 60% year to date, badly lagging the 29% advance for Intel's stock (INTC) will enter 2025 in the penalty box, with an uncertain timeline for when it may return to the rink.
Shares of Intel have plunged 60% year to date, badly lagging the 29% advance for the Nasdaq Composite (^IXIC). Meanwhile, shares of rival c…"
2024-12-31 18:01:54+00:00,"Tuesday links: social media shenanigans MarketsThe U.S. stock market is set for its best two-year performance since 1997-98. (wsj.com)After a good start, energy sector performance has faded. (axios.com)Intel ($INTC) had its worst year as a Markets
The U.S. stock market is set for its best two-year performance since 1997-98. (wsj.com)
After a good start, energy sector performance has faded. (axios.com)
Intel ($INTC) had its worst year as a public company. (cnbc.com)
Gold had its best year since …"
2024-12-31 21:21:21+00:00,"These Are The 5 Best Dow Jones Stocks Of 2024 Nvidia (NVDA), Walmart (WMT) and Amazon.com (AMZN) count among the five best Dow Jones stocks of 2024. Goldman Sachs (GS) and American Express (AXP) also make the cut.
XNOW PLAYINGStocks End Strong  Led by Nvidia, the best Dow Jones stocks have far outpaced index's 13% gain."
2025-01-01 08:04:55+00:00,"Brokerages Set Intel Co. (NASDAQ:INTC) Price Target at $30.04 Shares of Intel Co. (NASDAQ:INTC – Get Free Report) have been given a consensus recommendation of “Reduce” by the thirty-one research firms that are currently covering the stock, MarketBeat reports.  Shares of Intel Co. (NASDAQ:INTC – Get Free Report) have been given a consensus recommendation of “Reduce” by the thirty-one research firms that are currently covering the stock, MarketBeat reports. Five investment analysts have rated the stock with a sell ra…"
2025-01-01 12:47:03+00:00,"Intel (NASDAQ:INTC) Stock Price Down 2.3% – Here’s What Happened Intel Co. (NASDAQ:INTC – Get Free Report)’s stock price fell 2.3% during trading on Monday . The stock traded as low as $19.73 and last traded at $19.83. 14,969,290 shares were traded during trading, Intel Co. (NASDAQ:INTC – Get Free Report)’s stock price fell 2.3% during trading on Monday . The stock traded as low as $19.73 and last traded at $19.83. 14,969,290 shares were traded during trading, a decline of 76% from the average session volume of 61,502,…"
2025-01-01 13:15:52+00:00,"The 5 best performing stocks on the Dow Jones Industrial Average in 2024 That didn't take long. Nvidia joined the Dow Jones Industrial Average on Nov. 8, replacing Intel (INTC) , but the AI chip superpower quickly made its mark.Related: Nvidia stock faces new threat after That didn't take long. 
Nvidia joined the Dow Jones Industrial Average on Nov. 8, replacing Intel (INTC) , but the AI chip superpower quickly made its mark.
Related: Nvidia stock faces new threat after China update
Nvidia (NVDA) was the Dow's top performer fo…"
2025-01-02 09:30:00+00:00,"China's No 2 chip foundry Hua Hong names former Intel veteran as new president China's Hua Hong Semiconductor (688347.SS), the country's second-largest chip foundry, has hired a former Intel (INTC) veteran as its new president amid a management reshuffle.
The Shanghai-based ch China's Hua Hong Semiconductor, the country's second-largest chip foundry, has hired a former Intel veteran as its new president amid a management reshuffle...."
2025-01-02 12:22:54+00:00,"Intel (NASDAQ:INTC) Stock Price Up 1.7% – Here’s Why Intel Co. (NASDAQ:INTC – Get Free Report)’s stock price was up 1.7% during mid-day trading on Tuesday . The stock traded as high as $20.40 and last traded at $20.15. Approximately 15,667,047 shares w Intel Co. (NASDAQ:INTC – Get Free Report)’s stock price was up 1.7% during mid-day trading on Tuesday . The stock traded as high as $20.40 and last traded at $20.15. Approximately 15,667,047 shares were traded during trading, a decline of 75% from the average…"
2025-01-03 10:00:00+00:00,"Chipmakers are rushing to get Chips Act money before Biden's out. Here's who's finalized so far As the Biden administration prepares to pass power to President-elect Donald Trump, U.S. chipmakers are rushing to finalize federal funding.
In 2022, President Joe Biden signed the bipartisan CHIPS  As the Biden administration prepares to pass power to President-elect Donald Trump, U.S. chipmakers are rushing to finalize federal funding.Read more..."
2025-01-03 10:56:45+00:00,"Intel (NASDAQ:INTC) Stock Price Up 1.2% – Here’s What Happened Intel Co. (NASDAQ:INTC – Get Free Report)’s share price traded up 1.2% during mid-day trading on Wednesday . The stock traded as high as $20.40 and last traded at $20.05. 49,642,742 shares traded han Intel Co. (NASDAQ:INTC – Get Free Report)’s share price traded up 1.2% during mid-day trading on Wednesday . The stock traded as high as $20.40 and last traded at $20.05. 49,642,742 shares traded hands during mid-day trading, a decline of 19% from the average…"
2025-01-03 16:52:22+00:00,"Nvidia Hits Buy Point Amid CES Chip Buzz; Is Nvidia A Buy Now? Nvidia (NVDA) rose above the 50-day moving average Friday and hit an early buy point at 141.90. Does that mean Nvidia stock  is a buy now?
The 50 day moving average on a stock chart is a key level t Nvidia stock soared past the 50-day moving average on Friday and hit a buy point ahead of the CES event on Monday when it will reveal its latest chips."
2025-01-03 20:38:26+00:00,"Nvidia Competitors: Who Are the AI Chip Alternatives? Nvidia (NVDA) was one of the best-performing stocks in the S&amp;P 500 in 2024, having nearly tripled in value. It has become one of the best-known AI stocks in recent years, because its high-perform Nvidia dominates the market for the computer chips that power AI, but it isn’t a monopoly. Here’s a look at publicly-traded Nvidia competitors."
2025-01-04 08:51:04+00:00,"Intel Co. (NASDAQ:INTC) Shares Sold by Everence Capital Management Inc. Everence Capital Management Inc. cut its holdings in Intel Co. (NASDAQ:INTC – Free Report) by 26.1% during the 4th quarter, according to its most recent Form 13F filing with the Securities and Exchan Everence Capital Management Inc. cut its holdings in Intel Co. (NASDAQ:INTC – Free Report) by 26.1% during the 4th quarter, according to its most recent Form 13F filing with the Securities and Exchange Commission (SEC). The fund owned 81,708 shares of the chi…"
2025-01-05 12:32:47+00:00,"Intel (NASDAQ:INTC) Stock Price Up 0.4% – Here’s Why Intel Co. (NASDAQ:INTC – Get Free Report)’s stock price traded up 0.4% during mid-day trading on Friday . The company traded as high as $20.55 and last traded at $20.30. 14,168,730 shares were traded Intel Co. (NASDAQ:INTC – Get Free Report)’s stock price traded up 0.4% during mid-day trading on Friday . The company traded as high as $20.55 and last traded at $20.30. 14,168,730 shares were traded during trading, a decline of 51% from the average session v…"
2025-01-05 18:45:32+00:00,"INTC, AMD, or QCOM: Which Chip Stock Could Deliver the Highest Upside Potential? Chipmakers are gaining a lot of attention amid the ongoing artificial intelligence (AI) wave. While Nvidia (NVDA) quickly captured the robust demand for advanced chips required in building AI models, Chipmakers are gaining a lot of attention amid the ongoing artificial intelligence (AI) wave. While Nvidia (NVDA) quickly captured the robust demand for advanced chips required in building AI models, other semiconductor companies are either gradually catching…"
2025-01-06 13:18:00+00:00,"Nvidia and TSMC rise as Foxconn's record quarter boosts chip stocks In This Story
Semiconductor chip stocks rose on Monday after electronics giant Foxconn (HNHPF+1.24%
) reported record-breaking revenue for its fourth quarter, as the artificial intelligence boom co Semiconductor chip stocks rose on Monday after electronics giant Foxconn (HNHPF) reported record-breaking revenue for its fourth quarter, as the artificial intelligence boom continues into 2025.Read more..."
2025-01-06 16:00:59+00:00,"Qualcomm reveals Snapdragon X chip for AI PCs, new desktop system at CES 2025 Qualcomm (QCOM) is diving further into the PC industry, debuting its new Snapdragon X chip for mid-range laptops and desktops. The chip, which the company says will be available in PCs beginning this Qualcomm launches Snapdragon X chip for laptops and desktops in challenge to Intel at CES 2025."
2025-01-06 17:44:57+00:00,"Neville Rodie & Shaw Inc. Buys 13,095 Shares of Intel Co. (NASDAQ:INTC) Neville Rodie &amp; Shaw Inc. raised its holdings in Intel Co. (NASDAQ:INTC – Free Report) by 23.9% in the fourth quarter, HoldingsChannel.com reports. The firm owned 67,910 shares of the chip maker’ Neville Rodie & Shaw Inc. raised its holdings in Intel Co. (NASDAQ:INTC – Free Report) by 23.9% in the fourth quarter, HoldingsChannel.com reports. The firm owned 67,910 shares of the chip maker’s stock after purchasing an additional 13,095 shares during the …"
2025-01-06 17:53:07+00:00,"Intel fills out Core Ultra 200 laptop CPUs with hodgepodge of CPUs, GPUs, and NPUs - Ars Technica The Fine Print: The following comments are owned by whoever posted them. We are not responsible for them in any way. Intel fills out Core Ultra 200 laptop CPUs with hodgepodge of CPUs, GPUs, and NPUsArs Technica Intel Extends Leadership in AI PCs and Edge Computing at CES 2025Investor Relations :: Intel Corporation (INTC) Intel’s new Core Ultra 200HX series CPUs are ready f…"
2025-01-06 18:00:00+00:00,"The Dow jumps 300 points as Nvidia and other AI stocks surge Photo: Spencer Platt (Getty Images)
The Dow regained momentum by mid-morning on Monday as AI stocks surged. Electronic giant Foxconn (HNHPF) reported record-breaking revenue for its fourth quarter,  The Dow regained momentum by mid-morning on Monday as AI stocks surged. Electronic giant Foxconn (HNHPF) reported record-breaking revenue for its fourth..."
2025-01-06 18:00:22+00:00,"The Dow regains its groove, rising 300 points on AI stock surge In This Story
The Dow regained momentum by mid-morning on Monday as AI stocks surged. Electronic giant Foxconn (HNHPF+3.09%
) reported record-breaking revenue for its fourth quarter, and the artifi The Dow regained momentum by mid-morning on Monday as AI stocks surged. Electronic giant Foxconn (HNHPF) reported record-breaking revenue for its fourth quarter, and the artificial intelligence boom continues into 2025.Read more..."
2025-01-07 08:45:04+00:00,"Intel Co. (NASDAQ:INTC) Shares Sold by GAMMA Investing LLC GAMMA Investing LLC trimmed its holdings in Intel Co. (NASDAQ:INTC – Free Report) by 26.6% in the fourth quarter, according to its most recent disclosure with the Securities &amp; Exchange Commission GAMMA Investing LLC trimmed its holdings in Intel Co. (NASDAQ:INTC – Free Report) by 26.6% in the fourth quarter, according to its most recent disclosure with the Securities & Exchange Commission. The institutional investor owned 15,461 shares of the chip mak…"
2025-01-07 09:35:05+00:00,"Canandaigua National Bank & Trust Co. Sells 31,927 Shares of Intel Co. (NASDAQ:INTC) Canandaigua National Bank &amp; Trust Co. lowered its stake in shares of Intel Co. (NASDAQ:INTC – Free Report) by 43.0% in the 4th quarter, according to its most recent Form 13F filing with the Secur Canandaigua National Bank & Trust Co. lowered its stake in shares of Intel Co. (NASDAQ:INTC – Free Report) by 43.0% in the 4th quarter, according to its most recent Form 13F filing with the Securities and Exchange Commission. The institutional investor owned …"
