publishedAt,title
2024-11-21 09:06:50+00:00,"Empowered Funds LLC Grows Holdings in NIKE, Inc. (NYSE:NKE) Empowered Funds LLC raised its holdings in NIKE, Inc. (NYSE:NKE – Free Report) by 10.7% during the third quarter, according to the company in its most recent Form 13F filing with the SEC. The firm ow Empowered Funds LLC raised its holdings in NIKE, Inc. (NYSE:NKE – Free Report) by 10.7% during the third quarter, according to the company in its most recent Form 13F filing with the SEC. The firm owned 23,214 shares of the footwear maker’s stock after purcha…"
2024-11-21 10:52:47+00:00,"Caprock Group LLC Reduces Stock Holdings in NIKE, Inc. (NYSE:NKE) Caprock Group LLC reduced its holdings in NIKE, Inc. (NYSE:NKE – Free Report) by 11.6% during the 3rd quarter, according to its most recent filing with the Securities and Exchange Commission (SEC). T Caprock Group LLC reduced its holdings in NIKE, Inc. (NYSE:NKE – Free Report) by 11.6% during the 3rd quarter, according to its most recent filing with the Securities and Exchange Commission (SEC). The fund owned 19,521 shares of the footwear maker’s stock af…"
2024-11-22 14:31:32+00:00,"Stock market today: Nasdaq retreats as Dow, S&P 500 tread water with weekly wins in play US stocks rose on Friday as investors surveyed President-elect Donald Trump's efforts to build his team and bitcoin's (BTC-USD) bid to reach a key milestone.
The S&amp;P 500 (^GSPC) rose 0.3% while  Stocks are retreating but still on track to end a Nvidia-dominated week higher."
2024-11-22 18:40:14+00:00,"Nike's Worst May Nearly Be Over: Analyst Sees CEO Transition And Strategic Fixes Sparking A Turnaround Nike's Worst May Nearly Be Over: Analyst Sees CEO Transition And Strategic Fixes Sparking A Turnaround
Needham analyst Tom Nikic initiated Nike, Inc. (NYSE:NKE) with a Buy rating and a price forecas Needham analyst Tom Nikic initiated Nike, Inc. (NYSE:NKE) with a Buy rating and a price forecast of $84. The analyst suggests that Nike’s worst may nearly be..."
2024-11-26 04:08:57+00:00,"NIKE, Inc. Appoints Treasure Heinle as Executive Vice President and Chief Human Resources Officer Monique Matheson, NIKEs long-tenured Chief HR Officer, will retire after 26 years with the company
Beaverton, Ore.--(ANTARA/Business Wire)-- NIKE, Inc. (NYSE: NKE) today announced a change to its Se - NIKE, Inc. (NYSE: NKE) today announced a change to its Senior Leadership Team (SLT). Treasure Heinle, Chief Talent Officer, will become the company’s new ..."
2024-11-26 10:00:00+00:00,"5 investing trends for 2025—and 15 stocks to help you bet on them Picking stocks is about predicting the future. As investors can tell you, being early to spot a trend and betting on a company poised to ride it can translate to a handsome return. Those who bought A How to play AI, luxury goods, defense, and more. (And while you're at it: Buy gold.)"
2024-11-26 10:28:48+00:00,"NIKE, Inc. (NYSE:NKE) Stock Holdings Lifted by Eagle Asset Management Inc. Eagle Asset Management Inc. increased its position in shares of NIKE, Inc. (NYSE:NKE – Free Report) by 36.2% during the third quarter, according to its most recent Form 13F filing with the Securities Eagle Asset Management Inc. increased its position in shares of NIKE, Inc. (NYSE:NKE – Free Report) by 36.2% during the third quarter, according to its most recent Form 13F filing with the Securities and Exchange Commission (SEC). The firm owned 16,698 shares…"
2024-11-28 09:28:48+00:00,"Penserra Capital Management LLC Lowers Stake in NIKE, Inc. (NYSE:NKE) Penserra Capital Management LLC trimmed its position in NIKE, Inc. (NYSE:NKE – Free Report) by 18.4% during the third quarter, according to the company in its most recent 13F filing with the Securiti Penserra Capital Management LLC trimmed its position in NIKE, Inc. (NYSE:NKE – Free Report) by 18.4% during the third quarter, according to the company in its most recent 13F filing with the Securities and Exchange Commission (SEC). The firm owned 8,224 share…"
2024-11-30 15:42:32+00:00,Gap flags new trend that's a big threat to activewear brands' future The activewear retail sector has been struggling lately due to economic uncertainty and consumers' desire to sport the latest trends that provide both functionality and style. Even the most renowned  The activewear retail sector has been struggling lately due to economic uncertainty and consumers' desire to sport the latest trends that provide both functionality and style. Even the most renowned and successful brands have been through tough financial time…
2024-12-03 15:33:33+00:00,"Dow Jones Falls But Nvidia Nears Buy Point; Tesla Drops, While This AI Stock Soars After Earnings (Live Coverage) The Dow Jones Industrial Average fell in early trades Tuesday while other major indexes were little changed. Apple (AAPL), Meta Platforms (META) and Nvidia (NVDA) hovered near buy points, but Tesla ( Dow Jones stocks fell in early trades Tuesday but the S&P 500 and the Nasdaq were unchanged in the stock market today. Nvidia rose."
2024-12-04 07:00:00+00:00,"NKE FERSA and Nanoprecise revolutionize wind turbine maintenance with their new cutting-edge Condition Monitoring System This strategic partnership introduces an AI-based condition monitoring solution that promises to transform wind farm operations worldwide.
EDMONTON, AB, Dec. 4, 2024 /PRNewswire/ -- To redefine wind This strategic partnership introduces an AI-based condition monitoring solution that promises to transform wind farm operations worldwide. EDMONTON, AB, Dec. 4, 2024 /PRNewswire/ -- To redefine wind turbine maintenance, NKE FERSA, the Austrian-based premium b…"
2024-12-04 07:52:53+00:00,"JPMorgan Chase & Co. Lowers NIKE (NYSE:NKE) Price Target to $73.00 NIKE (NYSE:NKE – Get Free Report) had its target price decreased by equities research analysts at JPMorgan Chase &amp; Co. from $77.00 to $73.00 in a research note issued to investors on Monday,Benzi NIKE (NYSE:NKE – Get Free Report) had its target price decreased by equities research analysts at JPMorgan Chase & Co. from $77.00 to $73.00 in a research note issued to investors on Monday,Benzinga reports. The firm presently has a “neutral” rating on the fo…"
2024-12-05 13:00:18+00:00,"Investors Lose $383.2 Billion On These 10 Giant Losers This Year Everyone wants to talk about their big S&amp;P 500 winners this year. Don't expect to hear much about their losers.
XNOW PLAYINGBeating The Market: How To Find Outperforming StocksBut there are plen Everyone wants to talk about their big S&P 500 winners this year. Don't expect to hear much about their losers."
2024-12-07 13:41:33+00:00,"Dow Jones Stocks: Apple Above Buy Point, Nvidia Reverses Lower With the Dow Jones Industrial Average looking to end the year with solid gains, the best Dow Jones stocks to watch in December 2024 are Apple (AAPL), Nvidia (NVDA), Salesforce (CRM), Sherwin-Williams Apple and Nvidia are among the best Dow Jones stocks in December 2024."
2024-12-07 15:03:31+00:00,"My Top Dow Dividend Stock to Buy Before the End of the Year (and It's Not Even Close) There's no sugarcoating how terribly Nike (NYSE: NKE) has performed in 2024. At the time of this writing, the stock is down a staggering 27.4% compared to a 26.8% gain for the S&amp;P 500. The only w There's no sugarcoating how terribly Nike (NYSE: NKE) has performed in 2024. At the time of this writing, the stock is down a staggering 27.4% compared to a 26.8% gain for the S&P 500. The only worse-performing Dow Jones Industrial Average stock this year is …"
2024-12-09 12:00:00+00:00,"Why Is Lululemon Stock Down 33%? SHANGHAI, CHINA - NOVEMBER 24, 2024 - Customers enter a lululemon store in Shanghai, China, November ... [+] 24, 2024. (Photo credit should read CFOTO/Future Publishing via Getty Images)
CFOTO/Futur After a remarkable FY 2023, Lululemon’s stock faced significant headwinds in 2024, driven by the departure of its Chief Product Officer and changes in consumer behavior."
2024-12-10 15:23:19+00:00,"Nike Is Cheap Despite Recent Challenges In China And Product Design By Grahamites
Summary
<ul> Nike has under-performed due to distribution revamp, product design shifts, and backlash in China, impacting revenue and margins."
2024-12-10 15:23:19+00:00,"Nike Is Cheap Despite Recent Challenges In China And Product Design By Grahamites
Summary
<ul><li>Nike has under-performed due to distribution revamp, product design shifts, and backlash in China, impacting revenue and margins.</li><li>Nikes valuation is low, with  Nike has under-performed due to distribution revamp, product design shifts, and backlash in China, impacting revenue and margins."
2024-12-10 19:16:56+00:00,"Nike Reports After The Close On 12/19 — Options Expire The Next Day According to NextEarningsDate.com, the Nike next earnings date is projected to be 12/19 after the close, with earnings estimates of $0.83/share on $12.47 Billion of revenue.
Looking back, the recent According to NextEarningsDate.com, the Nike next earnings date is projected to be 12/19 after the close"
2024-12-11 17:17:02+00:00,"Nike and NFL renew partnership for 10-year term DALLAS - NIKE, Inc. (NYSE: NKE), a prominent player in the Textiles, Apparel &amp; Luxury Goods industry with a market capitalization of $117 billion, and the National Football League (NFL) have anno Nike and NFL renew partnership for 10-year term"
2024-12-11 17:17:50+00:00,"NIKE, Inc. & NFL Extend Long-Standing Partnership Through 2038 Renewed partnership to emphasize global expansion, player safety and youth football initiatives
DALLAS NIKE, Inc. (NYSE: NKE) and the National Football League (NFL) today announced a landmark 10-yea Renewed partnership to emphasize global expansion, player safety and youth football initiatives DALLAS — NIKE, Inc. (NYSE: NKE) and the National Football League (NFL) today announced a landmark 10-year partnership extension, cementing their commitment to shap…"
2024-12-12 02:28:08+00:00,"NIKE, Inc. & NFL Extend Long-Standing Partnership Through 2038 Renewed partnership to emphasize global expansion, player safety and youth football initiatives
Dallas--(ANTARA/Business Wire)-- NIKE, Inc. (NYSE: NKE) and the National Football League (NFL) today a - NIKE, Inc. (NYSE: NKE) and the National Football League (NFL) today announced a landmark 10-year partnership extension, cementing their commitment to shaping ..."
2024-12-12 07:50:49+00:00,"UBS Group Cuts NIKE (NYSE:NKE) Price Target to $80.00 NIKE (NYSE:NKE – Free Report) had its price objective reduced by UBS Group from $82.00 to $80.00 in a report issued on Monday,Benzinga reports. UBS Group currently has a neutral rating on the footwea NIKE (NYSE:NKE – Free Report) had its price objective reduced by UBS Group from $82.00 to $80.00 in a report issued on Monday,Benzinga reports. UBS Group currently has a neutral rating on the footwear maker’s stock. NKE has been the subject of a number of oth…"
2024-12-15 02:12:00+00:00,"NIKE, Inc. (NKE): A Bull Case Theory  "
2024-12-15 07:33:07+00:00,"NIKE, Inc. (NYSE:NKE) Receives Consensus Rating of “Moderate Buy” from Analysts NIKE, Inc. (NYSE:NKE – Get Free Report) has been given a consensus rating of “Moderate Buy” by the twenty-nine ratings firms that are presently covering the company, Marketbeat reports. Thirteen anal NIKE, Inc. (NYSE:NKE – Get Free Report) has been given a consensus rating of “Moderate Buy” by the twenty-nine ratings firms that are presently covering the company, Marketbeat reports. Thirteen analysts have rated the stock with a hold recommendation and six…"
2024-12-15 08:45:07+00:00,"Morgan Stanley Lowers NIKE (NYSE:NKE) Price Target to $80.00 NIKE (NYSE:NKE – Get Free Report) had its price objective decreased by equities research analysts at Morgan Stanley from $82.00 to $80.00 in a research note issued to investors on Friday,Benzinga rep NIKE (NYSE:NKE – Get Free Report) had its price objective decreased by equities research analysts at Morgan Stanley from $82.00 to $80.00 in a research note issued to investors on Friday,Benzinga reports. The firm currently has an “equal weight” rating on the…"
2024-12-15 10:00:00+00:00,"Micron, Nike, FedEx, and more stocks to watch this week In This Story
The Christmas holiday is fast approaching, and the festive spirit is in full swing as people gear up for celebrations, shopping sprees, and family reunions. While only a few companies  The Christmas holiday is fast approaching, and the festive spirit is in full swing as people gear up for celebrations, shopping sprees, and family reunions. While only a few companies are set to release earnings reports this week, the stock market is bracing …"
2024-12-15 11:39:14+00:00,"Trump Weekly: Trump appoints next FTC chair, looks to shrink bank watchdogs Catch up on the top industries and stocks that were impacted, or were predicted to be impacted, by the comments, actions and policies of President-elect Trump with this weekly recap compiled by The F See the rest of the story here.

thefly.com provides the latest financial news as it breaks. Known as a leader in market intelligence, The Fly's real-time, streaming news feed keeps individual investors, professional money managers, active traders, and corpor…"
2024-12-15 11:39:14+00:00,"Trump Weekly: Trump appoints next FTC chair, looks to shrink bank watchdogs Catch up on the top industries and stocks that were impacted, or were predicted to be impacted, by the comments, actions and policies of President-elect Trump with this weekly recap compiled by The F See the rest of the story here.

thefly.com provides the latest financial news as it breaks. Known as a leader in market intelligence, The Fly's real-time, streaming news feed keeps individual investors, professional money managers, active traders, and corpor…"
2024-12-15 12:45:03+00:00,"The final Fed meeting of 2024 awaits: What to know this week The stock market rally has stalled as the final Federal Reserve meeting of the year approaches.In the past week, the Nasdaq Composite (^IXIC) was the only of the three major indexes to post a weekly  Investors will be closely watching for any hints on how much further the Federal Reserve plans to lower interest rates in 2025."
2024-12-16 10:00:00+00:00,"What's ahead for retail in 2025, according to a former Amazon executive John Rossman was an early Amazon (AMZN) executive who played a key role in launching the Amazon marketplace business, and has served as senior technology advisor at the Gates Foundation and senior in John Rossman was an early Amazon (AMZN) executive who played a key role in launching the Amazon marketplace business, and has served as senior technology advisor at the Gates Foundation and senior innovation adviser at T-Mobile (TMUS).Read more..."
2024-12-16 15:29:12+00:00,"Wells Fargo cuts Nike price target on weak demand Investing.com -- Wells Fargo lowered its price target for Nike Inc (NYSE:NKE) to $92 from $95, warning of continued headwinds for the sportswear giant amid weak direct-to-consumer sales, prolonged or Wells Fargo cuts Nike price target on weak demand"
2024-12-16 16:06:22+00:00,"Stock Market Today: Dow Jones Up As Bitcoin Play Pops; Cathie Wood Loads Up On This AI Stock Amid 48% Plunge The Dow Jones Industrial Average inched up in morning trades Monday, helped by Nike (NKE), while other indexes were mixed. Bitcoin play MicroStrategy (MSTR) rose while famed investor Cathie Wood snap The Dow Jones index was steady on the stock market today. MicroStrategy rose on a Nasdaq move. Cathie Wood bought a plunging AI stock."
2024-12-16 16:47:13+00:00,"Stock Market Today: Dow Jones Up As Bitcoin Play Pops; Cathie Wood Loads Up On This AI Stock Amid 48% Plunge The Dow Jones Industrial Average inched up in morning trades Monday, helped by Nike (NKE), while other indexes were mixed. Bitcoin play MicroStrategy (MSTR) rose while famed investor Cathie Wood snap The Dow Jones Industrial Average inched up in morning trades Monday, helped by Nike (NKE), while other indexes were mixed. Bitcoin play MicroStrategy (MSTR) rose while famed investor Cathie Wood snapped up a plunging artificial intelligence stock. And Super M…"
2024-12-17 01:59:18+00:00,"Dow Jones Futures: Nvidia Triggers Sell Signal As Fed Meeting Looms Dow Jones futures, along with S&amp;P 500 futures and Nasdaq 100 futures, were slightly lower ahead of Tuesday's stock market open.
XNOW PLAYINGNasdaq Takes 20,000 On Poor Breadth; Amphenol, Dutch B Alphabet, Amazon, Apple and Tesla all set record highs Monday."
2024-12-17 07:02:55+00:00,"Deutsche Bank Aktiengesellschaft Lowers NIKE (NYSE:NKE) Price Target to $82.00 NIKE (NYSE:NKE – Free Report) had its price objective cut by Deutsche Bank Aktiengesellschaft from $92.00 to $82.00 in a report issued on Monday morning,Benzinga reports. They currently have a buy ra NIKE (NYSE:NKE – Free Report) had its price objective cut by Deutsche Bank Aktiengesellschaft from $92.00 to $82.00 in a report issued on Monday morning,Benzinga reports. They currently have a buy rating on the footwear maker’s stock. A number of other resear…"
2024-12-17 08:04:50+00:00,"Wells Fargo & Company Cuts NIKE (NYSE:NKE) Price Target to $92.00 NIKE (NYSE:NKE – Free Report) had its price target reduced by Wells Fargo &amp; Company from $95.00 to $92.00 in a research report sent to investors on Monday morning, MarketBeat Ratings reports. The NIKE (NYSE:NKE – Free Report) had its price target reduced by Wells Fargo & Company from $95.00 to $92.00 in a research report sent to investors on Monday morning, MarketBeat Ratings reports. They currently have an overweight rating on the footwear maker’s st…"
2024-12-17 15:56:15+00:00,Dow Jones Falls As These 2025 Risks Loom; Nvidia Dives On Microsoft News The Dow Jones Industrial Average was headed for its ninth-straight loss as blue chips tumbled more than 200 points in morning action Tuesday. Nvidia (NVDA) buckled again over concerns its voltage dev Dow Jones and other indexes fell after retail sales in the stock market today. Nvidia fell further while Tesla soared to another record high.
2024-12-17 21:17:32+00:00,"Jim Cramer on NIKE, Inc. (NKE): ‘It’s Amazing How Much Damage The Previous CEO Did To This Once Unassailable Brand’ We recently compiled a list of the Jim Cramer's Game Plan for This Week: 8 Stocks in Focus. In this article, we are going to take a look at where NIKE, Inc. (NYSE:NKE) stands against the other stocks We recently compiled a list of the Jim Cramer’s Game Plan for This Week: 8 Stocks in Focus. In this article, we are going to take a look at where NIKE, Inc. ..."
2024-12-18 06:05:25+00:00,"Nike Stock Could Rise 2x If It Recovers To Pre-Inflation Shock Highs WUHAN, CHINA - DECEMBER 05: Pedestrians walk past a Nike store featuring a modern design and ... [+] mannequins displaying winter apparel on December 5, 2024, in Wuhan, Hubei Province, China. As the  The company is scheduled to announce its second-quarter earnings on Thursday, 19th December."
2024-12-18 07:32:48+00:00,"Evercore ISI Issues Pessimistic Forecast for NIKE (NYSE:NKE) Stock Price NIKE (NYSE:NKE – Get Free Report) had its price target reduced by equities researchers at Evercore ISI from $105.00 to $97.00 in a report issued on Monday,Benzinga reports. The brokerage currently ha NIKE (NYSE:NKE – Get Free Report) had its price target reduced by equities researchers at Evercore ISI from $105.00 to $97.00 in a report issued on Monday,Benzinga reports. The brokerage currently has an “outperform” rating on the footwear maker’s stock. Ever…"
2024-12-18 07:32:50+00:00,"NIKE (NYSE:NKE) Given New $93.00 Price Target at Telsey Advisory Group NIKE (NYSE:NKE – Get Free Report) had its price target lowered by equities research analysts at Telsey Advisory Group from $96.00 to $93.00 in a research report issued on Monday, Marketbeat.com repor NIKE (NYSE:NKE – Get Free Report) had its price target lowered by equities research analysts at Telsey Advisory Group from $96.00 to $93.00 in a research report issued on Monday, Marketbeat.com reports. The brokerage currently has an “outperform” rating on th…"
2024-12-19 06:38:51+00:00,"Seaport Res Ptn Has Pessimistic Outlook of NIKE Q2 Earnings NIKE, Inc. (NYSE:NKE – Free Report) – Stock analysts at Seaport Res Ptn reduced their Q2 2025 earnings per share estimates for shares of NIKE in a research note issued on Monday, December 16th. Seapo NIKE, Inc. (NYSE:NKE – Free Report) – Stock analysts at Seaport Res Ptn reduced their Q2 2025 earnings per share estimates for shares of NIKE in a research note issued on Monday, December 16th. Seaport Res Ptn analyst M. Kummetz now forecasts that the footwea…"
2024-12-19 15:15:00+00:00,"The Dow rebounds 300 Points as Nvidia and Tesla surge In This Story
The Dow staged a rebound Thursday morning, following Wednesdays 1,100-point plunge that marked its longest losing streak since 1974. The upturn came despite investor disappointment ove The Dow staged a rebound Thursday morning, following Wednesday’s 1,100-point plunge that marked its longest losing streak since 1974. The upturn came despite investor disappointment over the Federal Reserve’s conservative approach to rate cuts. Other major in…"
2024-12-19 15:39:56+00:00,"Nike Earnings Preview: Is NKE Stock a Buy for 2025? Jump-Start Your Search For Promising Trade Ideas With Barchart Premiers ""Top Stock Pick"".FREE 30 Day Trial- Market Pulse-- Options Market Overview- Unusual Options Activity- IV Rank and IV Percentile Jump-Start Your Search For Promising Trade Ideas With Barchart Premier’s ""Top Stock Pick"".
FREE 30 Day Trial
- Market Pulse
-
- Options Market Overview
- Unusual Options Activity
- IV Rank and IV Percentile
- Implied vs Realized Vol
- Most Active Options
- Hi…"
2024-12-19 15:39:56+00:00,"Nike Earnings Preview: Is NKE Stock a Buy for 2025? Jump-Start Your Search For Promising Trade Ideas With Barchart Premiers ""Top Stock Pick"".FREE 30 Day Trial- Market Pulse-- Options Market Overview- Unusual Options Activity- IV Rank and IV Percentile Jump-Start Your Search For Promising Trade Ideas With Barchart Premier’s ""Top Stock Pick"".
FREE 30 Day Trial
- Market Pulse
-
- Options Market Overview
- Unusual Options Activity
- IV Rank and IV Percentile
- Implied vs Realized Vol
- Most Active Options
- Hi…"
2024-12-19 21:17:27+00:00,"Nike earnings beat by $0.13, revenue topped estimates Investing.com - Nike (NYSE: NKE) reported second quarter EPS of $0.78, $0.13 better than the analyst estimate of $0.65. Revenue for the quarter came in at $12.4B versus the consensus estimate of $12. Nike earnings beat by $0.13, revenue topped estimates"
2024-12-19 21:44:20+00:00,"Nike posts smaller fall in second-quarter sales as newer launches drive demand Nike NKE-N posted a smaller-than-expected drop in second-quarter revenue on Thursday, as the embattled sportswear brands release of newer versions of performance and running shoes drew customers to i Nike NKE-N posted a smaller-than-expected drop in second-quarter revenue on Thursday, as the embattled sportswear brand’s release of newer versions of performance and running shoes drew customers to its stores and website.
Shares of the company were up 11% in…"
2024-12-19 21:44:20+00:00,"Nike posts smaller fall in second-quarter sales as newer launches drive demand Nike NKE-N posted a smaller-than-expected drop in second-quarter revenue on Thursday, as the embattled sportswear brands release of newer versions of performance and running shoes drew customers to i Nike NKE-N posted a smaller-than-expected drop in second-quarter revenue on Thursday, as the embattled sportswear brand’s release of newer versions of performance and running shoes drew customers to its stores and website.
Shares of the company were up 11% in…"
2024-12-19 21:46:00+00:00,"Nike stock pops 9% as its new CEO starts with an earnings beat In This Story
Nike (NKE+0.26%
) appears to be find its footing under new CEO Elliott Hill, reporting second-quarter earnings on Thursday that were better than feared. Shares jumped over 9% in after Nike (NKE) appears to be find its footing under new CEO Elliott Hill, reporting second-quarter earnings on Thursday that were better than feared. Shares jumped over 9% in after-hours trading, offering a glimmer of hope after Nike’s had stock dropped 27% so fa…"
2024-12-19 23:32:22+00:00,"Nike CEO Elliott Hill: Our turnaround will be challenging and will hinge on sports Nike (NKE) is taking a step in the right direction under new CEO Elliott Hill.
The footwear brand posted its fiscal second quarter earnings on Thursday after market close. Its revenue of $12.35 bill Nike is slowly moving in the right direction by going back to the basics."
2024-12-20 03:15:25+00:00,"Q2 2025 Earnings Call Transcript Image source: The Motley Fool.Nike (NYSE: NKE)Q2 2025 Earnings CallDec 19, 2024, 5:00 p.m. ETContents:Prepared RemarksQuestions and AnswersCall ParticipantsPrepared Remarks:OperatorGood afternoon, ev Image source: The Motley Fool.
Nike (NYSE: NKE)
Q2 2025 Earnings Call
Dec 19, 2024, 5:00 p.m. ET
Contents:
Prepared Remarks
Questions and Answers
Call Participants
Prepared Remarks:
Operator
Good afternoon, everyone. Welcome to NIKE, Inc.'s fiscal 2025 second…"
2024-12-20 03:15:25+00:00,"Q2 2025 Earnings Call Transcript Image source: The Motley Fool.Nike (NYSE: NKE)Q2 2025 Earnings CallDec 19, 2024, 5:00 p.m. ETContents:Prepared RemarksQuestions and AnswersCall ParticipantsPrepared Remarks:OperatorGood afternoon, ev Image source: The Motley Fool.
Nike (NYSE: NKE)
Q2 2025 Earnings Call
Dec 19, 2024, 5:00 p.m. ET
Contents:
Prepared Remarks
Questions and Answers
Call Participants
Prepared Remarks:
Operator
Good afternoon, everyone. Welcome to NIKE, Inc.'s fiscal 2025 second…"
