publishedAt,title
2024-11-26 15:27:05+00:00,"Woodward Scores Breakout On Record Report; Musk Taunts F-35 Makers Defense parts and energy control systems manufacturer Woodward broke out after posting record results for 2024 and hiked its guidance. Meanwhile, other defense stocks look to rebound after taking soc Defense supplier Woodward rallied, set for a breakaway gap on earnings. F-35 contracts continue sliding after Elon Musk posts."
2024-11-27 12:00:51+00:00,"2 bullish charts showing how Block is breaking out post-election Listen and subscribe to Stocks in Translation on Apple Podcasts, Spotify, or wherever you find your favorite podcasts.
Stocks roared last week, with small caps resuming and leading the post-election Technical patterns don't only measure prices, they measure belief."
2024-11-27 21:09:19+00:00,"Dow Jones Slides, Nvidia Falters As Trump Rally Sputters; Warren Buffett's Berkshire Hits All-Time High (Live Coverage) The Dow Jones Industrial Average and other major indexes reversed lower Wednesday as the postelection Trump rally sputtered ahead of the Thanksgiving holiday. Indexes fell in the stock market today a The Dow Jones and other indexes were down Wednesday after October's inflation data. Nvidia broke a key level on the stock market today."
2024-11-29 20:00:20+00:00,"No. 1 Tesla Rival Prepares For Sharper Price War; EV Sales Due Tesla (TSLA) rivals in China prepare to report November EV sales. Archrival BYD (BYDDF) signaled a brutal two-year electric-vehicle price war won't let up in 2025.
The Chinese EV giant is likely to  China car firms to report EV sales on Sunday after debuting cheap new models."
2024-11-30 16:09:00+00:00,"‘I’ve nothing saved for retirement’: I’m 50 and earn $45,000. I don’t have a 401(k) match. Should I put 10% of my salary in a Roth IRA instead? I have the 40 credits needed to draw Social Security. (Photo subject is a model.) - Getty/iStockphoto
I am 50 years old and for the majority of my life I have worked construction and manual-labor jo “I currently have $36,000 in student-loan debt in forbearance in the SAVE program.”"
2024-12-02 13:18:00+00:00,"5 companies that own the most Bitcoin Yahoo is using AI to generate takeaways from this article. This means the info may not always match what's in the article. Reporting mistakes helps us improve the experience.Generate Key Takeaways
B Bitcoin has evolved into a powerful financial instrument, garnering attention not only from everyday individuals but also from major corporations. Over the..."
2024-12-02 13:37:00+00:00,"Jeff Bezos is betting millions on a Nvidia rival Yahoo is using AI to generate takeaways from this article. This means the info may not always match what's in the article. Reporting mistakes helps us improve the experience.Generate Key Takeaways
B Billionaire Jeff Bezos is throwing his weight behind a computing company that’s coming for Nvidia’s (NVDA) dominance of the artificial intelligence chip..."
2024-12-02 21:04:50+00:00,"Tesla Rolls Out 'New Brain' Amid 40% Tear On Hopes Trump Will Clear Path For Self Driving Tesla (TSLA) stock angled higher early Monday as the EV giant began rolling out its latest Full Self-Driving, or FSD, upgrade over the weekend to employees and limited outside customers. TSLA shares  Tesla stock is consolidating near highs and has rallied more than 40% since Donald Trump won the presidential election on self-driving optimism."
2024-12-02 21:56:08+00:00,"Delaware judge rejects request to restore Musk's $56 billion Tesla pay By Tom Hals
WILMINGTON, Delaware (Reuters) -A Delaware judge ruled on Monday that Tesla (TSLA) CEO Elon Musk still is not entitled to receive a $56 billion compensation package despite shareholders  WILMINGTON, Delaware (Reuters) -A Delaware judge ruled on Monday that Tesla CEO Elon Musk still is not entitled to receive a $56 billion compensation package..."
2024-12-02 22:22:51+00:00,"Delaware judge rejects request to restore Musk's $56 billion Tesla pay In This Article:By Tom HalsWILMINGTON, Delaware (Reuters) -A Delaware judge ruled on Monday that Tesla (TSLA) CEO Elon Musk still is not entitled to receive a $56 billion compensation package despite In This Article:
By Tom Hals
WILMINGTON, Delaware (Reuters) -A Delaware judge ruled on Monday that Tesla (TSLA) CEO Elon Musk still is not entitled to receive a $56 billion compensation package despite shareholders of the electric vehicle company voting to re…"
2024-12-02 23:15:00+00:00,"Elon Musk's $56 billion pay package is rejected In This Story
Elon Musks $56 billion pay package was rejected by a Delaware judge on Monday after a motion to revise was denied. The ruling follows a legal challenge against the 2018 compensation pl Elon Musk’s $56 billion pay package was rejected by a Delaware judge on Monday after a motion to revise was denied. The ruling follows a legal challenge against the 2018 compensation plan, which Tesla (TSLA) shareholders initially contested, claiming it was i…"
2024-12-03 11:56:55+00:00,"Stock market today: S&P 500, Nasdaq futures hold just short of records with JOLTS on deck US stock futures drifted near all-time highs on Tuesday as investors waited for fresh jobs data and Fedspeak to cement or dent growing hopes for interest-rate cuts.
Futures on the S&amp;P 500 (ES=F) The focus is on JOLTS jobs data and Fedspeak to cement or dent growing hopes for interest-rate cuts."
2024-12-03 12:58:00+00:00,"Elon Musk's SpaceX is considering a tender offer at a huge valuation In This Story
Elon Musks SpaceX is eyeing a tender offer that would value the aerospace company at $350 billion
Bloomberg, citing unnamed sources familiar with the discussions, reports that discuss Elon Musk’s SpaceX is eyeing a tender offer that would value the aerospace company at $350 billionRead more..."
2024-12-03 13:29:00+00:00,"Tesla is ready to fight for Elon Musk's $56 billion payout In This Story
Tesla (TSLA+3.35%
) is ready to appeal a Delaware judges decision to again reject CEO Elon Musks $56 billion pay package despite shareholder support.
Musks compensation was first app Tesla (TSLA) is ready to appeal a Delaware judge’s decision to — again — reject CEO Elon Musk’s $56 billion pay package despite shareholder support.Read more..."
2024-12-03 14:15:41+00:00,"Is APH Stock A Winner Over Corning? UKRAINE - 2021/10/06: In this photo illustration Amphenol Corporation logo seen displayed on a ... [+] smartphone and in the background. (Photo Illustration by Igor Golovniov/SOPA Images/LightRocket  We believe that Amphenol stock (NYSE: APH), an electrical, electronic, and fiber optic connectors maker, is currently a better pick than its industry peer, Corning sto..."
2024-12-03 14:35:48+00:00,"Stock market today: S&P 500, Nasdaq drift near record levels with JOLTS data on deck US stocks drifted near all-time highs on Tuesday as investors waited for fresh jobs data and Fedspeak to cement or dent growing hopes for future interest rate cuts.
The S&amp;P 500 (^GSPC) and the t The focus is on JOLTS jobs data and Fedspeak to cement or dent growing hopes for interest-rate cuts."
2024-12-03 15:03:14+00:00,"Dow Jones Falls After Jobs Data; Tesla Slides On Elon Musk Pay Package Rejection The Dow Jones Industrial Average and other major indexes Tuesday traded mixed as Wall Street reacted to the morning's employment data. Tesla (TSLA) was an early loser after a Delaware judge rejected  Key earnings movers include Credo and Zscaler, while Tesla skidded."
2024-12-03 15:33:33+00:00,"Dow Jones Falls But Nvidia Nears Buy Point; Tesla Drops, While This AI Stock Soars After Earnings (Live Coverage) The Dow Jones Industrial Average fell in early trades Tuesday while other major indexes were little changed. Apple (AAPL), Meta Platforms (META) and Nvidia (NVDA) hovered near buy points, but Tesla ( Dow Jones stocks fell in early trades Tuesday but the S&P 500 and the Nasdaq were unchanged in the stock market today. Nvidia rose."
2024-12-03 16:23:05+00:00,"Stock market today: Nasdaq drifts near records while S&P 500, Dow fall following key jobs data US stocks traded mixed on Tuesday as investors digested fresh jobs data and waited for new Fedspeak to cement or dent growing hopes for future interest rate cuts.
The S&amp;P 500 (^GSPC) fell about  The focus is on JOLTS jobs data and Fedspeak will cement or dent growing hopes for interest rate cuts."
2024-12-03 16:23:05+00:00,"Stock market today: Dow, S&P 500 slip after key jobs data shows surprise rebound in openings US stocks traded mixed on Tuesday as investors digested fresh jobs data and waited for new Fedspeak to cement or dent growing hopes for future interest rate cuts.
The S&amp;P 500 (^GSPC) fell about  The focus is on JOLTS jobs data and Fedspeak will cement or dent growing hopes for interest rate cuts."
2024-12-03 18:51:22+00:00,"Tesla, Inc. (TSLA) Upgraded by Roth MKM Amid AI-Driven Innovations and Market Optimism  "
2024-12-03 19:25:00+00:00,"Meta CEO Mark Zuckerberg wants an 'active role' in Trump administration tech policies In This Story
With Tesla (TSLA-2.20%
) and SpaceX chief executive Elon Musk solidifying his role in the incoming Donald Trump administration, another tech leader is looking to stay in the president With Tesla (TSLA) and SpaceX chief executive Elon Musk solidifying his role in the incoming Donald Trump administration, another tech leader is looking to stay in the president-elect’s good graces.Read more..."
2024-12-03 19:56:24+00:00,"Elon Musk pay defeat sets up a 2025 legal battle that could reach the Supreme Court Tesla (TSLA) has made it clear that its willing to go the distance to reinstate CEO Elon Musks $56 billion pay package.
Just hours after Delawares top Chancery Court judge, Chancellor Kathaleen McCo Tesla pledged to keep fighting for Elon Musk's $65 billion pay to be restored, a battle that could make it all the way to the highest US court."
2024-12-04 08:23:22+00:00,"The Nasdaq and S&P hit record highs on driven by tech gains Driven by a continued boost in technology sector shares, the S&amp;P 500 and Nasdaq composite ended Tuesday at record levels. The Nasdaq added 0.44%, and the S&amp;P 500 was also up 0.40%, like other Salesforce and Amazon Boost Nasdaq While Tesla Faces China Headwinds"
2024-12-04 14:56:25+00:00,"Pick This Drone Maker Over AXON Stock? DORTMUND, GERMANY - JANUARY 15: A police officer demonstrates the handling of an Taser on January ... [+] 15, 2021 in Dortmund, Germany. Police in North Rhine-Westphalia will begin using the Axon Tas We think this gap in valuation will narrow in favor of AeroVironment in the coming years."
2024-12-04 17:20:13+00:00,"Shift4 Chief Executive Tapped To Head NASA. Shares Fall. Shares in Shift4 Payments (FOUR) fell Wednesday after President-elect Donald Trump tapped its founder and Chief Executive, Jared Isaacman, to lead NASA. Shift4 stock has gained 47% in 2024.
Isaacman Shares in Shift4 Payments fell after President-elect Donald Trump tapped its chief executive, Jared Isaacman, to lead NASA."
2024-12-05 12:09:00+00:00,"This analyst talked of $100,000 bitcoin a decade ago — here’s what he says now Well, bitcoin has finally crossed $100,000, not bad for an asset whose underlying value is no different to imaginary rainbow unicorns. Granted, that unicorn has fans at the highest levels of official There’s a 2% chance bitcoin can become all of money, which would then value the cryptocurrency at $5 million, analyst says"
2024-12-05 18:20:00+00:00,"Elon Musk's DOGE has some Democratic friends on Capitol Hill In This Story
Tesla (TSLA+3.37%
) CEO Elon Musks pledge to slash trillions of dollars in government spending has found some helping hands from Democrats some being the keyword.
President-elect Don Tesla (TSLA) CEO Elon Musk’s pledge to slash trillions of dollars in government spending has found some helping hands from Democrats — some being the keyword.Read more..."
2024-12-05 19:01:00+00:00,"Boeing's 737 Max plea deal was struck down for having too much DEI In This Story
Boeing (BA-1.00%
) suffered a major legal setback Thursday when a federal judge struck down the plea agreement that the company had hoped would bring a major piece of litigation to a  Boeing (BA) suffered a major legal setback Thursday when a federal judge struck down the plea agreement that the company had hoped would bring a major piece of litigation to a close. Read more..."
2024-12-05 19:27:43+00:00,"5 Top Stocks To Buy In December 2024 getty
Many investors use this time of year to refresh their portfolios. Despite recent market volatility, several established companies present compelling investment opportunities, combining robust  Looking for the latest stock opportunities in December 2024? We have you covered. Click to read our top stock picks to consider adding to your portfolio now."
2024-12-05 20:53:08+00:00,"Jim Cramer on Tesla, Inc. (TSLA) CEO Elon Musk: ‘He May Be The Most Important Man In America For All I Know, As Long As He Stays Tight With Trump’  "
2024-12-05 21:20:12+00:00,"Is Tesla Stock A Buy Or A Sell After Analyst Hikes Price Target; 'Optimus Is Real' Tesla (TSLA) is on a 40% tear since Donald Trump's election win, as investors speculate that self-driving is coming soon, with the Trump administration easing the regulatory path for autonomous vehic Tesla stock has rallied 40% since Donald Trump won the presidential election."
2024-12-06 10:00:00+00:00,"Musk's DOGE allies, Bezos and Altman stand tall, and Biden's AI chip war isn't over: Politics news roundup Elon Musk is finding some tentative allies on Capitol Hill as he looks to advance his cost-cutting agenda. But his growing influence and penchant for revenge apparently isnt scaring Amazon (AMZN) fou Elon Musk is finding some tentative allies on Capitol Hill as he looks to advance his cost-cutting agenda. But his growing influence — and penchant for..."
2024-12-06 12:00:43+00:00,"Pick ZS Stock Over F5? UKRAINE - 2021/02/23: In this photo illustration, Zscaler logo of US cloud-based information ... [+] security company is seen displayed on a smartphone and pc screen. (Photo Illustration by Pavlo Gon Overall, the performance of FFIV and ZS stocks with respect to the index has been far from consistent."
2024-12-06 13:20:00+00:00,"Trump taps Elon Musk's ally and venture capitalist David Sacks as AI and crypto czar In This Story
President-elect Donald Trump has named David Sacks as the White Houses artificial intelligence and cryptocurrency czar, giving the venture capitalist and vocal Republican donor influen President-elect Donald Trump has named David Sacks as the White House’s artificial intelligence and cryptocurrency czar, giving the venture capitalist and vocal Republican donor influence over his administration’s policies.Read more..."
2024-12-06 13:52:08+00:00,"Uber Launches First International Robotaxis, Shares Regain Some Ground Uber Technologies (UBER) said Friday it is now offering autonomous vehicles on its app in Abu Dhabi through a partnership with China mobility company WeRide (WRD). Uber stock regained some ground in  Uber stock gained after launching robotaxis in Abu Dhabi, in partnership with WeRide. Shares lost 10% on Waymo expansion news a day earlier."
2024-12-06 17:13:29+00:00,"Top industrial CEOs warn Trump's tariff and budget plans could slow growth, increase consumer prices President-elect Donald Trumps policy agenda is generally good for business, top executives and analysts told me at the Goldman Sachs Industrial and Materials conference this week.
Its very bullish,  Business leaders warn of risks from inflationary tariffs and potential budget cuts at Goldman Sachs' Industrial and Materials conference."
2024-12-06 17:22:14+00:00,"8 Stocks Drive 50% Of The Year's $11.8 Trillion Stock Gain You already know about the Magnificent Seven stocks driving the S&amp;P 500. But what about the Elite Eight?
Eight stocks in the S&amp;P 500 including of course Nvidia (NVDA) and Amazon.com (AMZN) b You already know about the Magnificent Seven stocks driving the S&P 500. But what about the elite eight doing most of the work?"
2024-12-07 00:10:38+00:00,"Dow Jones Futures: Nasdaq Runs Toward 20,000 But These Risks Are Mounting Dow Jones futures will open Sunday evening, along with S&amp;P 500 futures and Nasdaq futures.
The stock market rally had a mixed week, but all the major indexes hit fresh highs at one point amid ge The index is starting to look stretched. Four tech titans are flashing buy signals."
2024-12-07 12:34:39+00:00,"Jobs Report: Implications For The Markets And The Fed Job growth bounced back after the hurricanes and strike impacted October data, but not enough to ... [+] relieve all worry about a softening labor market.
getty
The November jobs report on Friday w The solid jobs report had enough cracks to cause the Fed to want some insurance against economic downside risks by cutting rates. The coming CPI report is significant."
2024-12-07 17:52:43+00:00,"What Is Tesla, Inc. (TSLA) The Best Lithium and Battery Stocks to Buy Now? We recently compiled a list of the 11 Best Lithium and Battery Stocks To Invest In. In this article, we are going to take a look at where Tesla, Inc. (NASDAQ:TSLA) stands against the other lithium an We recently compiled a list of the 11 Best Lithium and Battery Stocks To Invest In. In this article, we are going to take a look at where Tesla, Inc..."
2024-12-07 18:11:28+00:00,"While Equities Set Records, Employment Trends, Retail Sales Expectations And Rising Delinquencies Advise Caution Financial markets waited all week for the jobs data, and that data did not disappoint. Like in the Goldilocks tale, the jobs numbers werent too hot, nor too cold. They were just right! As a result, t Financial markets waited all week for the jobs data, and that data did not disappoint. As a result, the S&P 500 and the Nasdaq both closed a record high on Friday."
2024-12-08 10:00:00+00:00,"Microsoft's shareholders will decide this week whether to invest in Bitcoin In This Story
While Bitcoin has achieved a historic milestone of $100,000 and garnered support from prominent leaders like President-elect Donald Trump and Russian President Vladimir Putin, Microsof While Bitcoin has achieved a historic milestone of $100,000 and garnered support from prominent leaders like President-elect Donald Trump and Russian President Vladimir Putin, Microsoft (MSFT) has yet to decide whether to invest in the cryptocurrency. The tec…"
2024-12-09 01:09:35+00:00,"How Networks Of Competence Are Crushing Hierarchies Of Authority Hierarchies of authority vs networks of competence
Stephen Denning
Around 2016, Amazon created a team to build an app for all its drivers that would integrate all of the information about delivery  Firms run as networks of competence tend to grow faster and have higher staff engagement then firms run as hierarchies of authority"
2024-12-09 12:37:38+00:00,"Dow Jones Futures: Techs Fall As China Probes Nvidia; Beware These Risks Dow Jones futures were flat Monday morning, while S&amp;P 500 futures and Nasdaq futures fell slightly.
The stock market rally had a mixed week, but all the major indexes hit fresh highs at one poin The Nasdaq is getting stretched. Nvidia fell on a China monopoly probe."
2024-12-09 16:34:00+00:00,"Xiaomi's newest Tesla-rivaling EV will launch next summer In This Story
Chinese consumer electronics maker Xiaomi is ready to launch an electric SUV next year as a follow-up on the smashing success of its first vehicle, the SU7.
The firm expects to launch Chinese consumer electronics maker Xiaomi is ready to launch an electric SUV next year as a follow-up on the smashing success of its first vehicle, the SU7.Read more..."
2024-12-09 16:42:04+00:00,"Amazon should buy Bitcoin, shareholders say In This Story
Shareholders of Amazon (AMZN+0.99%
) have submitted a proposal to add Bitcoin to the balance sheet. The shareholders of the e-commerce giant are urging the company to learn from Micro Shareholders of Amazon (AMZN) have submitted a proposal to add Bitcoin to the balance sheet. The shareholders of the e-commerce giant are urging the company to learn from MicroStrategy (MSTR), which heavily invested in Bitcoin, resulting in an increase in its…"
2024-12-09 21:02:03+00:00,"Tesla Stock Heads Toward 400 For First Time Since 2022 Tesla (TSLA) stock jumped early Monday, attempting to add to a nearly 13% gain last week, as the EV giant eyes a level it hasn't reached since early 2022.
TSLA shares angled higher, hitting 404.80 e Tesla stock jumped around 13% last week as it eyes an advance to 400, a level it hasn't hit since early in 2022."
2024-12-09 21:13:33+00:00,"Why Tesla (TSLA) Is Among the Best Autonomous Driving Stocks to Buy According to Hedge Funds We recently compiled a list of the 10 Best Autonomous Driving Stocks To Buy According to Hedge Funds. In this article, we are going to take a look at where Tesla, Inc. (NASDAQ:TSLA) stands against th We recently compiled a list of the 10 Best Autonomous Driving Stocks To Buy According to Hedge Funds. In this article, we are going to take a look at where..."
2024-12-09 21:23:08+00:00,Stocks Finish Near Day's Lows Amid Nvidia's Bad Day; Amazon Streak Ends As Hershey Sweetens (Live Coverage) The Dow Jones Industrial Average and the other major indexes finished trading near the day's lows weakened in the final hour of trading Monday. Amazon.com's (AMZN) winning streak came to an end while The Dow Jones and S&P 500 were little changed Monday. Nvidia stock sank on a China probe while Palantir popped on the stock market today.
2024-12-09 21:46:09+00:00,"Ways To Invest In Tesla Beyond Buying TSLA Stock © 2024 Bloomberg Finance LP
Tesla (TSLA) is one of the most closely followed and debated stocks. Thats what happens when you create a new industry (electric vehicles) and trade in a price range from Looking for ways to invest in Tesla without actually buying TSLA stock? Check out these 7 ways to give your portfolio exposure to the electric vechicle maker."
2024-12-10 01:56:55+00:00,"Dow Jones Futures: AppLovin, Cava, MicroStrategy, Palantir Dive; Nvidia Falls To Support Level Dow Jones futures, along with S&amp;P 500 futures and Nasdaq 100 futures, were slightly lower ahead of Tuesday's stock market open.
XNOW PLAYINGGrowth Leaders Slammed As China Stocks Surge; ATAT, EB AppLovin, Cava, MicroStrategy and Palantir dived, while Nvidia pulled back to a key level."
2024-12-10 09:00:00+00:00,"Salesforce vs. Oracle Stock The Salesforce logo appears on the screen of a smartphone in Reno, United States, on November 29, ... [+] 2024. (Photo by Jaque Silva/NurPhoto via Getty Images)
NurPhoto via Getty Images
Given its  Given its better valuation, we believe that Salesforce stock (NYSE: CRM) is currently a better pick over its peer, Oracle stock."
2024-12-10 12:00:03+00:00,"How to play the Mag 7 stocks in 2025: Portfolio manager The ""Magnificent Seven"" made up of Nvidia (NVDA), Alphabet (GOOG, GOOGL), Tesla (TSLA), Microsoft (MSFT), Amazon (AMZN), Meta Platforms (META), and Apple (AAPL) drove major indexes (^DJI, ^IXIC, ^GSP The ""Magnificent Seven"" — made up of Nvidia (NVDA), Alphabet (GOOG, GOOGL), Tesla (TSLA), Microsoft (MSFT), Amazon (AMZN), Meta Platforms (META), and Apple (..."
2024-12-10 13:14:50+00:00,"Tesla China Demand Hot; Key Analyst Raises Price Target But It's Not On Deliveries Tesla (TSLA) vehicle insurance registrations in China surged sequentially last week, marking one of the company's highest weekly totals ever in the key EV market as demand in China continues to rebou Tesla vehicle insurance registrations in China surged sequentially last week, marking one of the company's highest weekly totals ever in the key EV market as demand in China continues to rebound. Meanwhile, a top analyst increased his Tesla stock price target…"
2024-12-10 15:06:29+00:00,"Sell LULU Stock, Buy EBAY? The logo of e-commerce company Ebay is pictured at an exhibition booth for vehicle parts at the ... [+] Essen Motor Show in Essen, western Germany on December 4, 2024. (Photo by Ina FASSBENDER / AFP) There is more to the comparison, and in the sections below, we discuss why we think EBAY will outperform LULU in the next three years."
2024-12-10 17:20:00+00:00,"Microsoft shareholders vote against Bitcoin investment In This Story
Microsoft (MSFT+0.23%
) shareholders voted against adding Bitcoin to the companys balance sheet on Tuesday.
The decision follows the boards recommendation to vote against the proposa The shareholders of one of the world's most valuable companies voted against adding the top cryptocurrency to the balance sheet"
2024-12-10 21:18:29+00:00,Dow Jones Falls As Nvidia Breaks Key Level On Taiwan Semi Report (Live Coverage) The Dow Jones Industrial Average and other major indexes fell to close Tuesday's trading session. Nvidia (NVDA) fell after investors were disappointed by a sales report from chip supplier Taiwan Semi Dow Jones fell in the stock market today. Nvidia rose from a key level of support. Tesla got a boost from an analyst upgrade.
2024-12-11 12:16:27+00:00,"Why Is Tesla (TSLA) the Best Self-Driving Technology Stock to Buy According to Hedge Funds? The autonomous driving industry is, along with machine learning and image processing, one of the earliest adopters of artificial intelligence. While the post-2022 hype surrounding AI has led to the t We recently published a list of 10 Best Self-Driving Technology Stocks To Buy According to Hedge Funds. In this article, we are going to take a look at where..."
