publishedAt,title
2024-11-21 15:00:13+00:00,"'Finally Able to Retire' – Dividend Investor Earning $5,130 Per Month on $622K Investment Shares Portfolio: Top 9 Stocks, ETFs Benzinga and Yahoo Finance LLC may earn commission or revenue on some items through the links below.Millions of young Americans are forging unconventional paths to early retirement amid a growing des Millions of young Americans are forging unconventional paths to early retirement amid a growing desire for financial freedom and greater flexibility in..."
2024-11-22 21:50:00+00:00,"Relative Strength Line: Good Guide For Buys And Sells In Postelection Bump The past week saw some spectacular moves with plenty of stocks garnering investors' attention. But you only have so much room in your portfolio. How do you know what's deserving of a coveted spot as  Besides price, the relative strength line can be one of your best indicators of whether you stay in your positions or move on to others."
2024-11-25 11:35:39+00:00,"Tesla’s $350 billion stock surge driven by ‘animal spirits,’ UBS says (Bloomberg) Tesla Inc.s (TSLA) post-election stock surge has more to do with market exuberance than actual improvement in the fundamentals of its business, UBS Group AG analysts cautioned in a report (Bloomberg) -- Tesla Inc.’s post-election stock surge has more to do with market exuberance than actual improvement in the fundamentals of its business, UBS ..."
2024-11-25 13:30:08+00:00,"Dow Jones Futures Rallies 300 Points As Tesla Nears New High; Bitcoin Stock MicroStrategy Jumps The Dow Jones Industrial Average and other major stock indexes traded higher Monday, as Tesla (TSLA) rallied near a new high. Another gainer was bitcoin stock MicroStrategy (MSTR), which continued to Key earnings reports this week include Burlington Stores and CrowdStrike."
2024-11-25 17:45:34+00:00,"Tesla stock could drop 35% as the Trump-fueled rally isn't supported by business fundamentals, UBS says Tesla shares could be poised for a double-digit correction, as the car company's fundamentals don't support the surge in its stock price since the election, UBS analysts said.
In a note on Monday, t Tesla shares have rallied sharply since the election, though its valuation implies growth far beyond what Wall Street is forecasting, UBS analysts said."
2024-11-25 21:00:43+00:00,Stock market today: Dow leaps 400 points to fresh high as Wall Street cheers Trump's pick of Scott Bessent US stocks rose on Monday as small caps rallied near new highs and the Dow Jones Industrial Average (^DJI) rose more than 400 points amid a broad sense of optimism over President-elect Donald Trump's  Trump's choice of Scott Bessent for Treasury secretary is buoying spirits at the start of a holiday-shortened week.
2024-11-26 00:17:21+00:00,"Dow Jones Futures Fall: Nvidia Stock Tumbles To Key Level; Fed Inflation Data Looms Dow Jones futures, along with S&amp;P 500 futures and Nasdaq 100 futures, were lower ahead of Tuesday's stock market open, as Nvidia (NVDA) sold off for a second straight session, while the Federal R Tesla reversed lower after hitting a new high, while Apple is nearing a buy point."
2024-11-26 15:27:05+00:00,"Woodward Scores Breakout On Record Report; Musk Taunts F-35 Makers Defense parts and energy control systems manufacturer Woodward broke out after posting record results for 2024 and hiked its guidance. Meanwhile, other defense stocks look to rebound after taking soc Defense supplier Woodward rallied, set for a breakaway gap on earnings. F-35 contracts continue sliding after Elon Musk posts."
2024-11-27 12:00:51+00:00,"2 bullish charts showing how Block is breaking out post-election Listen and subscribe to Stocks in Translation on Apple Podcasts, Spotify, or wherever you find your favorite podcasts.
Stocks roared last week, with small caps resuming and leading the post-election Technical patterns don't only measure prices, they measure belief."
2024-11-27 21:09:19+00:00,"Dow Jones Slides, Nvidia Falters As Trump Rally Sputters; Warren Buffett's Berkshire Hits All-Time High (Live Coverage) The Dow Jones Industrial Average and other major indexes reversed lower Wednesday as the postelection Trump rally sputtered ahead of the Thanksgiving holiday. Indexes fell in the stock market today a The Dow Jones and other indexes were down Wednesday after October's inflation data. Nvidia broke a key level on the stock market today."
2024-11-29 20:00:20+00:00,"No. 1 Tesla Rival Prepares For Sharper Price War; EV Sales Due Tesla (TSLA) rivals in China prepare to report November EV sales. Archrival BYD (BYDDF) signaled a brutal two-year electric-vehicle price war won't let up in 2025.
The Chinese EV giant is likely to  China car firms to report EV sales on Sunday after debuting cheap new models."
2024-12-02 13:18:00+00:00,"5 companies that own the most Bitcoin Yahoo is using AI to generate takeaways from this article. This means the info may not always match what's in the article. Reporting mistakes helps us improve the experience.Generate Key Takeaways
B Bitcoin has evolved into a powerful financial instrument, garnering attention not only from everyday individuals but also from major corporations. Over the..."
2024-12-02 13:37:00+00:00,"Jeff Bezos is betting millions on a Nvidia rival Yahoo is using AI to generate takeaways from this article. This means the info may not always match what's in the article. Reporting mistakes helps us improve the experience.Generate Key Takeaways
B Billionaire Jeff Bezos is throwing his weight behind a computing company that’s coming for Nvidia’s (NVDA) dominance of the artificial intelligence chip..."
2024-12-02 21:04:50+00:00,"Tesla Rolls Out 'New Brain' Amid 40% Tear On Hopes Trump Will Clear Path For Self Driving Tesla (TSLA) stock angled higher early Monday as the EV giant began rolling out its latest Full Self-Driving, or FSD, upgrade over the weekend to employees and limited outside customers. TSLA shares  Tesla stock is consolidating near highs and has rallied more than 40% since Donald Trump won the presidential election on self-driving optimism."
2024-12-02 21:56:08+00:00,"Delaware judge rejects request to restore Musk's $56 billion Tesla pay By Tom Hals
WILMINGTON, Delaware (Reuters) -A Delaware judge ruled on Monday that Tesla (TSLA) CEO Elon Musk still is not entitled to receive a $56 billion compensation package despite shareholders  WILMINGTON, Delaware (Reuters) -A Delaware judge ruled on Monday that Tesla CEO Elon Musk still is not entitled to receive a $56 billion compensation package..."
2024-12-03 11:56:55+00:00,"Stock market today: S&P 500, Nasdaq futures hold just short of records with JOLTS on deck US stock futures drifted near all-time highs on Tuesday as investors waited for fresh jobs data and Fedspeak to cement or dent growing hopes for interest-rate cuts.
Futures on the S&amp;P 500 (ES=F) The focus is on JOLTS jobs data and Fedspeak to cement or dent growing hopes for interest-rate cuts."
2024-12-03 14:35:48+00:00,"Stock market today: S&P 500, Nasdaq drift near record levels with JOLTS data on deck US stocks drifted near all-time highs on Tuesday as investors waited for fresh jobs data and Fedspeak to cement or dent growing hopes for future interest rate cuts.
The S&amp;P 500 (^GSPC) and the t The focus is on JOLTS jobs data and Fedspeak to cement or dent growing hopes for interest-rate cuts."
2024-12-03 15:03:14+00:00,"Dow Jones Falls After Jobs Data; Tesla Slides On Elon Musk Pay Package Rejection The Dow Jones Industrial Average and other major indexes Tuesday traded mixed as Wall Street reacted to the morning's employment data. Tesla (TSLA) was an early loser after a Delaware judge rejected  Key earnings movers include Credo and Zscaler, while Tesla skidded."
2024-12-03 15:33:33+00:00,"Dow Jones Falls But Nvidia Nears Buy Point; Tesla Drops, While This AI Stock Soars After Earnings (Live Coverage) The Dow Jones Industrial Average fell in early trades Tuesday while other major indexes were little changed. Apple (AAPL), Meta Platforms (META) and Nvidia (NVDA) hovered near buy points, but Tesla ( Dow Jones stocks fell in early trades Tuesday but the S&P 500 and the Nasdaq were unchanged in the stock market today. Nvidia rose."
2024-12-03 16:23:05+00:00,"Stock market today: Nasdaq drifts near records while S&P 500, Dow fall following key jobs data US stocks traded mixed on Tuesday as investors digested fresh jobs data and waited for new Fedspeak to cement or dent growing hopes for future interest rate cuts.
The S&amp;P 500 (^GSPC) fell about  The focus is on JOLTS jobs data and Fedspeak will cement or dent growing hopes for interest rate cuts."
2024-12-03 16:23:05+00:00,"Stock market today: Dow, S&P 500 slip after key jobs data shows surprise rebound in openings US stocks traded mixed on Tuesday as investors digested fresh jobs data and waited for new Fedspeak to cement or dent growing hopes for future interest rate cuts.
The S&amp;P 500 (^GSPC) fell about  The focus is on JOLTS jobs data and Fedspeak will cement or dent growing hopes for interest rate cuts."
2024-12-03 18:51:22+00:00,"Tesla, Inc. (TSLA) Upgraded by Roth MKM Amid AI-Driven Innovations and Market Optimism  "
2024-12-03 19:56:24+00:00,"Elon Musk pay defeat sets up a 2025 legal battle that could reach the Supreme Court Tesla (TSLA) has made it clear that its willing to go the distance to reinstate CEO Elon Musks $56 billion pay package.
Just hours after Delawares top Chancery Court judge, Chancellor Kathaleen McCo Tesla pledged to keep fighting for Elon Musk's $65 billion pay to be restored, a battle that could make it all the way to the highest US court."
2024-12-04 08:23:22+00:00,"The Nasdaq and S&P hit record highs on driven by tech gains Driven by a continued boost in technology sector shares, the S&amp;P 500 and Nasdaq composite ended Tuesday at record levels. The Nasdaq added 0.44%, and the S&amp;P 500 was also up 0.40%, like other Salesforce and Amazon Boost Nasdaq While Tesla Faces China Headwinds"
2024-12-04 17:20:13+00:00,"Shift4 Chief Executive Tapped To Head NASA. Shares Fall. Shares in Shift4 Payments (FOUR) fell Wednesday after President-elect Donald Trump tapped its founder and Chief Executive, Jared Isaacman, to lead NASA. Shift4 stock has gained 47% in 2024.
Isaacman Shares in Shift4 Payments fell after President-elect Donald Trump tapped its chief executive, Jared Isaacman, to lead NASA."
2024-12-05 20:53:08+00:00,"Jim Cramer on Tesla, Inc. (TSLA) CEO Elon Musk: ‘He May Be The Most Important Man In America For All I Know, As Long As He Stays Tight With Trump’  "
2024-12-05 21:20:12+00:00,"Is Tesla Stock A Buy Or A Sell After Analyst Hikes Price Target; 'Optimus Is Real' Tesla (TSLA) is on a 40% tear since Donald Trump's election win, as investors speculate that self-driving is coming soon, with the Trump administration easing the regulatory path for autonomous vehic Tesla stock has rallied 40% since Donald Trump won the presidential election."
2024-12-06 10:00:00+00:00,"Musk's DOGE allies, Bezos and Altman stand tall, and Biden's AI chip war isn't over: Politics news roundup Elon Musk is finding some tentative allies on Capitol Hill as he looks to advance his cost-cutting agenda. But his growing influence and penchant for revenge apparently isnt scaring Amazon (AMZN) fou Elon Musk is finding some tentative allies on Capitol Hill as he looks to advance his cost-cutting agenda. But his growing influence — and penchant for..."
2024-12-06 13:52:08+00:00,"Uber Launches First International Robotaxis, Shares Regain Some Ground Uber Technologies (UBER) said Friday it is now offering autonomous vehicles on its app in Abu Dhabi through a partnership with China mobility company WeRide (WRD). Uber stock regained some ground in  Uber stock gained after launching robotaxis in Abu Dhabi, in partnership with WeRide. Shares lost 10% on Waymo expansion news a day earlier."
2024-12-06 17:13:29+00:00,"Top industrial CEOs warn Trump's tariff and budget plans could slow growth, increase consumer prices President-elect Donald Trumps policy agenda is generally good for business, top executives and analysts told me at the Goldman Sachs Industrial and Materials conference this week.
Its very bullish,  Business leaders warn of risks from inflationary tariffs and potential budget cuts at Goldman Sachs' Industrial and Materials conference."
2024-12-06 17:22:14+00:00,"8 Stocks Drive 50% Of The Year's $11.8 Trillion Stock Gain You already know about the Magnificent Seven stocks driving the S&amp;P 500. But what about the Elite Eight?
Eight stocks in the S&amp;P 500 including of course Nvidia (NVDA) and Amazon.com (AMZN) b You already know about the Magnificent Seven stocks driving the S&P 500. But what about the elite eight doing most of the work?"
2024-12-07 00:10:38+00:00,"Dow Jones Futures: Nasdaq Runs Toward 20,000 But These Risks Are Mounting Dow Jones futures will open Sunday evening, along with S&amp;P 500 futures and Nasdaq futures.
The stock market rally had a mixed week, but all the major indexes hit fresh highs at one point amid ge The index is starting to look stretched. Four tech titans are flashing buy signals."
2024-12-07 17:52:43+00:00,"What Is Tesla, Inc. (TSLA) The Best Lithium and Battery Stocks to Buy Now? We recently compiled a list of the 11 Best Lithium and Battery Stocks To Invest In. In this article, we are going to take a look at where Tesla, Inc. (NASDAQ:TSLA) stands against the other lithium an We recently compiled a list of the 11 Best Lithium and Battery Stocks To Invest In. In this article, we are going to take a look at where Tesla, Inc..."
2024-12-09 12:37:38+00:00,"Dow Jones Futures: Techs Fall As China Probes Nvidia; Beware These Risks Dow Jones futures were flat Monday morning, while S&amp;P 500 futures and Nasdaq futures fell slightly.
The stock market rally had a mixed week, but all the major indexes hit fresh highs at one poin The Nasdaq is getting stretched. Nvidia fell on a China monopoly probe."
2024-12-09 21:02:03+00:00,"Tesla Stock Heads Toward 400 For First Time Since 2022 Tesla (TSLA) stock jumped early Monday, attempting to add to a nearly 13% gain last week, as the EV giant eyes a level it hasn't reached since early 2022.
TSLA shares angled higher, hitting 404.80 e Tesla stock jumped around 13% last week as it eyes an advance to 400, a level it hasn't hit since early in 2022."
2024-12-09 21:13:33+00:00,"Why Tesla (TSLA) Is Among the Best Autonomous Driving Stocks to Buy According to Hedge Funds We recently compiled a list of the 10 Best Autonomous Driving Stocks To Buy According to Hedge Funds. In this article, we are going to take a look at where Tesla, Inc. (NASDAQ:TSLA) stands against th We recently compiled a list of the 10 Best Autonomous Driving Stocks To Buy According to Hedge Funds. In this article, we are going to take a look at where..."
2024-12-09 21:23:08+00:00,Stocks Finish Near Day's Lows Amid Nvidia's Bad Day; Amazon Streak Ends As Hershey Sweetens (Live Coverage) The Dow Jones Industrial Average and the other major indexes finished trading near the day's lows weakened in the final hour of trading Monday. Amazon.com's (AMZN) winning streak came to an end while The Dow Jones and S&P 500 were little changed Monday. Nvidia stock sank on a China probe while Palantir popped on the stock market today.
2024-12-10 01:56:55+00:00,"Dow Jones Futures: AppLovin, Cava, MicroStrategy, Palantir Dive; Nvidia Falls To Support Level Dow Jones futures, along with S&amp;P 500 futures and Nasdaq 100 futures, were slightly lower ahead of Tuesday's stock market open.
XNOW PLAYINGGrowth Leaders Slammed As China Stocks Surge; ATAT, EB AppLovin, Cava, MicroStrategy and Palantir dived, while Nvidia pulled back to a key level."
2024-12-10 12:00:03+00:00,"How to play the Mag 7 stocks in 2025: Portfolio manager The ""Magnificent Seven"" made up of Nvidia (NVDA), Alphabet (GOOG, GOOGL), Tesla (TSLA), Microsoft (MSFT), Amazon (AMZN), Meta Platforms (META), and Apple (AAPL) drove major indexes (^DJI, ^IXIC, ^GSP The ""Magnificent Seven"" — made up of Nvidia (NVDA), Alphabet (GOOG, GOOGL), Tesla (TSLA), Microsoft (MSFT), Amazon (AMZN), Meta Platforms (META), and Apple (..."
2024-12-10 13:14:50+00:00,"Tesla China Demand Hot; Key Analyst Raises Price Target But It's Not On Deliveries Tesla (TSLA) vehicle insurance registrations in China surged sequentially last week, marking one of the company's highest weekly totals ever in the key EV market as demand in China continues to rebou Tesla vehicle insurance registrations in China surged sequentially last week, marking one of the company's highest weekly totals ever in the key EV market as demand in China continues to rebound. Meanwhile, a top analyst increased his Tesla stock price target…"
2024-12-10 21:18:29+00:00,Dow Jones Falls As Nvidia Breaks Key Level On Taiwan Semi Report (Live Coverage) The Dow Jones Industrial Average and other major indexes fell to close Tuesday's trading session. Nvidia (NVDA) fell after investors were disappointed by a sales report from chip supplier Taiwan Semi Dow Jones fell in the stock market today. Nvidia rose from a key level of support. Tesla got a boost from an analyst upgrade.
2024-12-11 12:16:27+00:00,"Why Is Tesla (TSLA) the Best Self-Driving Technology Stock to Buy According to Hedge Funds? The autonomous driving industry is, along with machine learning and image processing, one of the earliest adopters of artificial intelligence. While the post-2022 hype surrounding AI has led to the t We recently published a list of 10 Best Self-Driving Technology Stocks To Buy According to Hedge Funds. In this article, we are going to take a look at where..."
2024-12-11 17:32:06+00:00,"Stock market today: Nasdaq tops 20,000 for first time as Big Tech surge leads stocks higher US stocks rallied on Wednesday, led by Big Tech, as investors digested another month of sticky inflation data that met economists' expectations and likely pointed to a Federal Reserve interest rate c The CPI report sets the stage for the Federal Reserve's final interest rate decision of the year."
2024-12-12 11:00:53+00:00,"What Cruise's self-driving end means for Tesla and Waymo: Morning Brief This is The Takeaway from today's Morning Brief, which you can sign up to receive in your inbox every morning along with:
<ul><li>The chart of the day
</li><li>What we're watching
</li><li>What we Cruise's demise pokes another hole in the commercial fantasy of a robotaxi fleet."
2024-12-12 11:48:06+00:00,"Dow Jones Futures Fall After Tesla, Titans Push Nasdaq Above 20,000; What To Do Now Dow Jones futures fell slightly early Thursday, along with S&amp;P 500 futures and Nasdaq futures.
The stock market rally marched higher Wednesday, with the Nasdaq clearing the 20,000 level for the  Keep an eye on the Nasdaq and sentiment. Adobe tumbled late on guidance."
2024-12-13 00:55:40+00:00,"Dow Jones Futures: AI Chip Stock Broadcom Surges On Earnings Dow Jones futures were little changed overnight, while S&amp;P 500 futures and Nasdaq futures rose modestly. Broadcom (AVGO) and Costco Wholesale (COST) reported earnings late Thursday.
Broadcom sur The stock market backed off highs Thursday as Adobe plunged and rising Treasury yields. Arm Holdings flashed a buy signal while Broadcom jumped late on earnings."
2024-12-13 13:00:51+00:00,"S&P 500 Is 20% Overvalued — Watch For These Warning Signs: Analyst Following a 27% run this year, the S&amp;P 500 is concerningly 20% overvalued, says a prominent chief investment officer. And wise investors should keep an eye out for early warning signs of trouble. Following a 27% run this year, the S&P 500 is concerningly 20% overvalued, says a prominent chief investment officer."
2024-12-13 14:34:16+00:00,"Cathie Wood Sells $15.3 Million Of Tesla, Buys This Surging Drone Stock Cathie Wood and her Ark Invest firm on Thursday loaded up on Archer Aviation stock and off-loaded a small portion of their Tesla holdings. Meanwhile, drone maker Archer Aviation received price target Cathie Wood loads up on drone maker Archer Aviation amid price hikes, defense partnership. Ark Invest off-loaded some Tesla stock."
2024-12-13 14:34:31+00:00,"EVgo Gets DOE Loan To Triple Network Without Issuing Shares; Stock Eyes Buy Point EVgo (EVGO) said late Thursday it has finalized a $1.25 billion, low-interest loan facility from the Department of Energy to finance construction of 7,500 electric vehicle fast-charging stalls by 202 EVgo stock jumped near a buy point after finalizing a Department of Energy loan that will finance construction of 7,500 EV charging stalls."
2024-12-13 17:16:26+00:00,"Stock Market Mixed As Google, Broadcom, Tesla Mask Weakness: Weekly Review The stock market rally saw mixed action, with the Nasdaq hitting a record high while the S&amp;P 500, Dow Jones and Russell 2000 all lost ground. Google-parent Alphabet (GOOGL) took a quantum leap pa The Nasdaq held at highs, but the broader market struggled as yields jumped."
2024-12-13 21:15:30+00:00,"Stock Market Today: Small Caps Fall Again As Major Indexes Close With Minor Moves (Live Coverage) The stock market closed narrowly mixed Friday, with the Dow Jones Industrial Average down 0.2% and the Nasdaq composite up 0.1% after paring gains.
The S&amp;P 500 closed flat. Small caps struggled, Stocks pared early gains in the stock market today and breadth turned negative by more than 2-to-1 on both exchanges."
2024-12-14 01:11:18+00:00,"Dow Jones Futures: Nasdaq Bucks Slide As Fed Meeting Looms; Is Nvidia An AI Laggard? Dow Jones futures will open Sunday evening, along with S&amp;P 500 futures and Nasdaq futures. The final Federal Reserve meeting of 2024 is on tap this week.
The stock market rally had a mixed week. Market breadth was weak with the Dow down 7 straight sessions."
2024-12-15 12:45:03+00:00,"The final Fed meeting of 2024 awaits: What to know this week The stock market rally has stalled as the final Federal Reserve meeting of the year approaches.In the past week, the Nasdaq Composite (^IXIC) was the only of the three major indexes to post a weekly  Investors will be closely watching for any hints on how much further the Federal Reserve plans to lower interest rates in 2025."
2024-12-16 13:00:03+00:00,"The AI Race Is On. Do Ambitious Startups Like OpenAI Stand A Chance Against Big Tech? Two years after OpenAI introduced ChatGPT, the frenzy over artificial intelligence has morphed into a fierce competition between tech industry giants and upstarts.
AI stocks led by Nvidia (NVDA), Mi Will AI model builders OpenAI and Anthropic ever rank among the best AI stocks? Going public may be a challenge as they battle tech incumbents like Google and Meta."
2024-12-16 16:06:22+00:00,"Stock Market Today: Dow Jones Up As Bitcoin Play Pops; Cathie Wood Loads Up On This AI Stock Amid 48% Plunge The Dow Jones Industrial Average inched up in morning trades Monday, helped by Nike (NKE), while other indexes were mixed. Bitcoin play MicroStrategy (MSTR) rose while famed investor Cathie Wood snap The Dow Jones index was steady on the stock market today. MicroStrategy rose on a Nasdaq move. Cathie Wood bought a plunging AI stock."
2024-12-17 01:59:18+00:00,"Dow Jones Futures: Nvidia Triggers Sell Signal As Fed Meeting Looms Dow Jones futures, along with S&amp;P 500 futures and Nasdaq 100 futures, were slightly lower ahead of Tuesday's stock market open.
XNOW PLAYINGNasdaq Takes 20,000 On Poor Breadth; Amphenol, Dutch B Alphabet, Amazon, Apple and Tesla all set record highs Monday."
2024-12-17 15:56:15+00:00,Dow Jones Falls As These 2025 Risks Loom; Nvidia Dives On Microsoft News The Dow Jones Industrial Average was headed for its ninth-straight loss as blue chips tumbled more than 200 points in morning action Tuesday. Nvidia (NVDA) buckled again over concerns its voltage dev Dow Jones and other indexes fell after retail sales in the stock market today. Nvidia fell further while Tesla soared to another record high.
2024-12-17 19:52:05+00:00,"Tesla clinches another record high after new bullish price targets from Wall Street Tesla stock hit a new all-time high for the fifth day in a row on Tuesday, surging as much as 5% to $483.99.
Gains have continued to roll in for Tesla stock since President-elect Donald Trump won a  Tesla shares hit a record high for the fifth day in a row on Tuesday, boosted by bullish price target upgrades from two Wall Street firms."
2024-12-17 20:00:40+00:00,"Elon Musk Hopes TSLA Stock Will Reach $690 As Analysts Raise Price Target Despite Technical Indicators Flashing Warning Signals Elon Musk Hopes TSLA Stock Will Reach $690 As Analysts Raise Price Target Despite Technical Indicators Flashing Warning Signals
Benzinga and Yahoo Finance LLC may earn commission or revenue on some  Tesla Inc (NASDAQ:TSLA) CEO Elon Musk on Monday expressed hope that the company’s stock will touch $690 in the future, without specifying a timeline. What..."
2024-12-17 20:41:47+00:00,"Why the 'Magnificent 7' rally could be a ‘defensive’ move Decembers market action has been all about a rally from several members of the ""Magnificent Seven"" tech stocks.
Tesla (TSLA), Alphabet (GOOGL, GOOG), Amazon (AMZN), and Apple (AAPL) all hit fresh re Wall Street strategists believe investors are seeking safety in the market's most consistent performers as nervousness grows about the path forward for..."
2024-12-17 22:38:46+00:00,"Dow Jones Futures: Hawkish Fed Rate Cut Due As Nvidia Leads Market Slide; Tesla Keeps Rising Dow Jones futures fell slightly after hours, along with S&amp;P 500 futures and Nasdaq future. The Federal Reserve meeting decision looms Wednesday afternoon, with the a hawkish Fed rate-cut expected The Dow is in its longest losing streak since 1978 as Nvidia woes mount. Tesla runs higher as the Fed decision looms."
