publishedAt,title
2024-12-17 23:08:23+00:00,"Why the Dow is suddenly in a historic funk The Dow Jones Industrial Average (^DJI) is on its worst losing streak in nearly 50 years.
The major index has fallen for nine straight trading days, its largest stretch of consecutive declines since The Dow Jones Industrial Average has fallen for nine straight trading sessions, marking its worst losing streak since 1978."
2024-12-18 07:17:50+00:00,"Trump Team Pushes to Scrap Crash Reporting Rule Opposed by Tesla (TSLA) We recently published a list of Top 10 AI News You Shouldnt Miss. In this article, we are going to take a look at where Tesla, Inc. (NASDAQ:TSLA) stands against other top AI news you shouldnt miss.
 We recently published a list of Top 10 AI News You Shouldn’t Miss. In this article, we are going to take a look at where Tesla, Inc. (NASDAQ:TSLA) stands..."
2024-12-18 11:00:40+00:00,"Big Tech is dominating the market once again — and that's probably just fine: Morning Brief This is The Takeaway from today's Morning Brief, which you can sign up to receive in your inbox every morning along with:
<ul><li>The chart of the day
</li><li>What we're watching
</li><li>What we December is shaping up to be a tale of two markets."
2024-12-19 02:04:09+00:00,"Dow Jones Dives 1,100 Points On Fed Outlook, Tesla Skids; Micron Plunges Late On Earnings Dow Jones futures were little changed overnight, along with S&amp;P 500 futures and Nasdaq futures. Micron Technology (MU) dived late on weak guidance, bad news for the chip sector.
The stock market The Dow Jones lost 1,100 points as the stock market plunged on the Fed rate outlook. Tesla was a big loser. Micron dived late on guidance."
2024-12-19 13:27:25+00:00,"Dow Jones Futures Rebound Ahead Of GDP, Jobless Claims; AI Chip Giant Micron Plunges The Dow Jones Industrial Average and other major indexes traded higher in premarket action Thursday, as stocks looked to bounce back from Wednesday's sell-off. Markets also digested stronger-than-exp Key earnings movers include Micron, Darden Restaurants and Lennar."
2024-12-19 13:32:17+00:00,"Nvidia stock rebounds after broad market rout as analysts stay bullish on outlook Nvidia (NVDA) stock jumped as much as 2.7% early Thursday, as Wall Street analysts reiterated their Buy ratings on the stock despite concerns about rising competition and the possibility that AI chip Nvidia stock rose as Wall Street analysts reiterated their Buy ratings despite concerns about rising competition and the possibility that AI chip demand..."
2024-12-19 15:34:48+00:00,"Dow Jones Tries To Recover After 1,100 Point Drop; Micron Sinks On Earnings But Nvidia Rebounds (Live Coverage) The Dow Jones Industrial Average and other major indexes tried to recover Thursday morning after a brutal day of selling Wednesday, following the Federal Reserve's policy meeting. Micron (MU) tumbled The Dow Jones and S&P 500 try to rebound after a harsh sell-off. Micron tumbled after the company's earnings report while Nvidia climbed."
2024-12-19 21:22:53+00:00,"Tesla: 3 top moments that defined the EV maker in 2024  Tesla (TSLA) has experienced a turbulent year, from unveiling its robotaxi and Optimus robots to its stock surging as CEO Elon Musk emerged as a key figure in President-elect Donald Trump's campaign and cabinet. Yahoo Finance Senior Autos Reporter Pras Subram…"
2024-12-20 03:12:47+00:00,"Jim Cramer on Tesla, Inc. (TSLA): It’s More About the Ethos Than the Cars  "
2024-12-20 10:42:33+00:00,"Tesla recalls nearly 700,000 vehicles in US over tire pressure monitoring system issue (Reuters) -Tesla (TSLA) said on Friday it was recalling 694,304 vehicles in the United States over an issue with the tire pressure monitoring system.
The issue, which affects some Model 3, Model Y a The issue, which affects some Model 3, Model Y and Cybertruck vehicles, will be resolved with an over-the-air software update, the company said.  The tire..."
2024-12-20 13:48:36+00:00,"Stock market today: Dow, S&P 500, Nasdaq futures sell-off as government shutdown looms, inflation data improves but still sticky US stock futures pointed to another rough day on Wall Street Friday after the House of Representatives voted against a Trump-backed spending bill, further increasing the odds of a US government shutd Stocks signaled another rough day of trading on Friday after the House of Representatives voted against a Trump-backed spending bill."
2024-12-20 15:13:17+00:00,"EV Tax Credits: $7,500 Is Up For Grabs. Here's How To Get It. Analysts expect sales of electric vehicles will jump in early 2025, ahead of President-elect Donald Trump's reported plans to cut clean-energy incentives such as the federal EV tax credits in the new Here’s who qualifies and which vehicles can earn you the biggest federal EV tax credit."
2024-12-20 15:58:11+00:00,"Dow Jones Jumps Nearly 400 Points As Government Shutdown Looms; Nvidia Rises While Tesla, Trump Shares Drop (Live Coverage) Volume on the New York Stock Exchange and on the Nasdaq was higher compared with the same time on Thursday. Advancing stocks outnumbered decliners by 4-to-1 on the NYSE and nearly 5-to-2 on the Nasda The Dow Jones rose on the stock market today as a government shutdown looms. Nvidia rose while Tesla fell along with a Trump stock."
2024-12-20 20:58:10+00:00,"Nvidia, Tesla Showcase Timely Tips From Rudolph, Frosty And Scrooge Tis the season to be jolly, thankful and disciplined. And where better to get some timely tips on investing in stocks than the holiday classics ""Rudolph the Red-Nosed Reindeer,"" ""Frosty the Snowman""  Discover timely investing tips from Rudolph, Frosty and Scrooge."
