publishedAt,title
2024-12-24 09:13:23+00:00,"Jim Cramer Says Ford Motor (F) Is in Trouble – Here’s Why We recently published a list of Jim Cramers Latest Calls Before 2025 Begins: Top 10 Stocks. In this article, we are going to take a look at where Ford Motor Co (NYSE:F) stands against other stocks in We recently published a list of Jim Cramer’s Latest Calls Before 2025 Begins: Top 10 Stocks. In this article, we are going to take a look at where Ford Motor..."
2024-12-24 12:00:04+00:00,"Canadian EV charging robot startup in talks with Big 3 U.S. automaker When it comes to busting a big roadblock for electric vehicles, these may be the droids were looking for.A Canadian startup says robots that roam apartment and condo parking lots by night, charging d Toronto-based Kiwi Charge sees fixed chargers as a relic of internal combustion, modelled after gas pumps where drivers pull up for their fill."
2024-12-24 12:39:57+00:00,"Tesla Announces Quarterly Deliveries Next Week. China Continues To Offer Good News. Tesla (TSLA) vehicle insurance registrations in China retreated sequentially for a second straight week, but the EV giant is trending toward a strong quarterly performance with official fourth-quarte Tesla's strong quarter in China continues with latest data release. Will that be enough?"
2024-12-24 15:00:36+00:00,"'I'm 20 With $40K And Ready To Risk It All' – Reddit Explodes Over Best Long-Term Stocks And ETF Strategies Benzinga and Yahoo Finance LLC may earn commission or revenue on some items through the links below.
Exchange-traded funds (ETFs) and long-term stocks are two important pillars for building a strong Exchange-traded funds (ETFs) and long-term stocks are two important pillars for building a strong investment portfolio, especially since they have the..."
2024-12-24 15:05:20+00:00,"Charged: Analyst sees Tesla Q4 deliveries just above expectations https://www.tipranks.com/news/the-fly/charged-analyst-sees-tesla-q4-deliveries-just-above-expectations
Institutional investors and professional traders rely on The Fly to keep up-to-the-second on br Institutional investors and professional traders rely on The Fly to keep up-to-the-second on breaking news in the electric vehicle and clean energy space, as..."
2024-12-24 15:18:00+00:00,"Honda-Nissan Mega Merger Plans: A Bold Move to Survive EV Disruption As the auto industry navigates transformative shifts, two of Japan’s largest automakers, Honda HMC and Nissan NSANY, are exploring a landmark merger. This bold move aims to create a roughly $50 billi HMC-NSANY's potential $50B merger seeks to tackle EV challenges, cut costs and compete with Tesla and BYD, reshaping the future of Japan's auto industry."
2024-12-24 15:48:37+00:00,Stock Market Today: Dow Jones Up As Santa Claus Rally Begins; American Airlines Dips After U.S. Flights Grounded The Dow Jones Industrial Average rose and other major indexes gained in the shortened Christmas Eve trading session on Tuesday. American Airlines (AAL) dipped after all its U.S. flights were temporal The Dow Jones rose on the stock market today. Magnificent Seven names Amazon and Nvidia were strong. American Airlines stock skidded.
2024-12-24 15:49:59+00:00,"Tesla Stock Leads Magnificent Seven Shares Higher Justin Sullivan / Getty Images
Tesla's (TSLA) shares were the S&amp;P 500's top gainers Tuesday as the Magnificent Seven big tech stocks rose on Christmas Eve.
Shares of the EV maker finished the d Tesla's shares were the S&P 500's top gainers Tuesday as the Magnificent Seven big tech stocks rose on Christmas Eve."
2024-12-25 02:05:30+00:00,"Dow Jones Futures: Market Rallies Into Holiday; Tesla Surges, Nvidia Tops Buy Point Dow Jones futures were little changed Tuesday night, along with S&amp;P 500 futures and Nasdaq futures. Markets are closed for the Christmas holiday.
The stock market rally had a solid advance in th The Santa Claus rally got off to a strong start with Tesla leading the Nasdaq higher. Nvidia just topped a buy point."
2024-12-25 16:00:13+00:00,38-Year-Old Military Vet With Pension Wants High-Risk Bets for $500/Month – 'Should I Dump It All in TSLA or Go All-In On Leverage?'  
2024-12-25 19:53:28+00:00,"Why Maintaining A Gas Car Sucks Compared To An Electric Car Sign up for daily news updates from CleanTechnica on email. Or follow us on Google News!
Owning gas cars means dealing with frequent oil changes and various maintenance issues, leading to time, cost Owning gas cars means dealing with frequent oil changes and various maintenance issues, leading to time, cost, and reliability concerns versus EVs. This rant is going to list some things I’ve found to be annoying about the ~15 gas cars I owned until I went al…"
2024-12-26 13:05:05+00:00,"Dow Jones Futures Fall Ahead Of Jobless Claims; Nvidia Hits Buy Point The Dow Jones Industrial Average and other major indexes were lower Thursday, as Wall Street awaited weekly unemployment data. An early name to watch on the stock market today is Nvidia (NVDA), which Nvidia hit a buy point Tuesday, while Tesla continued to rebound."
2024-12-26 15:35:34+00:00,"Tesla, Inc. (TSLA): AI and Autonomous Driving Drive Long-Term Bull Case Amid Q4 Delivery Projections We recently compiled a list of the 10 AI News You Can't Miss. In this article, we are going to take a look at where Tesla, Inc. (NASDAQ:TSLA) stands against the other AI stocks you can't miss.
Accor We recently compiled a list of the 10 AI News You Can’t Miss. In this article, we are going to take a look at where Tesla, Inc. (NASDAQ:TSLA) stands against ..."
2024-12-26 15:45:08+00:00,"Uber Stock Lower After Taiwan Regulators Block $950 Million Foodpanda Deal Regulators in Taiwan have blocked Uber Technologies' (UBER) plan to acquire Delivery Hero's Foodpanda local operations for $950 million, citing competition concerns. Uber stock was slightly lower in  Uber stock was lower after regulators in Taiwan blocked its plan to acquire Delivery Hero's Foodpanda local operations for $950 million."
2024-12-26 17:52:35+00:00,"Stock market today: Dow ekes out gains, bitcoin slumps as 'Santa Claus' rally takes a pause US stocks struggled to meaningfully extend a ""Santa Claus"" rally the day after Christmas while Wall Street digested one of the only significant economic data points of the week.
The S&amp;P 500 (^GS US stocks were set to open post-Christmas trading with a bit of a hangover."
2024-12-26 18:26:15+00:00,"Nasdaq 100 Adjusts Weightings Amid Record Gains by Major Tech Firms Meta Platforms (META, Financials), Broadcom (AVGO, Financials), and Tesla (TSLA, Financials) all saw weightings within the Nasdaq 100 index shrink after notable stock price gains over the year. Bloom This marks the second adjustment to the Nasdaq 100 this year, aimed at limiting the dominance of the largest constituents."
2024-12-27 13:20:18+00:00,"Dow Jones Futures Fall As Treasury Yields Climb; Nvidia, Tesla Drop The Dow Jones Industrial Average and other major indexes were lower Friday, as Wall Street threatened to close out the week in the red. Two early losers on the stock market today were Nvidia (NVDA) a The Dow Jones Industrial Average and other major indexes were lower Friday, as Wall Street threatened to close out the week in the red. Two early losers on the stock market today were Nvidia (NVDA) and Tesla (TSLA).
Ahead of the opening bell, Dow Jones future…"
2024-12-27 14:32:06+00:00,"Stock market today: Dow, S&P 500, Nasdaq sink as Nvidia, Tesla lead Big Tech slide US stocks opened on a downbeat note as Wall Street slogged to the finish of a largely triumphant year.
The S&amp;P 500 (^GSPC) lost 1.5%, while the tech-heavy Nasdaq Composite (^IXIC) shed 2.2% Frid Wall Street looked to be slogging to the finish of a largely triumphant year."
2024-12-27 15:11:33+00:00,"The AI stock trade is starting to shift beyond the 'Magnificent 7' Investor enthusiasm surrounding artificial intelligence has once again driven the ""Magnificent Seven"" tech stocks to another banner year, with Tesla (TSLA), Meta (META), Amazon (AMZN), Alphabet (GOOG Strategists expect the artificial intelligence trade will mature in 2025 to benefit companies beyond those buying and creating new AI chips."
2024-12-27 15:19:36+00:00,"OpenAI Lays Out For-Profit Business Strategy Amid Microsoft Talks, Musk Feud Artificial intelligence pioneer OpenAI laid out more details of its plans to adopt a for-profit business structure in 2025, amid negotiations with investor Microsoft (MSFT) and a feud with Tesla (TSL Artificial intelligence pioneer OpenAI laid out more details on plans to adopt a for-profit business structure in 2025, a move that could impact Microsoft stock."
2024-12-27 17:44:00+00:00,"The Dow sinks 500 points as Nvidia and Tesla lead tech decline Photo: Michael M. Santiago (Getty Images)
The Dow fell sharply on Friday, dropping more than 500 points as tech giants within the so-called Magnificent Seven saw significant declines.
The Dow Jones The Dow fell sharply on Friday, dropping more than 500 points as tech giants within the so-called “Magnificent Seven” saw significant declines."
2024-12-27 17:44:00+00:00,"The Dow sinks 500 points as Nvidia and Tesla lead tech decline In This Story
The Dow fell sharply on Friday, dropping more than 500 points as tech giants within the so-called Magnificent Seven saw significant declines.
The Dow Jones Industrial Average lost 542 The Dow fell sharply on Friday, dropping more than 500 points as tech giants within the so-called “Magnificent Seven” saw significant declines.Read more..."
2024-12-27 20:49:58+00:00,Daniel Ives Bullish on Big Tech Tesla (TSLA) and Palantir (PLTR) and Cryptocurrencies on Regulation Getting Defanged  
2024-12-27 21:42:50+00:00,"Best China Stocks 2025: Tesla Rivals, Travel Plays Near Buy Points Amid Trump Tariff Fears China stocks have whipsawed in recent months on stimulus hopes and disappointment, along with the threat of new tariffs under President-elect Donald Trump. Still, several stocks are showing strength. Best China stocks 2025: China stimulus bets and Trump tariff fears have weighed on Chinese stocks. Tesla rivals BYD and Zeekr are setting up."
2024-12-27 23:05:55+00:00,Analyst on Tesla (TSLA): ‘No Cause To Be Concerned’  
2024-12-28 13:11:12+00:00,"Dow Jones Futures: Market Skids, But Nvidia Forges Base; Tesla Deliveries Loom Dow Jones futures will open Sunday evening, along with S&amp;P 500 futures and Nasdaq futures, with the stock market set to wrap up 2024 and ring in the new year.
The stock market rally saw sharp Fr The market rally is divided but plenty of leading stocks are acting well."
2024-12-29 12:36:08+00:00,"Is Tesla, Inc. (TSLA) A Good Car Stock To Invest In Now?  "
2024-12-30 02:22:58+00:00,"How Networks Of Competence Achieve Superior Competitive Advantage The Winner Is... 
getty
In the summer of 2002, Amazon CEO Jeff Bezos went on vacation. His firm had survived the dot-com crash of 2000, with an obsessional focus on customer value. Amazon had grown How Networks Of Competence Beat Hierarchies Of Authority In Terms Of Cost, Customers, Network Effects, Differentiation, Focus, Speed, Innovation, Control, Fulfillment"
2024-12-30 03:23:41+00:00,"Watch These Tesla Price Levels as Stock Hits Brakes Ahead of Q4 Deliveries Report Source: TradingView.com
<ul><li>Tesla shares will be in focus to start the week after logging two consecutive days of losses, as investors look ahead to the EV makers fourth-quarter deliveries repor Tesla shares will be in focus to start the week after logging two consecutive days of losses, as investors look ahead to the EV maker’s fourth-quarter..."
2024-12-30 03:23:41+00:00,"Watch These Tesla Price Levels as Stock Hits Brakes Ahead of Q4 Deliveries Report Source: TradingView.com
<ul> Tesla shares will be in focus to start the week after logging two consecutive days of losses, as investors look ahead to the EV maker’s fourth-quarter..."
2024-12-30 05:18:07+00:00,"Jim Cramer on Tesla, Inc (TSLA): ‘Shares Of Tesla Are Down About 13% Year To Date’ We recently published an article titled Jim Cramer's Bold Predictions About These 15 AI Stocks. In this article, we are going to take a look at where Tesla, Inc (NASDAQ:TSLA) stands against the other We recently published an article titled Jim Cramer’s Bold Predictions About These 15 AI Stocks. In this article, we are going to take a look at where Tesla, ..."
2024-12-30 12:43:36+00:00,"Stock market today: S&P 500, Nasdaq and Dow sink to start final trading week of 2024 Stocks fell on Monday, with the woes of the three major indexes continuing in the final week of the year as an otherwise strong 2024 comes to a close.
The benchmark S&amp;P 500 (^GSPC) dropped about Stocks moved lower on Monday morning as the market slumped to end 2024."
2024-12-30 12:43:36+00:00,"Stock market today: S&P 500, Nasdaq, Dow slide as strong year nears its close Stocks fell on Monday, with the woes of the three major indexes continuing in the final week of the year as an otherwise strong 2024 comes to a close.
The benchmark S&amp;P 500 (^GSPC) slipped more  Stocks moved lower on Monday morning as the market slumped to end 2024."
2024-12-30 13:03:09+00:00,"Dow Jones Futures Fall 290 Points As Nvidia Offers New Buy Point; Tesla Extends Losses The Dow Jones Industrial Average and other major indexes traded lower Monday, threatening to extend Friday's stock market sell-off heading into the final two trading days of 2024. Two early losers on Nvidia offered a new buy point, while Tesla threatened to extend Friday's losses."
2024-12-30 13:05:37+00:00,"Is Tesla, Inc. (TSLA) the Biggest EV Stock In the World Heading Into 2025?  "
2024-12-30 15:44:54+00:00,"Tesla investor: Elon Musk is working more for Trump and less for Tesla Elon Musk is Tesla (TSLA) CEO in title only nowadays and is keener on wielding power in the incoming Trump administration, one outspoken investor in the electric vehicle maker contended.
""[Elon Musk Tesla shareholders may want to begin paying attention to who is really running the EV giant, one prominent investor says."
2024-12-30 15:47:00+00:00,"Elon Musk's Starlink will give Ukraine 'uninterrupted' cell service In This Story
Elon Musks Starlink is set to give Ukraine uninterrupted service through its satellite network through a partnership with Kyivstar (VEON+2.82%
), the countrys largest mobile operator. Elon Musk’s Starlink is set to give Ukraine “uninterrupted” service through its satellite network through a partnership with Kyivstar (VEON), the country’s largest mobile operator. Read more..."
2024-12-30 15:50:00+00:00,"The Dow sinks 650 points in the final days of 2024 In This Story
The Dow dropped 650 points on Monday morning as lighter trading volumes were anticipated in the final days of 2024. The market experienced a wave of profit-taking, especially in the te The Dow dropped 650 points on Monday morning as lighter trading volumes were anticipated in the final days of 2024. The market experienced a wave of profit-taking, especially in the technology sector.Read more..."
2024-12-30 20:30:27+00:00,"China And Musk Could Both Contribute To Tesla’s (TSLA) Commercial Deployment of Robotaxis As the political temperature cools down in the aftermath of Donald Trump's victory, analysts are now starting to evaluate the possible implications. Everyone saw Elon Musks involvement in the politic As the political temperature cools down in the aftermath of Donald Trump’s victory, analysts are now starting to evaluate the possible implications. Everyone..."
2024-12-30 20:33:06+00:00,Tesla’s (TSLA) Autonomous Future: What’s Next for Driverless Cars?  
2024-12-30 20:38:59+00:00,"Nvidia may be entering a 'limitless' era: Investor Nvidia's (NVDA) Teflon-like stock may be taking a few swipes as the year winds down, but a new chapter awaits the AI market darling and with it more impressive quarters of growth, experts and investo Nvidia is entering its next phase of growth, and it could be as impressive as its most recent phase, one investor argued."
2024-12-31 09:36:57+00:00,"Why Tesla, Inc. (TSLA) Is the Best Environmental Stock to Invest in Right Now?  "
2024-12-31 09:37:00+00:00,"Stocks are skipping the ‘Santa Claus rally’ again this year. That doesn’t bode well for January. Investors look set to be disappointed as the Santa Claus rally has so far failed to materialize for the second year in a row. - AFP via Getty Images
Santa Claus is leaving investors in the lurch onc Santa Claus is leaving investors in the lurch once again in 2024 as U.S. stocks have struggled during the typically bullish home stretch of the year."
2024-12-31 10:00:00+00:00,"Tesla stock's bumpy road through 2024 was erased by Musk and Trump's bromance In This Story
Tesla (TSLA-2.88%
) began 2024 with a bang.
In January alone, the company was slammed by a recall dealing with an Autopilot glitch, reports about CEO Elon Musks troubling drug habits In March, Tesla stock was one of the worst performers of the year. Now, it's up 70%"
2024-12-31 10:00:00+00:00,"The AI stocks that could boom in 2025 Big Tech stocks could have another big year in 2025.
Nvidia (NVDA), Amazon (AMZN), Alphabet (GOOGL), and Apple (AAPL) could continue to be some of the biggest winners of the artificial intelligence- Nvidia, Amazon, Google parent Alphabet, and Apple could continue to see their shares boosted by AI"
2024-12-31 11:46:59+00:00,"Is Tesla Stock a Buy in 2025? Tesla (NASDAQ: TSLA) had a big year in 2024 and shareholders enjoyed a 70% gain (as of Dec. 30).A series of positive factors, such as solid sales volume and the election of Donald Trump as president, Tesla (NASDAQ: TSLA) had a big year in 2024 and shareholders enjoyed a 70% gain (as of Dec. 30).
A series of positive factors, such as solid sales volume and the election of Donald Trump as president, propelled the stock to new all-time highs. But as the year…"
2024-12-31 12:41:12+00:00,"5 Things to Know Before the Stock Market Opens Michael Nagle / Bloomberg via Getty Images
Tuesday is the last trading day of 2024 and markets will be closed tomorrow for New Year's Day; U.S. stock futures are pointing higher, with investors hopi News of the day for Dec. 31, 2024"
2024-12-31 12:50:59+00:00,"Tesla Stock Surge Runs Up Against a Potential Annual Sales Drop (Bloomberg) For all the exuberance about Tesla Inc. (TSLA) benefiting from Donald Trumps return to the White House, Wall Street isnt so sure the carmaker can avoid its first annual sales decline in o (Bloomberg) -- For all the exuberance about Tesla Inc. benefiting from Donald Trump’s return to the White House, Wall Street isn’t so sure the carmaker can..."
2024-12-31 13:07:03+00:00,"Option Trade Could Return 39% On A Seemingly Exhausted Palantir Palantir (PLTR) stock's phenomenal run looks like it's getting a bit long in the tooth. Options flow has been negative over the last week as the stock has pulled back more than 6% in three days.
Ana Palantir stock’s phenomenal run looks like it’s getting a bit long in the tooth, with the stock showing negative options flow."
2024-12-31 14:30:39+00:00,"Stock market today: Stocks slide as Wall Street's year of 20% gains ends on a quiet note US stocks slipped Tuesday, closing 2024 with an uncharacteristic down note after a roaring year of trading.
The S&amp;P 500 (^GSPC) fell 0.4%. The Dow Jones Industrial Average (^DJI) dropped just be US stocks slipped Tuesday, continuing an uncharacteristic limp to the finish after a roaring year of trading."
2024-12-31 15:43:47+00:00,"Stock Market Today: Dow Jones Bounces Modestly; Tesla Gains As Some Of Year's Top Winners Fall (Live Coverage) The Dow Jones Industrial Average rose 0.4% in early trades Tuesday, and other indexes also rose as investors sought to end the year on a high note.The S&amp;P 500 and the Nasdaq are trying to break a The Nasdaq is headed for a 30% gain for the year."
2024-12-31 16:15:29+00:00,"Tesla Stock Slips Further Ahead of EV Maker's Q4 Delivery Report <ul><li>Tesla shares reversed course and edged lower Tuesday, continuing recent declines ahead of its fourth-quarter delivery report.</li><li>Analysts expect the EV maker to report a record number of Tesla shares reversed course and edged lower Tuesday, continuing recent declines ahead of its fourth-quarter delivery report."
2024-12-31 16:15:29+00:00,"Tesla Stock Slips Further Ahead of EV Maker's Q4 Delivery Report <ul> Tesla shares reversed course and edged lower Tuesday, continuing recent declines ahead of its fourth-quarter delivery report."
2024-12-31 22:00:53+00:00,"Stock Market Caps Best Two-Year Gain Of 21st Century The stock market had a weak finish, but 2024 was another strong year, with the S&amp;P 500 index boasting its best two-year performance of the 21st century. A lot of the credit goes to Nvidia (NVDA)  The S&P 500 had its second straight annual gain of more than 20%."
2024-12-31 22:12:16+00:00,"Dow Jones Futures: Stock Market Ends 2024 On Weak Note; Tesla Deliveries Due Dow Jones futures edged higher after hours, along with S&amp;P 500 futures and Nasdaq futures, heading into the New Year's Day holiday.
The stock market ended a strong 2024 on a weak note. The Nasda Here's what investors should do now."
2025-01-01 16:50:08+00:00,"China says Tesla to update software for over 77K China-made cars, Reuters says https://www.tipranks.com/news/the-fly/china-says-tesla-to-update-software-for-over-77k-china-made-cars-reuters-says
Chinas market regulator said that Tesla (TSLA) intends to repair software in 77,65 China’s market regulator said that Tesla (TSLA) intends to repair software in 77,650 China-made Model 3 and Model Y vehicles over safety concerns, Reuters..."
2025-01-01 17:33:02+00:00,"Tesla Cybertruck Eligible For $7,500 Tax Credit The Tesla Cybertruck is now eligible for the $7,500 tax credit as of Jan. 1, which should boost demand for expensive EV.
The dual-motor Tesla (TSLA) Cybertruck, which starts at $79,990, now qualifie That should boost demand for the pricey electric vehicle."
2025-01-02 11:58:16+00:00,"Dow Jones Futures Rise To Start 2025; Tesla Climbs With Deliveries Due Dow Jones futures rose strongly Thursday morning, along with S&amp;P 500 futures and Nasdaq futures, as global markets kick off 2025.
The stock market ended a strong 2024 on a weak note. The Nasdaq  Tesla deliveries were due but is going to lose its BEV crown."
2025-01-02 12:14:52+00:00,"Stock market today: Nasdaq, S&P 500, Dow rise as Wall Street eyes a new year comeback Stocks edged higher on Thursday to kick off the first day of trading of the new year as Wall Street returned from holiday.
The S&amp;P 500 (^GSPC) popped 0.2%, while the Dow Jones Industrial Average Markets are set to kick off the new year on the front foot as faith in techs re-emerges."
2025-01-02 13:09:13+00:00,"Tesla Deliveries Are Due. Analysts Expect A Record Quarter. Tesla (TSLA) will report fourth-quarter and full-year deliveries and production figures on Thursday, likely around 9 a.m. ET, ET. Analysts expect record Tesla Q4 deliveries, but the consensus view ha Tesla stock rose early Thursday ahead of Q4 delivery and production numbers."
2025-01-02 14:31:20+00:00,"Stock market today: Dow, Nasdaq, S&P 500 rise as Wall Street eyes a new year comeback Stocks rose on Thursday to kick off the first trading day of the new year as Wall Street returned from holiday.
The S&amp;P 500 (^GSPC) edged up 0.4%, while the Dow Jones Industrial Average (^DJI) r Markets are set to kick off the new year on the front foot as faith in techs reemerges."
2025-01-02 14:45:00+00:00,"Tesla failed to meet its EV sales goals and Wall Street's expectations In This Story
Tesla (TSLA-5.38%
) has officially failed to reach its 2024 delivery goal, according to the latest sales data released by the electric vehicle maker.
Austin, Texas-based Tesla delive Tesla (TSLA) has officially failed to reach its 2024 delivery goal, according to the latest sales data released by the electric vehicle maker.Read more..."
2025-01-02 15:04:42+00:00,"Magnificent Seven Stocks: Nvidia Rebounds; Tesla Slides On Q4 Deliveries Dubbed the Magnificent Seven stocks, Apple, Microsoft, Google parent Alphabet, Amazon.com, Nvidia, Meta Platforms and Tesla lived up to their name in 2024 with big gains.
Due to their outsized marke Magnificent Seven stocks to watch in January 2025 include Apple, Nvidia and Tesla."
2025-01-02 15:20:12+00:00,"Tesla stock drops after it reports first annual decline in EV deliveries Tesla stock dropped as much as 8% on Thursday after the company reported fourth-quarter vehicle deliveries.
Shares of the company traded as low as $373.40 before paring losses. 
The company deliver The delivery figures are the first real piece of fundamental news for Tesla investors since the November election sparked a big rally for the stock."
2025-01-02 16:05:00+00:00,"Electric cars already won — in Norway In This Story
Nine out of every ten new cars sold in Norway last year were powered by electricity, as the Scandinavian country continues to be a leader in electric vehicle purchases.
Fully electric Nine out of every ten new cars sold in Norway last year were powered by electricity, as the Scandinavian country continues to be a leader in electric vehicle purchases.Read more..."
2025-01-02 16:30:00+00:00,"Elon Musk’s cryptic post sent another memecoin soaring — momentarily In This Story
Crypto-friendly billionaire Elon Musk is known for his cryptic social media posts. This time, his online activity triggered a dramatic pump-and-dump of cryptocurrency. 
On Tuesday, th Crypto-friendly billionaire Elon Musk is known for his cryptic social media posts. This time, his online activity triggered a dramatic pump-and-dump of cryptocurrency. Read more..."
