publishedAt,title
2024-12-11 17:32:06+00:00,"Stock market today: Nasdaq tops 20,000 for first time as Big Tech surge leads stocks higher US stocks rallied on Wednesday, led by Big Tech, as investors digested another month of sticky inflation data that met economists' expectations and likely pointed to a Federal Reserve interest rate c The CPI report sets the stage for the Federal Reserve's final interest rate decision of the year."
2024-12-12 11:00:53+00:00,"What Cruise's self-driving end means for Tesla and Waymo: Morning Brief This is The Takeaway from today's Morning Brief, which you can sign up to receive in your inbox every morning along with:
<ul> Cruise's demise pokes another hole in the commercial fantasy of a robotaxi fleet."
2024-12-12 11:00:53+00:00,"What Cruise's self-driving end means for Tesla and Waymo: Morning Brief This is The Takeaway from today's Morning Brief, which you can sign up to receive in your inbox every morning along with:
<ul><li>The chart of the day
</li><li>What we're watching
</li><li>What we Cruise's demise pokes another hole in the commercial fantasy of a robotaxi fleet."
2024-12-12 11:48:06+00:00,"Dow Jones Futures Fall After Tesla, Titans Push Nasdaq Above 20,000; What To Do Now Dow Jones futures fell slightly early Thursday, along with S&amp;P 500 futures and Nasdaq futures.
The stock market rally marched higher Wednesday, with the Nasdaq clearing the 20,000 level for the  Keep an eye on the Nasdaq and sentiment. Adobe tumbled late on guidance."
2024-12-12 16:40:00+00:00,"Trump says Elon Musk will put America before Tesla or SpaceX In This Story
President-elect Donald Trump says there arent any potential conflicts of interest that come with Elon Musk leading a group scrutinizing the same federal agencies that regulate his comp President-elect Donald Trump says there aren’t any potential conflicts of interest that come with Elon Musk leading a group scrutinizing the same federal agencies that regulate his companies. Read more..."
2024-12-13 00:55:40+00:00,"Dow Jones Futures: AI Chip Stock Broadcom Surges On Earnings Dow Jones futures were little changed overnight, while S&amp;P 500 futures and Nasdaq futures rose modestly. Broadcom (AVGO) and Costco Wholesale (COST) reported earnings late Thursday.
Broadcom sur The stock market backed off highs Thursday as Adobe plunged and rising Treasury yields. Arm Holdings flashed a buy signal while Broadcom jumped late on earnings."
2024-12-13 13:00:51+00:00,"S&P 500 Is 20% Overvalued — Watch For These Warning Signs: Analyst Following a 27% run this year, the S&amp;P 500 is concerningly 20% overvalued, says a prominent chief investment officer. And wise investors should keep an eye out for early warning signs of trouble. Following a 27% run this year, the S&P 500 is concerningly 20% overvalued, says a prominent chief investment officer."
2024-12-13 14:30:00+00:00,"Elon Musk wants to make SpaceX's base an official company town In This Story
SpaceXs latest endeavor is to make its Starbase, a Texas community where the company launches rockets and where some employees and their families live, into its very own city. 
Elon M SpaceX’s latest endeavor is to make its Starbase, a Texas community where the company launches rockets and where some employees and their families live, into its very own city. Read more..."
2024-12-13 14:34:16+00:00,"Cathie Wood Sells $15.3 Million Of Tesla, Buys This Surging Drone Stock Cathie Wood and her Ark Invest firm on Thursday loaded up on Archer Aviation stock and off-loaded a small portion of their Tesla holdings. Meanwhile, drone maker Archer Aviation received price target Cathie Wood loads up on drone maker Archer Aviation amid price hikes, defense partnership. Ark Invest off-loaded some Tesla stock."
2024-12-13 14:34:31+00:00,"EVgo Gets DOE Loan To Triple Network Without Issuing Shares; Stock Eyes Buy Point EVgo (EVGO) said late Thursday it has finalized a $1.25 billion, low-interest loan facility from the Department of Energy to finance construction of 7,500 electric vehicle fast-charging stalls by 202 EVgo stock jumped near a buy point after finalizing a Department of Energy loan that will finance construction of 7,500 EV charging stalls."
2024-12-13 17:16:26+00:00,"Stock Market Mixed As Google, Broadcom, Tesla Mask Weakness: Weekly Review The stock market rally saw mixed action, with the Nasdaq hitting a record high while the S&amp;P 500, Dow Jones and Russell 2000 all lost ground. Google-parent Alphabet (GOOGL) took a quantum leap pa The Nasdaq held at highs, but the broader market struggled as yields jumped."
2024-12-13 21:15:30+00:00,"Stock Market Today: Small Caps Fall Again As Major Indexes Close With Minor Moves (Live Coverage) The stock market closed narrowly mixed Friday, with the Dow Jones Industrial Average down 0.2% and the Nasdaq composite up 0.1% after paring gains.
The S&amp;P 500 closed flat. Small caps struggled, Stocks pared early gains in the stock market today and breadth turned negative by more than 2-to-1 on both exchanges."
2024-12-14 01:11:18+00:00,"Dow Jones Futures: Nasdaq Bucks Slide As Fed Meeting Looms; Is Nvidia An AI Laggard? Dow Jones futures will open Sunday evening, along with S&amp;P 500 futures and Nasdaq futures. The final Federal Reserve meeting of 2024 is on tap this week.
The stock market rally had a mixed week. Market breadth was weak with the Dow down 7 straight sessions."
2024-12-14 12:00:00+00:00,"The 7 worst EVs for winter, according to a study Electric vehicles have been heralded as an environmentally friendly alternative to gas-guzzling vehicles, but they may not be suitable for everyone. 
The lithium-ion batteries that power EVs struggl Electric vehicles have been heralded as an environmentally friendly alternative to gas-guzzling vehicles, but they may not be suitable for everyone. Read more..."
2024-12-15 12:00:00+00:00,"Will Sticky Inflation Stop The Fed Rate Cut? Inflation has remained sticky, raising fear that the Federal Reserve could be prevented from further ... [+] interest rate cuts. For example, meat and egg prices are 3.8% higher year-over-year, while Higher inflation and a resilient economy have some wondering if the Fed will cut rates this week. This week will be full of economic data ahead of the Christmas week."
2024-12-15 12:45:03+00:00,"The final Fed meeting of 2024 awaits: What to know this week The stock market rally has stalled as the final Federal Reserve meeting of the year approaches.In the past week, the Nasdaq Composite (^IXIC) was the only of the three major indexes to post a weekly  Investors will be closely watching for any hints on how much further the Federal Reserve plans to lower interest rates in 2025."
2024-12-16 10:00:00+00:00,"What's ahead for the markets in 2025, according to experts U.S. stocks rose in 2024, fueled by the unprecedented surge of artificial intelligence a revolutionary technology that has driven investor sentiment. Inflation also eased after a couple of years of p U.S. stocks rose in 2024, fueled by the unprecedented surge of artificial intelligence — a revolutionary technology that has driven investor sentiment. Inflation also eased after a couple of years of persistent price pressure, allowing the Federal Reserve to …"
2024-12-16 13:00:03+00:00,"The AI Race Is On. Do Ambitious Startups Like OpenAI Stand A Chance Against Big Tech? Two years after OpenAI introduced ChatGPT, the frenzy over artificial intelligence has morphed into a fierce competition between tech industry giants and upstarts.
AI stocks led by Nvidia (NVDA), Mi Will AI model builders OpenAI and Anthropic ever rank among the best AI stocks? Going public may be a challenge as they battle tech incumbents like Google and Meta."
2024-12-16 16:06:22+00:00,"Stock Market Today: Dow Jones Up As Bitcoin Play Pops; Cathie Wood Loads Up On This AI Stock Amid 48% Plunge The Dow Jones Industrial Average inched up in morning trades Monday, helped by Nike (NKE), while other indexes were mixed. Bitcoin play MicroStrategy (MSTR) rose while famed investor Cathie Wood snap The Dow Jones index was steady on the stock market today. MicroStrategy rose on a Nasdaq move. Cathie Wood bought a plunging AI stock."
2024-12-16 17:45:00+00:00,"The Trump administration's billionaires are worth more than $450 billion. Here's who they are Elon Musk is by far the richest individual on Earth and in Trumps orbit. 
He leads or owns electric vehicle company Tesla (TSLA), aerospace firm SpaceX, artificial intelligence startup xAI, which is President-elect Donald Trump likes to surround himself with people he trusts — friends and allies — and people who win. Read more..."
2024-12-17 01:59:18+00:00,"Dow Jones Futures: Nvidia Triggers Sell Signal As Fed Meeting Looms Dow Jones futures, along with S&amp;P 500 futures and Nasdaq 100 futures, were slightly lower ahead of Tuesday's stock market open.
XNOW PLAYINGNasdaq Takes 20,000 On Poor Breadth; Amphenol, Dutch B Alphabet, Amazon, Apple and Tesla all set record highs Monday."
2024-12-17 05:05:29+00:00,"Is CVS Stock A Better Pick Over UNH Stock? WASHINGTON, DC - NOVEMBER 05: Patrons enter a CVS Pharmacy on November 5, 2024 in Washington, DC. ... [+] The pharmacy and other nearby businesses were preemptively boarded out of fear of violence fo UnitedHealth’s better revenue growth and profitability explains the difference between the two."
2024-12-17 10:29:33+00:00,"MicroStrategy's Addition to Nasdaq-100 May Pave Way for S&P 500 Inclusion: Benchmark MicroStrategy's (MSTR) addition to the Nasdaq-100 index is a big deal, but its potential inclusion in the U.S's S&amp;P 500 index could be an even bigger opportunity in the medium-term, broker Benchm The software company's potential addition to the S&P 500 index could be an even larger opportunity in the medium-term, the report said."
2024-12-17 13:28:00+00:00,"Tesla’s stock surge means even the biggest bulls are showing some restraint Better late than never?
Mizuho analyst Vijay Rakesh missed out on the big rally in Tesla Inc. shares 
TSLA this year, by holding a neutral stance on the stock for much of 2024. But he sees more ups A Mizuho analyst upgraded Tesla shares, outlining a rosy bull-case scenario but projecting more limited upside with his base-case price target."
2024-12-17 15:56:15+00:00,Dow Jones Falls As These 2025 Risks Loom; Nvidia Dives On Microsoft News The Dow Jones Industrial Average was headed for its ninth-straight loss as blue chips tumbled more than 200 points in morning action Tuesday. Nvidia (NVDA) buckled again over concerns its voltage dev Dow Jones and other indexes fell after retail sales in the stock market today. Nvidia fell further while Tesla soared to another record high.
2024-12-17 16:06:01+00:00,"Dow Jones Futures Fall Ahead Of Retail Sales; Nvidia Extends Losses The Dow Jones Industrial Average and other major indexes traded lower Tuesday amid November retail sales numbers that gave a mixed picture. An early loser on the stock market today was Nvidia (NVDA), The Dow Jones Industrial Average and other major indexes traded lower Tuesday amid November retail sales numbers that gave a mixed picture. An early loser on the stock market today was Nvidia (NVDA), while Tesla (TSLA) set more record highs Tuesday.
After the…"
2024-12-17 16:06:15+00:00,"5 Things to Know Before the Stock Market Opens U.S. stock futures are lower ahead of retail sales data and the start of the two-day Federal Reserve meeting; bitcoin (BTCUSD) reaches a new high above $107,000 as MicroStrategy (MSTR) continues to b U.S. stock futures are lower ahead of retail sales data and the start of the two-day Federal Reserve meeting; bitcoin (BTCUSD) reaches a new high above $107,000 as MicroStrategy (MSTR) continues to buy the cryptocurrency; Tesla (TSLA) stock adds to its fresh …"
2024-12-17 17:51:57+00:00,"Elizabeth Warren pushes Trump to clear up ethics concerns over Musk's DOGE gig In This Story
Sen. Elizabeth Warren is pushing President-elect Donald Trump to outline and enforce ethics rules on Elon Musk, a key member of his transition team who has been tapped to lead a group  Sen. Elizabeth Warren is pushing President-elect Donald Trump to outline and enforce ethics rules on Elon Musk, a key member of his transition team who has been tapped to lead a group scrutinizing the same federal agencies that regulate his companies.Read mor…"
2024-12-17 19:52:05+00:00,"Tesla clinches another record high after new bullish price targets from Wall Street Tesla stock hit a new all-time high for the fifth day in a row on Tuesday, surging as much as 5% to $483.99.
Gains have continued to roll in for Tesla stock since President-elect Donald Trump won a  Tesla shares hit a record high for the fifth day in a row on Tuesday, boosted by bullish price target upgrades from two Wall Street firms."
2024-12-17 20:00:40+00:00,"Elon Musk Hopes TSLA Stock Will Reach $690 As Analysts Raise Price Target Despite Technical Indicators Flashing Warning Signals Elon Musk Hopes TSLA Stock Will Reach $690 As Analysts Raise Price Target Despite Technical Indicators Flashing Warning Signals
Benzinga and Yahoo Finance LLC may earn commission or revenue on some  Tesla Inc (NASDAQ:TSLA) CEO Elon Musk on Monday expressed hope that the company’s stock will touch $690 in the future, without specifying a timeline. What..."
2024-12-17 20:41:47+00:00,"Why the 'Magnificent 7' rally could be a ‘defensive’ move Decembers market action has been all about a rally from several members of the ""Magnificent Seven"" tech stocks.
Tesla (TSLA), Alphabet (GOOGL, GOOG), Amazon (AMZN), and Apple (AAPL) all hit fresh re Wall Street strategists believe investors are seeking safety in the market's most consistent performers as nervousness grows about the path forward for..."
2024-12-17 22:38:46+00:00,"Dow Jones Futures: Hawkish Fed Rate Cut Due As Nvidia Leads Market Slide; Tesla Keeps Rising Dow Jones futures fell slightly after hours, along with S&amp;P 500 futures and Nasdaq future. The Federal Reserve meeting decision looms Wednesday afternoon, with the a hawkish Fed rate-cut expected The Dow is in its longest losing streak since 1978 as Nvidia woes mount. Tesla runs higher as the Fed decision looms."
2024-12-17 23:08:23+00:00,"Why the Dow is suddenly in a historic funk The Dow Jones Industrial Average (^DJI) is on its worst losing streak in nearly 50 years.
The major index has fallen for nine straight trading days, its largest stretch of consecutive declines since The Dow Jones Industrial Average has fallen for nine straight trading sessions, marking its worst losing streak since 1978."
2024-12-18 07:17:50+00:00,"Trump Team Pushes to Scrap Crash Reporting Rule Opposed by Tesla (TSLA) We recently published a list of Top 10 AI News You Shouldnt Miss. In this article, we are going to take a look at where Tesla, Inc. (NASDAQ:TSLA) stands against other top AI news you shouldnt miss.
 We recently published a list of Top 10 AI News You Shouldn’t Miss. In this article, we are going to take a look at where Tesla, Inc. (NASDAQ:TSLA) stands..."
2024-12-18 11:00:40+00:00,"Big Tech is dominating the market once again — and that's probably just fine: Morning Brief This is The Takeaway from today's Morning Brief, which you can sign up to receive in your inbox every morning along with:
<ul><li>The chart of the day
</li><li>What we're watching
</li><li>What we December is shaping up to be a tale of two markets."
2024-12-18 11:00:40+00:00,"Big Tech is dominating the market once again — and that's probably just fine: Morning Brief This is The Takeaway from today's Morning Brief, which you can sign up to receive in your inbox every morning along with:
<ul> December is shaping up to be a tale of two markets."
2024-12-18 13:22:00+00:00,"Nissan and Mitsubishi stock pop because a Honda mega-merger might be coming In This Story
Nissan Motor (NSANY+11.24%
) stock is booming as the automaker reportedly prepares to explore a merger with Honda Motor (HMC+0.76%
), which would tie up Japans second and third-large Nissan Motor (NSANY) stock is booming as the automaker reportedly prepares to explore a merger with Honda Motor (HMC), which would tie up Japan’s second and third-largest automakers. Read more..."
2024-12-18 13:28:00+00:00,"AT&T is joining Amazon in ordering employees back to the office 5 days a week In This Story
AT&amp;T (T+0.26%
) is jumping on the return-to-office bandwagon. The telecom giant is requiring all of its office workers to head back to the office five days a week starting in Janu AT&T (T) is jumping on the return-to-office bandwagon. The telecom giant is requiring all of its office workers to head back to the office five days a week starting in January, Quartz confirmed. AT&T had formerly implemented a hybrid schedule, requiring just …"
2024-12-19 02:04:09+00:00,"Dow Jones Dives 1,100 Points On Fed Outlook, Tesla Skids; Micron Plunges Late On Earnings Dow Jones futures were little changed overnight, along with S&amp;P 500 futures and Nasdaq futures. Micron Technology (MU) dived late on weak guidance, bad news for the chip sector.
The stock market The Dow Jones lost 1,100 points as the stock market plunged on the Fed rate outlook. Tesla was a big loser. Micron dived late on guidance."
2024-12-19 13:27:25+00:00,"Dow Jones Futures Rebound Ahead Of GDP, Jobless Claims; AI Chip Giant Micron Plunges The Dow Jones Industrial Average and other major indexes traded higher in premarket action Thursday, as stocks looked to bounce back from Wednesday's sell-off. Markets also digested stronger-than-exp Key earnings movers include Micron, Darden Restaurants and Lennar."
2024-12-19 13:32:17+00:00,"Nvidia stock rebounds after broad market rout as analysts stay bullish on outlook Nvidia (NVDA) stock jumped as much as 2.7% early Thursday, as Wall Street analysts reiterated their Buy ratings on the stock despite concerns about rising competition and the possibility that AI chip Nvidia stock rose as Wall Street analysts reiterated their Buy ratings despite concerns about rising competition and the possibility that AI chip demand..."
2024-12-19 15:15:00+00:00,"The Dow rebounds 300 Points as Nvidia and Tesla surge In This Story
The Dow staged a rebound Thursday morning, following Wednesdays 1,100-point plunge that marked its longest losing streak since 1974. The upturn came despite investor disappointment ove The Dow staged a rebound Thursday morning, following Wednesday’s 1,100-point plunge that marked its longest losing streak since 1974. The upturn came despite investor disappointment over the Federal Reserve’s conservative approach to rate cuts. Other major in…"
2024-12-19 15:34:48+00:00,"Dow Jones Tries To Recover After 1,100 Point Drop; Micron Sinks On Earnings But Nvidia Rebounds (Live Coverage) The Dow Jones Industrial Average and other major indexes tried to recover Thursday morning after a brutal day of selling Wednesday, following the Federal Reserve's policy meeting. Micron (MU) tumbled The Dow Jones and S&P 500 try to rebound after a harsh sell-off. Micron tumbled after the company's earnings report while Nvidia climbed."
2024-12-19 21:22:53+00:00,"Tesla: 3 top moments that defined the EV maker in 2024  Tesla (TSLA) has experienced a turbulent year, from unveiling its robotaxi and Optimus robots to its stock surging as CEO Elon Musk emerged as a key figure in President-elect Donald Trump's campaign and cabinet. Yahoo Finance Senior Autos Reporter Pras Subram…"
2024-12-20 03:12:47+00:00,"Jim Cramer on Tesla, Inc. (TSLA): It’s More About the Ethos Than the Cars  "
2024-12-20 10:42:33+00:00,"Tesla recalls nearly 700,000 vehicles in US over tire pressure monitoring system issue (Reuters) -Tesla (TSLA) said on Friday it was recalling 694,304 vehicles in the United States over an issue with the tire pressure monitoring system.
The issue, which affects some Model 3, Model Y a The issue, which affects some Model 3, Model Y and Cybertruck vehicles, will be resolved with an over-the-air software update, the company said.  The tire..."
2024-12-20 13:48:36+00:00,"Stock market today: Dow, S&P 500, Nasdaq futures sell-off as government shutdown looms, inflation data improves but still sticky US stock futures pointed to another rough day on Wall Street Friday after the House of Representatives voted against a Trump-backed spending bill, further increasing the odds of a US government shutd Stocks signaled another rough day of trading on Friday after the House of Representatives voted against a Trump-backed spending bill."
2024-12-20 15:13:17+00:00,"EV Tax Credits: $7,500 Is Up For Grabs. Here's How To Get It. Analysts expect sales of electric vehicles will jump in early 2025, ahead of President-elect Donald Trump's reported plans to cut clean-energy incentives such as the federal EV tax credits in the new Here’s who qualifies and which vehicles can earn you the biggest federal EV tax credit."
2024-12-20 15:58:11+00:00,"Dow Jones Jumps Nearly 400 Points As Government Shutdown Looms; Nvidia Rises While Tesla, Trump Shares Drop (Live Coverage) Volume on the New York Stock Exchange and on the Nasdaq was higher compared with the same time on Thursday. Advancing stocks outnumbered decliners by 4-to-1 on the NYSE and nearly 5-to-2 on the Nasda The Dow Jones rose on the stock market today as a government shutdown looms. Nvidia rose while Tesla fell along with a Trump stock."
2024-12-20 20:58:10+00:00,"Nvidia, Tesla Showcase Timely Tips From Rudolph, Frosty And Scrooge Tis the season to be jolly, thankful and disciplined. And where better to get some timely tips on investing in stocks than the holiday classics ""Rudolph the Red-Nosed Reindeer,"" ""Frosty the Snowman""  Discover timely investing tips from Rudolph, Frosty and Scrooge."
2024-12-21 22:36:46+00:00,"Tesla (TSLA) and LiveOne Achieve 350,000 Subscribers, Enhancing In-Car Entertainment with AI  "
2024-12-22 16:15:36+00:00,Why Tesla (TSLA) Is Among the Best Stocks to Buy and Hold for 3 Years?  
2024-12-23 13:00:17+00:00,"Dow Jones Futures Fall After Funding Bill Averts Shutdown; Nvidia, Tesla Rally The Dow Jones Industrial Average and other major indexes traded mixed Monday in the wake of a funding bill that averted a government shutdown. Nvidia (NVDA) and Tesla (TSLA) were early winners on the Nvidia and Tesla rallied sharply higher, while Apple is at new highs."
2024-12-23 13:25:00+00:00,"Honda, Nissan, and Mitsubishi may merge to compete with Tesla and China's EV makers In This Story
Nissan Motor (NSANY-0.87%
) and Honda Motor (HMC+1.03%
) have officially begun talks to merge by 2026 as Japans automakers seek an edge over tough Chinese rivals and Tesla (TSLA-1.20 Nissan Motor (NSANY) and Honda Motor (HMC) have officially begun talks to merge by 2026 as Japan’s automakers seek an edge over tough Chinese rivals and Tesla (TSLA).Read more..."
2024-12-23 13:28:26+00:00,"Tesla Record Deliveries Expected. This Is Why It Probably Doesn't Matter For TSLA. The fourth quarter is ending soon and Tesla (TSLA) is attempting to shatter its previous delivery record. Analysts see the EV giant setting a new quarterly record for vehicle deliveries, but it remai The company could hit record Q4 deliveries but it may not mean anything for TSLA."
2024-12-23 14:30:52+00:00,"Stock market today: Dow slumps, S&P 500, Nasdaq slip as Wall Street assesses Fed's 2025 rate path Stocks were mixed on Monday as investors considered the path of interest rates next year after the Fed hinted they would stay higher for longer.
The S&amp;P 500 (^GSPC) fell 0.2% while the tech-heav Investors considered the path of interest rates next year after the Fed hinted they would stay higher for longer."
2024-12-23 15:39:42+00:00,"Stock Market Today: Dow Jones Sees Red; Palantir Fades As Tesla Tries To End Losing Streak (Live Coverage) The Dow Jones Industrial Average and other major indexes started the holiday-shortened week lower Monday, after a strong day of gains Friday. Palantir Technologies (PLTR) reached a new high on the st The Dow Jones fell while the S&P 500 struggled to climb on the stock market today. Palantir stock sank as Tesla and Nvidia rose higher."
2024-12-23 16:54:00+00:00,"Stock market ‘Santa Claus rally’ might get a late start this year The stock markets Santa Claus rally could get a late start this year. - AFP via Getty Images
The so-called Santa Claus rally could get off to a late start this year. But better late than never.
A t The Santa Claus Rally could get off to a late start this year. But better late than never."
2024-12-23 17:14:29+00:00,"MicroStrategy's Additional $561M Bitcoin Bet: Bold Move or Bubble Waiting to Burst? MicroStrategy (NASDAQ:MSTR) just made wavesagain. The company dropped a cool $561 million to scoop up another 5,262 BTC, pushing its total Bitcoin (BTC-USD) stash to a jaw-dropping 444,262 coins. Thi Joining Nasdaq 100, MicroStrategy doubles down on Bitcoin with over 444,000 BTC in its arsenal."
2024-12-23 21:10:33+00:00,"This Non-Mag 7 Joins Nvidia, Google, Meta On Leaderboard As Tesla Lurks Enviously Magnificent Seven stocksNvidia (NVDA), Meta Platforms (META) and Alphabet (GOOGL) have secured their spots on IBD Leaderboard, while Tesla (TSLA) looks on longingly on the watchlist. But retail giant As Tesla looks to graduate from the watchlist, this retail giant joins this elite list."
2024-12-23 21:21:29+00:00,"TSLA, LI, or RIVN: Which EV Stock Could Deliver the Highest Upside Potential?  "
