publishedAt,title
2024-11-20 13:22:00+00:00,'Breath of fresh air': Delta's CEO is optimistic about Trump
2024-11-20 17:36:34+00:00,Here's why so many Tesla Cybertrucks are suddenly being spotted in Toronto
2024-11-21 13:00:00+00:00,Which Is A Better Pick: JNJ Stock Or AbbVie?
2024-11-21 15:38:00+00:00,Musk and Ramaswamy's DOGE will work with Marjorie Taylor Greene on cost-cutting
2024-11-21 16:02:00+00:00,Bezos denies Musk's claim he told people to sell Tesla and SpaceX stock since Trump would lose
2024-11-22 10:00:00+00:00,Pick Honeywell Over 3M Stock?
2024-11-22 18:25:00+00:00,3 Nvidia customers have each spent $10 billion on chips this year
2024-11-22 21:50:00+00:00,Relative Strength Line: Good Guide For Buys And Sells In Postelection Bump
2024-11-24 01:08:08+00:00,My Tesla Got Hit — Fix It At A Tesla Certified Repair Or “Regular” Body Shop?
2024-11-24 08:18:06+00:00,Tesla Cybertruck Hate-Love Dynamic Kicks Into Hyperdrive
2024-11-25 10:00:00+00:00,How to invest in Bitcoin and crypto — without actually buying it
2024-11-25 11:35:39+00:00,"Tesla’s $350 billion stock surge driven by ‘animal spirits,’ UBS says"
2024-11-25 14:43:25+00:00,Elon Musk says he's a friend of the environment. But Tesla's factories are racking up pollution violations
2024-11-25 17:20:18+00:00,"Market Clubhouse Morning Memo - November 25th, 2024 (Trade Strategy For SPY, QQQ, AAPL, MSFT, NVDA, GOOGL, META And TSLA)"
2024-11-25 19:20:00+00:00,NASA is making SpaceX fly a Toyota to the moon
2024-11-26 00:17:21+00:00,Dow Jones Futures Fall: Nvidia Stock Tumbles To Key Level; Fed Inflation Data Looms
2024-11-26 10:30:00+00:00,Tesla Stock & Trump: Risks Galore
2024-11-26 15:20:40+00:00,Tesla's exclusion from a new EV proposal could ignite a 'Game of Thrones' style feud
2024-11-26 15:27:05+00:00,Woodward Scores Breakout On Record Report; Musk Taunts F-35 Makers
2024-11-26 20:24:46+00:00,Tesla's exclusion from a new EV proposal could ignite a 'Game of Thrones' style feud
2024-11-27 10:00:06+00:00,BMY Stock vs. JNJ Stock
2024-11-27 12:00:51+00:00,2 bullish charts showing how Block is breaking out post-election
2024-11-27 16:23:00+00:00,Elon Musk's demands for Nvidia's AI chips strained its supply
2024-11-28 10:00:00+00:00,Unilever Vs. PG Stock
2024-11-29 13:39:04+00:00,Dow Jones Futures Rise As Nvidia Rebounds; Tesla Looks To Snap Losing Streak
2024-11-30 15:04:53+00:00,"Elon Musk's 'animal spirits,' Apple misses out, and SpaceX to the moon: Tech news roundup"
2024-11-30 16:09:00+00:00,"‘I’ve nothing saved for retirement’: I’m 50 and earn $45,000. I don’t have a 401(k) match. Should I put 10% of my salary in a Roth IRA instead?"
2024-12-02 10:00:32+00:00,KDP Stock vs. KMB Stock
2024-12-02 13:02:00+00:00,Elon Musk buying Twitter might not have been such a bad move after all
2024-12-02 13:18:00+00:00,5 companies that own the most Bitcoin
2024-12-02 13:37:00+00:00,Jeff Bezos is betting millions on a Nvidia rival
2024-12-02 18:22:04+00:00,The Nasdaq hits a record as Tesla and Intel push tech stocks higher
2024-12-02 21:56:08+00:00,Delaware judge rejects request to restore Musk's $56 billion Tesla pay
2024-12-02 22:22:51+00:00,Delaware judge rejects request to restore Musk's $56 billion Tesla pay
2024-12-02 23:15:00+00:00,Elon Musk's $56 billion pay package is rejected
2024-12-03 12:58:00+00:00,Elon Musk's SpaceX is considering a tender offer at a huge valuation
2024-12-03 13:29:00+00:00,Tesla is ready to fight for Elon Musk's $56 billion payout
2024-12-03 14:15:41+00:00,Is APH Stock A Winner Over Corning?
2024-12-03 14:35:48+00:00,"Stock market today: S&P 500, Nasdaq drift near record levels with JOLTS data on deck"
2024-12-03 15:03:14+00:00,Dow Jones Falls After Jobs Data; Tesla Slides On Elon Musk Pay Package Rejection
2024-12-03 16:23:05+00:00,"Stock market today: Nasdaq drifts near records while S&P 500, Dow fall following key jobs data"
2024-12-03 18:51:22+00:00,"Tesla, Inc. (TSLA) Upgraded by Roth MKM Amid AI-Driven Innovations and Market Optimism"
2024-12-03 19:25:00+00:00,Meta CEO Mark Zuckerberg wants an 'active role' in Trump administration tech policies
2024-12-03 19:56:24+00:00,Elon Musk pay defeat sets up a 2025 legal battle that could reach the Supreme Court
2024-12-04 08:23:22+00:00,The Nasdaq and S&P hit record highs on driven by tech gains
2024-12-04 14:56:25+00:00,Pick This Drone Maker Over AXON Stock?
2024-12-05 18:20:00+00:00,Elon Musk's DOGE has some Democratic friends on Capitol Hill
2024-12-05 19:01:00+00:00,Boeing's 737 Max plea deal was struck down for having too much DEI
2024-12-05 19:27:43+00:00,5 Top Stocks To Buy In December 2024
2024-12-05 20:53:08+00:00,"Jim Cramer on Tesla, Inc. (TSLA) CEO Elon Musk: ‘He May Be The Most Important Man In America For All I Know, As Long As He Stays Tight With Trump’"
2024-12-05 21:20:12+00:00,Is Tesla Stock A Buy Or A Sell After Analyst Hikes Price Target; 'Optimus Is Real'
2024-12-06 12:00:43+00:00,Pick ZS Stock Over F5?
2024-12-06 13:20:00+00:00,Trump taps Elon Musk's ally and venture capitalist David Sacks as AI and crypto czar
2024-12-06 17:22:14+00:00,8 Stocks Drive 50% Of The Year's $11.8 Trillion Stock Gain
2024-12-07 12:34:39+00:00,Jobs Report: Implications For The Markets And The Fed
2024-12-07 17:52:43+00:00,"What Is Tesla, Inc. (TSLA) The Best Lithium and Battery Stocks to Buy Now?"
2024-12-07 18:11:28+00:00,"While Equities Set Records, Employment Trends, Retail Sales Expectations And Rising Delinquencies Advise Caution"
2024-12-08 10:00:00+00:00,Microsoft's shareholders will decide this week whether to invest in Bitcoin
2024-12-09 01:09:35+00:00,How Networks Of Competence Are Crushing Hierarchies Of Authority
2024-12-09 12:37:38+00:00,Dow Jones Futures: Techs Fall As China Probes Nvidia; Beware These Risks
2024-12-09 16:34:00+00:00,Xiaomi's newest Tesla-rivaling EV will launch next summer
2024-12-09 16:42:04+00:00,"Amazon should buy Bitcoin, shareholders say"
2024-12-09 21:02:03+00:00,Tesla Stock Heads Toward 400 For First Time Since 2022
2024-12-09 21:13:33+00:00,Why Tesla (TSLA) Is Among the Best Autonomous Driving Stocks to Buy According to Hedge Funds
2024-12-09 21:46:09+00:00,Ways To Invest In Tesla Beyond Buying TSLA Stock
2024-12-10 01:56:55+00:00,"Dow Jones Futures: AppLovin, Cava, MicroStrategy, Palantir Dive; Nvidia Falls To Support Level"
2024-12-10 09:00:00+00:00,Salesforce vs. Oracle Stock
2024-12-10 15:06:29+00:00,"Sell LULU Stock, Buy EBAY?"
2024-12-10 17:20:00+00:00,Microsoft shareholders vote against Bitcoin investment
2024-12-11 12:16:27+00:00,Why Is Tesla (TSLA) the Best Self-Driving Technology Stock to Buy According to Hedge Funds?
2024-12-11 17:32:06+00:00,"Stock market today: Nasdaq tops 20,000 for first time as Big Tech surge leads stocks higher"
2024-12-12 03:20:42+00:00,Watch These Tesla Stock Price Levels After First Record High in Three Years
2024-12-12 11:00:53+00:00,What Cruise's self-driving end means for Tesla and Waymo: Morning Brief
2024-12-12 11:48:06+00:00,"Dow Jones Futures Fall After Tesla, Titans Push Nasdaq Above 20,000; What To Do Now"
2024-12-12 16:40:00+00:00,Trump says Elon Musk will put America before Tesla or SpaceX
2024-12-13 14:30:00+00:00,Elon Musk wants to make SpaceX's base an official company town
2024-12-13 14:34:16+00:00,"Cathie Wood Sells $15.3 Million Of Tesla, Buys This Surging Drone Stock"
2024-12-13 21:15:30+00:00,Stock Market Today: Small Caps Fall Again As Major Indexes Close With Minor Moves (Live Coverage)
2024-12-14 12:00:00+00:00,"The 7 worst EVs for winter, according to a study"
2024-12-15 12:00:00+00:00,Will Sticky Inflation Stop The Fed Rate Cut?
2024-12-15 12:45:03+00:00,The final Fed meeting of 2024 awaits: What to know this week
2024-12-16 10:00:00+00:00,"What's ahead for the markets in 2025, according to experts"
2024-12-16 13:00:03+00:00,The AI Race Is On. Do Ambitious Startups Like OpenAI Stand A Chance Against Big Tech?
2024-12-16 17:45:00+00:00,The Trump administration's billionaires are worth more than $450 billion. Here's who they are
2024-12-17 05:05:29+00:00,Is CVS Stock A Better Pick Over UNH Stock?
2024-12-17 10:29:33+00:00,MicroStrategy's Addition to Nasdaq-100 May Pave Way for S&P 500 Inclusion: Benchmark
2024-12-17 13:28:00+00:00,Tesla’s stock surge means even the biggest bulls are showing some restraint
2024-12-17 15:56:15+00:00,Dow Jones Falls As These 2025 Risks Loom; Nvidia Dives On Microsoft News
2024-12-17 16:06:01+00:00,Dow Jones Futures Fall Ahead Of Retail Sales; Nvidia Extends Losses
2024-12-17 16:06:15+00:00,5 Things to Know Before the Stock Market Opens
2024-12-17 17:51:57+00:00,Elizabeth Warren pushes Trump to clear up ethics concerns over Musk's DOGE gig
2024-12-17 23:08:23+00:00,Why the Dow is suddenly in a historic funk
2024-12-18 07:17:50+00:00,Trump Team Pushes to Scrap Crash Reporting Rule Opposed by Tesla (TSLA)
2024-12-18 11:00:40+00:00,Big Tech is dominating the market once again — and that's probably just fine: Morning Brief
2024-12-18 13:22:00+00:00,Nissan and Mitsubishi stock pop because a Honda mega-merger might be coming
2024-12-18 13:28:00+00:00,AT&T is joining Amazon in ordering employees back to the office 5 days a week
2024-12-19 13:32:17+00:00,Nvidia stock rebounds after broad market rout as analysts stay bullish on outlook
2024-12-19 15:15:00+00:00,The Dow rebounds 300 Points as Nvidia and Tesla surge
2024-12-19 15:34:48+00:00,"Dow Jones Tries To Recover After 1,100 Point Drop; Micron Sinks On Earnings But Nvidia Rebounds (Live Coverage)"
2024-12-20 03:12:47+00:00,"Jim Cramer on Tesla, Inc. (TSLA): It’s More About the Ethos Than the Cars"
