publishedAt,title
2024-11-21 11:12:56+00:00,"US airline flight crews confident and angry as unions seek richer contracts By Rajesh Kumar Singh
CHICAGO (Reuters) -Alaska Airlines flight attendant Rebecca Owens works 10 hours a day but only gets paid for half that time - a legacy of a common U.S. airline policy to pay c CHICAGO (Reuters) -Alaska Airlines flight attendant Rebecca Owens works 10 hours a day but only gets paid for half that time - a legacy of a common U.S. airline policy to pay cabin crew members only when planes are in motion. Owens, and thousands of cabin cre…"
2024-11-21 15:18:31+00:00,"50 best wellness gifts to encourage a healthy lifestyle You'd think gift-giving would be easy how could giving selflessly ever be a bad thing? but if you're the type who likes to tailor the gifts you give to each individual recipient, it can start to feel The best wellness gifts are all about encouraging a holistically healthy lifestyle — water bottles, sunglasses, cookbooks and herb gardens — we've found the ..."
2024-11-21 17:55:51+00:00,Uber Said in Talks to Invest in US IPO of China’s Pony AI  
2024-11-23 11:30:01+00:00,"Insider Today: Vacation-rental red flags Welcome back to our Saturday edition! Looking for something to do that the whole family would enjoy? BI's movie reviewer said that ""Wicked,"" starring Ariana Grande and Cynthia Erivo, is worth the two In this Saturday edition of Insider Today, we're talking about things you should look for in vacation rentals, and hosting Thanksgiving."
2024-11-24 11:33:01+00:00,"An ex-Meta employee and FIRE blogger explains how he used the 'mega backdoor Roth' strategy that allows high-earners to bypass Roth IRA income limits and contribute up to $69,000 in a 401(k) Andre Nader resides in San Francisco and considers himself 'semi-FIRE'd.'Courtesy of Andre Nader
<ul><li>Andre Nader built a seven-figure portfolio by saving and investing in index funds.</li><li>He While working at Meta, Andre Nader used a strategy known as a mega backdoor Roth to max out tax-advantaged accounts."
2024-11-24 11:41:01+00:00,"Insider Today: White-collar recession Welcome back to our Sunday edition, a roundup of some of our top stories. Cars with a manual transmission now make up a tiny share of autos sold in the US. An updated Porsche 911 Carrera is a reminde In this Sunday edition of Insider Today, we're talking about a tech jobs recession and the effects of Elon Musk's DOGE."
2024-11-24 15:39:48+00:00,"AI leaders are starting to rethink the best way to advance AI Andriy Onufriyenko/Getty
<ul><li>AI leaders are rethinking data-heavy training for large language models.</li><li>Traditional models scale linearly with data, but this approach may hit a dead end.</ AI leaders are rethinking the conventional wisdom about how to train large language models."
2024-11-25 10:07:01+00:00,"'It's Trump 5.0': Lobbyists reveal how Trump is changing the influence game As Donald Trump returns to the White House promising to obliterate business as usual in Washington, the city's lobbyists are preparing for a seismic shift in how and where they do business.
""Florida K Street lobbyists are flocking to Florida, as the nexus of power under Donald Trump shifts from Washington to Palm Beach."
2024-11-25 11:11:25+00:00,"Is Uber Technologies (UBER) the Best Stock to Invest in for the Next 3 Months? <ul><li>Morgan Stanley's Global Investment Committee advises investors to approach current market trends cautiously due to three primary risks: stretched equity valuations, ambitious corporate earnin We recently published a list of 12 Best Stocks to Invest in for the Next 3 Months. In this article, we are going to take a look at where Uber Technologies..."
2024-11-25 14:15:55+00:00,"Travis Kalanick, Marc Andreessen, and other Silicon Valley leaders are reportedly getting involved with Elon Musk's DOGE Donald Trump has assigned Elon Musk to create DOGE, an advisory group to cut government waste. Brandon Bell/Getty Images
<ul><li>Elon Musk and Vivek Ramaswamy are making plans for The Department of  Notable Silicon Valley figures like Joe Lonsdale and Marc Andreessen are involved in DOGE's planning, The Wall Street Journal reported."
2024-11-25 17:15:14+00:00,"Is Warren Buffett Preparing For A Market Downturn With Berkshire Hathaway's $325B Cash Pile? Is Warren Buffett Preparing For A Market Downturn With Berkshire Hathaway's $325B Cash Pile?
Berkshire Hathaway Inc. (NYSE:BRK) (NYSE:BRK) has amassed a staggering $325 billion cash reserve, its lar Berkshire Hathaway Inc. (NYSE:BRK) (NYSE:BRK) has amassed a staggering $325 billion cash reserve, its largest ever, and nearly double the previous year's..."
2024-11-26 10:04:02+00:00,"I worked at Google and Meta: Here's the résumé that helped me land jobs at both companies I was able to land a six-figure role at Google as a global product lead and Meta as a business planning and operations lead. I also made it to the final rounds at highly competitive tech companies li Former Google and Meta employee, Andrew Yeung shared résumé tips along with the template that helped him land six-figure roles in Big Tech."
2024-11-26 12:30:00+00:00,"Wall Street’s Uber Bull Tom Lee Makes Next Bold Bet in ETF Era (Bloomberg) Wall Street prognosticators tend to huddle around the consensus, afraid to stand out for fear of being wrong. Then theres Tom Lee.
Most Read from Bloomberg
The chief investment officer  (Bloomberg) -- Wall Street prognosticators tend to huddle around the consensus, afraid to stand out for fear of being wrong. Then there’s Tom Lee.Most Read..."
2024-11-26 15:07:43+00:00,Uber’s Gig Workers Now Include Coders for Hire on AI Projects (Bloomberg) -- Uber Technologies Inc.s gig-economy workforce now includes programmers. The company is expanding beyond its rideshare roots to enter a hot new market: helping other businesses outsourc (Bloomberg) -- Uber Technologies Inc.’s gig-economy workforce now includes programmers. The company is expanding beyond its rideshare roots to enter a hot...
2024-11-27 08:36:11+00:00,"Why the $72 billion software company Workday is psyched about DOGE Workday's CEO sees an opportunity with President-elect Trump's plan to reshape the federal government.Kevin Dietsch/Getty Images
<ul><li>Musk and Ramaswamy have plans for the DOGE, and Workday sees  ""With DOGE coming out, people are absolutely looking to drive more economies of scale and more efficiency,"" Workday's CEO said on Tuesday."
2024-11-27 10:34:33+00:00,"China's robotaxi startup Pony AI raises $260 million in US IPO Pony AI, a China-based robotaxi company, has raised $260 million in its US initial public offering, valuing the company at around $4.55 billion. The company sold 20 million American depositary shares It sold 20 million American depositary shares in the offering priced to investors at $13 each, the high-end of its targeted range.  Pony AI's listing may..."
2024-11-27 11:45:00+00:00,"Move Over, Uber. Billionaire David Tepper Just Raised Appaloosa's Stake in This Other Ride-Hailing Stock By 98%.  "
2024-11-27 19:11:04+00:00,"Uber faces FTC consumer protection probe over subscriptions (Bloomberg) The US Federal Trade Commission is looking into whether Uber Technologies Inc (UBER). violated consumer protection laws with its flagship subscription service.
The FTC is investigating U (Bloomberg) -- The US Federal Trade Commission is looking into whether Uber Technologies Inc. violated consumer protection laws with its flagship..."
2024-11-27 19:33:06+00:00,"I tried Dolly Parton's new mac and cheese recipe. It's the perfect Thanksgiving comfort dish. Dolly Parton's mac and cheese is a great Thanksgiving dish.Jon Morgan/CBS via Getty Images
<ul><li>Dolly Parton once told me she's a huge fan of mac and cheese and loves making it at home.</li><li>N Dolly Parton told Business Insider that she loves making mac and cheese. Her Thanksgiving recipe features three different types of cheese."
2024-11-27 19:39:54+00:00,Coroner identifies Uber driver killed in ‘road rage’ incident on Las Vegas Strip  
2024-11-27 23:24:53+00:00,The FTC is investigating Uber for its subscription policies  
2024-11-28 06:54:58+00:00,Uber questioned by US regulator over subscription plan  
2024-11-28 15:23:29+00:00,"Elastic N.V. (ESTC) Expands AWS Partnership to Enhance Observability for Generative AI with Amazon Bedrock We recently compiled a list of the 15 Buzzing AI Stocks Making Headlines. In this article, we are going to take a look at where Elastic N.V. (NYSE:ESTC) stands against the other buzzing AI stocks.
P We recently compiled a list of the 15 Buzzing AI Stocks Making Headlines. In this article, we are going to take a look at where Elastic N.V. (NYSE:ESTC..."
2024-11-28 19:50:23+00:00,"NVIDIA Corporation (NVDA) Supply Chain Boosted by Vishay’s Strong Orders for AI Servers and RTX 50 Series We recently compiled a list of the 15 AI Stocks on Wall Street's Radar. In this article, we are going to take a look at where NVIDIA Corporation (NASDAQ:NVDA) stands against the other AI stocks.
Ube We recently compiled a list of the 15 AI Stocks on Wall Street’s Radar. In this article, we are going to take a look at where NVIDIA Corporation (NASDAQ:NVDA..."
2024-11-28 21:00:14+00:00,"1 In 5 Dollars The Government Expends Goes To Repaying Investors. Here's Why This Spells Trouble For Trump And DOGE 1 In 5 Dollars The Government Expends Goes To Repaying Investors. Here's Why This Spells Trouble For Trump And DOGE
As of today, the U.S. debt has skyrocketed to $36 trillion and around one in every As of today, the U.S. debt has skyrocketed to $36 trillion and around one in every five dollars the government spends goes straight into repaying investors. ..."
2024-11-29 01:11:02+00:00,"5 ways to cut costs and save money in 10 minutes or less Affiliate links for the products on this page are from partners that compensate us and terms apply to offers listed (see our advertiser disclosure with our list of partners for more details). However You can find ways to save money in just a few minutes a day, starting with automatic transfers and some phone calls."
2024-11-29 09:14:42+00:00,"Didi Again Records a Profit While It Prepares for Hong Kong IPO (Bloomberg) -- Didi Global Inc. posted its second straight quarterly profit, a boost for the Chinese ride-hailing leader as it contemplates a potential re-listing in Hong Kong.
Most Read from Bloomb (Bloomberg) -- Didi Global Inc. posted its second straight quarterly profit, a boost for the Chinese ride-hailing leader as it contemplates a potential re..."
2024-11-29 10:47:01+00:00,"The app gold rush 'is kind of over,' Procreate CEO says. Here's his advice if you're thinking of making an app. Procreate CEO James Cuda told Business Insider that VC funding for apps has ""dried up.""Igor Golovniov/SOPA Images/LightRocket via Getty Images
<ul><li>Procreate CEO James Cuda said VC funding for ap Procreate CEO James Cuda said there's still room to create ""incredible"" apps but founders won't find success by following trends."
2024-11-29 12:41:01+00:00,"Black Friday gift card deals: Discounts from Uber, Nintendo, and StubHub When you buy through our links, Business Insider may earn an affiliate commission. Learn more
Black Friday deals are in full swing, with most retailers offering their biggest price drops of the year Black Friday gift card deals offer excellent bang for your buck and make great gifts for the holiday season. Here are the best available now."
2024-11-29 15:14:45+00:00,"From Marc Andreessen to Sriram Krishnan, these are all the Silicon Valley leaders linked with Elon Musk's DOGE Elon Musk is set to lead the Department of Government Efficiency.ANGELA WEISS / AFP via Getty Images
<ul><li>Donald Trump has tapped Elon Musk and Vivek Ramaswamy to lead the Department of Governmen Donald Trump has tapped Elon Musk and Vivek Ramaswamy to lead the Department of Government Efficiency."
2024-11-29 18:15:17+00:00,"My 85-Year-Old Mother Has Dementia And Loves Going To The Casino – Suze Orman Advises On How To Handle The Situation On a recent episode of Women &amp; Money, financial expert Suze Orman tackled a heartfelt question from Sabrina, a listener grappling with a challenging situation involving her 85-year-old mother. Th On a recent episode of Women & Money, financial expert Suze Orman tackled a heartfelt question from Sabrina, a listener grappling with a challenging..."
2024-11-29 20:51:53+00:00,"A veteran strategist sees an 'extraordinary' S&P 500 surge ahead — and shares 3 top ways to invest your money A red-hot S&amp;P 500 will defy the odds again by continuing to sprint higher in 2025, says Mary Ann Bartels, the chief market strategist at Indianapolis-based Sanctuary Wealth. She expects the index An uber-bullish strategy chief predicts that the S&P 500 as high as 7,400 by the end of next year. Here's how investors can prepare for takeoff."
2024-11-30 02:54:12+00:00,"Remote workers are swapping commute hours for side hustles Remote workers are more likely to have side gigs than their office-based peers 34% versus 29% according to a new LinkedIn Workforce Confidence survey of 8,606 US professionals.
The trend toward addi Remote workers are more likely to have side gigs than in-person or hybrid peers, and it may be due to commute times or productivity differences."
2024-11-30 13:15:01+00:00,"Longtime Tesla investor Ross Gerber on why Musk's ties to Trump might not boost the EV maker Elon Musk spent immense money and energy helping Donald Trump retake the White House, but the Tesla CEO's new political influence may not do much to boost the fortunes of his carmaker, one of the com Gerber has grown skeptical of Musk's other ventures in recent years, and has said previously that his side projects are hurting the Tesla brand."
2024-12-02 09:30:00+00:00,"China's Meituan to expand Keeta food delivery service to more Middle East cities, sources say Chinese food delivery giant Meituan, which operates the Keeta brand in Hong Kong and Saudi Arabia, is set to expand to more Middle Eastern and North African countries, according to two sources famili Chinese food delivery giant Meituan, which operates the Keeta brand in Hong Kong and Saudi Arabia, is set to expand to more Middle Eastern and North African ..."
2024-12-02 10:06:01+00:00,"I got a bad performance review at work and lost 15 pounds. It was stressful, but I learned how to avoid it in the future. The woman pictured is not the author.ingwervanille/Getty Images
<ul><li>A poor performance review at work led to significant stress and weight loss for the author.</li><li>The review was unexpected, A bad performance review at work led to stress and weight loss, but taught valuable lessons in self-advocacy and career management."
2024-12-02 12:49:14+00:00,"Delivery firm Glovo riders in Spain to become employees Yahoo is using AI to generate takeaways from this article. This means the info may not always match what's in the article. Reporting mistakes helps us improve the experience.Generate Key Takeaways
A App-based food delivery firm Glovo's freelance riders in Spain will be hired as employees following pressure from the government to give them labour..."
2024-12-02 13:00:19+00:00,10 REITs To Supercharge Your Portfolio With Up To 18.6% Yield Benzinga and Yahoo Finance LLC may earn commission or revenue on some items through the links below.Investors aiming to boost their investment income may find real estate investment trusts (REITs) at Investors aiming to boost their investment income may find real estate investment trusts (REITs) attractive. REITs own or finance income-generating real...
2024-12-02 13:33:41+00:00,"Uber launches boat hailing service on Kashmir's scenic Dal Lake By Fayaz Bukhari
SRINAGAR, India (Reuters) - Uber launched a water transport hailing service on scenic Dal Lake in India's Kashmir region on Monday, offering rides on boats popular with tourists.
U Uber launched a water transport hailing service on scenic Dal Lake in India's Kashmir region on Monday, offering rides on boats popular with tourists.  The..."
2024-12-02 15:03:53+00:00,"AI Stock Nebius Group Jumps After Nvidia Joins $700 Million Investment AI infrastructure player Nebius Group (NBIS) is raising $700 million through a private placement from a group of investors that includes Nvidia (NVDA). Nebius stock jumped on the news.
The Netherlan Nebius stock jumped on the news that Nvidia had joined a $700 million private placement for Nebius Group, which offers AI infrastructure."
2024-12-02 16:01:56+00:00,Uber now offers boat hailing in India  
2024-12-02 20:06:03+00:00,"Former Meta exec says the company's failed crypto project was '100% a political kill' by regulators Meta's former head of its Libra project says roadblocks from regulators effectively shut down the company's cryptocurrency effort and the way he sees it, it was ""100% a political kill.""
Libra was a  David Marcus, who led the Facebook project, reflected on its demise in a social media post titled ""How Libra Was Killed."""
2024-12-03 14:00:45+00:00,"You Buy Products From These Dual Dividend Aristocrat and Dividend King Stocks Every Day – Why Not Earn Passive Income On Their Shares? Benzinga and Yahoo Finance LLC may earn commission or revenue on some items through the links below.
Have you ever looked high and low for something without realizing it was right in front of you th Have you ever looked high and low for something without realizing it was right in front of you the entire time? It's a surprisingly common situation..."
2024-12-03 20:08:52+00:00,"A former homeowner on track to retire early explains why he switched to renting and isn't incorporating real estate in his investment strategy Andre Nader has been both a homeowner and a landlord and neither are for him, at least at this moment in time.
Shortly after getting married in 2012, he and his wife bought a home in Austin. When th ""Right now, San Francisco really favors renting. It's really hard from a pure numbers standpoint to make owning make sense."""
2024-12-04 14:54:28+00:00,Judge demands woman accused of fatally shooting El Paso Uber driver to appear for trial  
2024-12-04 16:45:19+00:00,"Musk's $119 Billion Wealth Increase Outpaces Dell and Zuckerberg, But Guess Who's Catching Up Musk's $119 Billion Wealth Increase Outpaces Dell and Zuckerberg, But Guess Who's Catching Up
Elon Musk is on another level this year. The Tesla and SpaceX CEO added $119 billion to his fortune in 2 Elon Musk is on another level this year. The Tesla and SpaceX CEO added $119 billion to his fortune in 2024. This pushed his net worth to $348 billion..."
2024-12-05 00:30:36+00:00,'Had To Uber To The Funeral Home And Beg For A Ride' – This Family Says Dave Ramsey's No-Credit Advice Failed Them  
2024-12-05 10:32:01+00:00,"Scared your partner is cheating? Strangers on the internet are here to help — for a fee Getty Images; iStock; Natalie Ammari/BI
<ul><li>Some people are turning to ""loyalty tests"" to check if their partners are cheating.</li><li>Companies are cashing in, connecting users to testers for  Loyalty tests have become a popular way to see if a partner is cheating, and companies are cashing in. A therapist says they are rarely a good thing."
2024-12-05 15:00:46+00:00,"Club World Cup draw: Messi, Inter Miami get winnable group, Seattle gets PSG and tough road Manchester City will play Juventus, and the Seattle Sounders will face PSG and Atlético Madrid, in the inaugural Club World Cup, which began to take shape at a draw Thursday in Miami.
The 32 partici The 2025 Club World Cup draw took place Thursday in Miami."
2024-12-05 15:20:23+00:00,"Trump just gave a new signal he isn't going to let up on Big Tech President-elect Donald Trump is making it clear he doesn't intend to ease up on the nation's technology giants once he is back in the Oval Office.
The latest sign came Wednesday when he said he woul President-elect Donald Trump is making it clear he doesn't intend to ease up on the nation's technology giants once he is back in the Oval Office."
2024-12-05 20:28:10+00:00,"Oracle Earnings Due Soon. Can Tech Giant Keep Its Huge Rally Rolling? Oracle stock has been partying like its 1999 but its big rally will be put to the test soon. Oracle (ORCL) reports its fiscal second-quarter earnings late Monday.
The database software company is on Oracle stock is having its best year since 1999. But its earnings report Monday will test that rally. Here's what to expect."
2024-12-05 21:20:12+00:00,"Is Tesla Stock A Buy Or A Sell After Analyst Hikes Price Target; 'Optimus Is Real' Tesla (TSLA) is on a 40% tear since Donald Trump's election win, as investors speculate that self-driving is coming soon, with the Trump administration easing the regulatory path for autonomous vehic Tesla stock has rallied 40% since Donald Trump won the presidential election."
2024-12-05 22:50:14+00:00,"NYC Mayor Eric Adams Takes Victory Lap: 'Remember Y'All Laughed When I First Got My Bitcoin? Who's Laughing Now?' NYC Mayor Eric Adams Takes Victory Lap: 'Remember Y'All Laughed When I First Got My Bitcoin? Who's Laughing Now?'
New York City Mayor Eric Adams is seizing the moment as Bitcoin's (CRYPTO: BTC) valu New York City Mayor Eric Adams is seizing the moment as Bitcoin's (CRYPTO: BTC) value edges closer to the $100,000 mark, up 129% this year. At a press..."
2024-12-06 01:29:06+00:00,"Trump picks David Sacks as the White House's AI and crypto czar President-elect Donald Trump has named David Sacks as his White House artificial intelligence and crypto czar.
The entrepreneur served as chief operating officer for Elon Musk and Peter Thiel's PayP The former PayPal COO has close ties with Elon Musk and Peter Thiel."
2024-12-06 09:53:00+00:00,Toast and Uber Direct extend US partnership to boost delivery options  
2024-12-06 13:52:08+00:00,"Uber Launches First International Robotaxis, Shares Regain Some Ground Uber Technologies (UBER) said Friday it is now offering autonomous vehicles on its app in Abu Dhabi through a partnership with China mobility company WeRide (WRD). Uber stock regained some ground in  Uber stock gained after launching robotaxis in Abu Dhabi, in partnership with WeRide. Shares lost 10% on Waymo expansion news a day earlier."
2024-12-06 17:15:15+00:00,"'$72,000 For A Kia?' – Dave Ramsey Tells Florida Woman 'We'll Call That Debt A Stupid Tax' After Husband Buys EV Now Worth Only Half That Buying a car shouldn't feel like financial quicksand but for Ashley from Jacksonville, Florida, that's exactly what happened when her husband's $72,000 impulse buy turned their financial picture upsi Buying a car shouldn't feel like financial quicksand – but for Ashley from Jacksonville, Florida, that's exactly what happened when her husband's $72,000..."
2024-12-08 09:11:01+00:00,"A FIRE blogger who built a 7-figure net worth shares 3 books that changed his money mindset At 37, Andre Nader has enough in savings that he doesn't expect to ever have to work a 9-to-5 again.
After 15 years working in tech nine of which were at Meta he was laid off in 2023. Rather than jo A former Meta employee who writes about financial independence full-time shares his top book recommendations, including Jack Bogle's ""Enough."""
2024-12-08 09:50:02+00:00,"I launched a startup after pivoting my career in my 40s. Here's what I've learned about securing investment from big names like Uber. Tiya Gordon pivoted from her career in design to launch an electric vehicle charging startup.Deborah Feingold Photography
<ul><li>Tiya Gordon worked in design before she pivoted to cofounded It's El 45-year-old Tiya Gordon was a successful designer before she pivoted careers and cofounded a startup that makes EV charging more accessible."
2024-12-09 17:37:50+00:00,Kentucky woman charged in fatal Uber shooting collapses in El Paso courtroom  
2024-12-09 21:17:35+00:00,"Oracle Posts Lackluster Growth, Denting Cloud Unit Enthusiasm (Bloomberg) -- Oracle Corp. reported quarterly revenue in line with estimates, disappointing investors who have boosted the stock to a record high in recent weeks on enthusiasm for the companys ascen (Bloomberg) -- Oracle Corp. reported quarterly revenue in line with estimates, disappointing investors who have boosted the stock to a record high in recent ..."
2024-12-11 05:44:45+00:00,"GM gives up on robotaxis after a string of troubles with Cruise General Motors is giving up on Cruise's robotaxi focus after eight years of pouring money into the commercial business.
GM said on Tuesday that it will no longer fund Cruise's robotaxi development w General Motors is pulling out of robotaxis after eight years of pouring money into Cruise's commercial business."
2024-12-11 14:32:22+00:00,"GM's Cruise U-turn is a sign of just how hard the robotaxi game really is A Cruise robotaxi in San Francisco.Anadolu Agency/Getty Images
<ul><li>General Motors just pulled the plug on Cruise's robotaxi dreams.</li><li>The self-driving venture has been in doubt since a ped After GM pulled the plug on its robotaxi dreams, one expert says driverless cabs remain ""really more hype than reality."""
2024-12-11 16:45:17+00:00,"A Crypto Tycoon and Luxury Property Investor's $36 Million Manhattan Glass Box Penthouse Gets Listed By Netflix Realty Star Ryan Serhant A Crypto Tycoon and Luxury Property Investor's $36 Million Manhattan Glass Box Penthouse Gets Listed By Netflix Realty Star Ryan Serhant
Australian crypto entrepreneur Kain Warwick became famous for Australian crypto entrepreneur Kain Warwick became famous for his company Synthetix. Still, there’s nothing fake about the glass Manhattan penthouse he has..."
