publishedAt,title
2024-12-11 17:00:53+00:00,"4 Ways To Boost Your Income by $50 a Day and Save for a House in 2 Years ©Shutterstock.com
According to the National Association of Realtors (NAR) 2024 Profile of Home Buyers and Sellers report, the median age for a first-time homebuyer reached an all-time high of 38. Th According to the National Association of Realtors (NAR) 2024 Profile of Home Buyers and Sellers report, the median age for a first-time homebuyer reached an ..."
2024-12-12 17:23:29+00:00,"Mexican police arrest 3 taxi drivers near Cancun for threatening a tourist who used a ride-share app MEXICO CITY (AP) Mexico's police have arrested three taxi drivers have been arrested in Puerto Morelos, just south of the resort of Cancun, for threatening a tourist for using a rides-hare app.
Driv Mexico's police have arrested three taxi drivers have been arrested in Puerto Morelos, just south of the resort of Cancun, for threatening a tourist for..."
2024-12-13 09:01:02+00:00,"The battle between human and robot ride-hailing drivers hinges on airports Uber and Lyft drivers could see their earnings take a hit if Waymo One's robotaxis continue getting access to airports.Waymo
<ul><li>Waymo One's robotaxis could threaten Uber and Lyft drivers' earni Waymo One's robotaxis could already be impacting the earnings of Uber and Lyft drivers.  Some drivers are concerned about an expansion to airports."
2024-12-13 10:05:01+00:00,"A 5-step end-of-year networking checklist to keep connections warm as you head into 2025 LinkedIn; Getty Images; Chelsea Jia Feng/BI
<ul><li>Susie Moore, a life coach, moved to NYC and landed a tech job by leveraging mutual connections.</li><li>Networking to set yourself up for a future Susie Moore networked her way into a tech job without a college degree. Here are her 5 ways to step up your networking game before the new year."
2024-12-13 15:11:47+00:00,"Uber, Amazon, DoorDash Remain Analyst's Top Picks Into 2025. But Watch These 'Wild Cards.' Uber (UBER), Amazon[ticker symb=AMZN] and DoorDash (DASH) are the top large-capitalization stock picks for internet industry analysts at Evercore ISI, according to a new analyst note late Thursday.
 Amazon stock, along with Uber and DoorDash, are the top picks heading into 2025 for Evercore ISI analyst Mark Mahaney."
2024-12-13 16:45:20+00:00,"This CEO's Journey From Rock Bottom To $100M Success: ""I Hated My Job, Quit In Secret and Built Showpo Over Glasses Of Red Wine"" This CEO's Journey From Rock Bottom To $100M Success: ""I Hated My Job, Quit In Secret and Built Showpo Over Glasses Of Red Wine""
Jane Lu never imagined that her dreams of corporate power suits and c Jane Lu never imagined that her dreams of corporate power suits and city skyscrapers would one day give way to running a $100 million fashion retail company,..."
2024-12-13 17:16:26+00:00,"Stock Market Mixed As Google, Broadcom, Tesla Mask Weakness: Weekly Review The stock market rally saw mixed action, with the Nasdaq hitting a record high while the S&amp;P 500, Dow Jones and Russell 2000 all lost ground. Google-parent Alphabet (GOOGL) took a quantum leap pa The Nasdaq held at highs, but the broader market struggled as yields jumped."
2024-12-13 18:51:29+00:00,"Anyone can give Donald Trump $1 million. The pros do it in public. Tech moguls are lining up to give Donald Trump money — and, crucially, to make sure everyone knows about it.Joe Raedle/Getty Images
<ul><li>It's not new for rich people and big companies to donate t Sometimes people like to give away money anonymously. But for Big Tech CEOs trying to get on Trump's good side, that's no good, Peter Kafka writes."
2024-12-13 19:24:22+00:00,Short Term Headwinds Make Uber Technologies (UBER) Stock A Buy  
2024-12-14 11:00:40+00:00,"The mysterious ideology of Luigi Mangione: Anti-corporate hero? Far-right tech bro? Yahoo is using AI to generate takeaways from this article. This means the info may not always match what's in the article. Reporting mistakes helps us improve the experience.Generate Key Takeaways
W The 26-year-old former data engineer's political ideology, steeped in a hodgepodge of online Silicon Valley tech philosophy and heterodox ideas, defies neat ..."
2024-12-15 13:16:01+00:00,"The 15 best modern Christmas songs to add to your holiday playlist Taylor Swift, Sabrina Carpenter, and Beyoncé.Theo Wargo/Getty Images; Netflix; KMazur/WireImage
<ul><li>Modern Christmas songs are gaining popularity alongside classic holiday tracks.</li><li>Artist Here's the best modern and new Christmas music to refresh your holiday playlist in 2024, featuring hits from Justin Bieber, Taylor Swift, Sabrina Carpenter, and more."
2024-12-15 14:17:02+00:00,"My daughter got her first job at 14. Everything changed when she became a teen with extra money, so I had to help her save. The author's daughter (not pictured) is a teen who just got her first job.StockPlanets/Getty Images
<ul><li>My teenage daughter needed logistical and emotional support to thrive in her first job.</l When my teenage daughter started working, I didn't know she would need so much support. I had to drive her to work and I had to help her save money."
2024-12-16 03:24:01+00:00,"Grab Stock’s Big Quarter Has Some Analysts Seeing Further Gains (Bloomberg) -- Grab Holdings Ltd.s ability to cut costs and edge out rivals in Southeast Asias ride-hailing arena helped push its share performance above global peers this quarter, with some analysts (Bloomberg) -- Grab Holdings Ltd.’s ability to cut costs and edge out rivals in Southeast Asia’s ride-hailing arena helped push its share performance above..."
2024-12-16 03:24:01+00:00,"Grab Stock’s Big Quarter Has Some Analysts Seeing Further Gains (Bloomberg) -- Grab Holdings Ltd.s ability to cut costs and edge out rivals in Southeast Asias ride-hailing arena helped push its share performance above global peers this quarter, with some analysts (Bloomberg) -- Grab Holdings Ltd.’s ability to cut costs and edge out rivals in Southeast Asia’s ride-hailing arena helped push its share performance above..."
2024-12-16 05:11:00+00:00,"As schools cut back on bus service, parents are turning to rideshare apps Yahoo is using AI to generate takeaways from this article. This means the info may not always match what's in the article. Reporting mistakes helps us improve the experience.Generate Key Takeaways
C Ismael El-Amin was driving his daughter to school when a chance encounter gave him an idea for a new way to carpool.  On the way across Chicago, El-Amin’s..."
2024-12-16 05:11:00+00:00,"As schools cut back on bus service, parents are turning to rideshare apps CHICAGO (AP) Ismael El-Amin was driving his daughter to school when a chance encounter gave him an idea for a new way to carpool.
On the way across Chicago, El-Amins daughter spotted a classmate rid Ismael El-Amin was driving his daughter to school when a chance encounter gave him an idea for a new way to carpool.  On the way across Chicago, El-Amin’s..."
2024-12-16 10:05:02+00:00,"I'm a retiree who assembles furniture on Taskrabbit to avoid draining my retirement fund. At 79, I also like having structure and meeting new people. This as-told-to essay is based on a conversation with Dan Weiss, a 79-year-old Tasker on Taskrabbit in Oakdale, Minnesota. It has been edited for length and clarity.
I joined Taskrabbit in 2021 and  Dan Weiss was only retired for six months before he realized he needed structure. He made $47,000 on Taskrabbit last year building furniture."
2024-12-16 10:33:00+00:00,"Down 27%, Is Uber Stock an Incredible Buying Opportunity Before the End of 2024?  "
2024-12-17 11:01:22+00:00,"3 US Growth Companies With High Insider Ownership Growing Revenues Up To 56% Three US growth companies with high insider ownership are highlighted for their strong revenue growth potential. Cipher Mining is expected to grow revenue by 56.9% annually, driven by its expansion o As the Nasdaq Composite reaches new heights and the Dow Jones Industrial Average experiences a consecutive losing streak, investors are closely watching..."
2024-12-17 12:00:19+00:00,"Nothing Works The Same Way Forever – Why Jim Cramer Says You Must Always Be Ready And Willing To Adjust Your Trading Strategy Benzinga and Yahoo Finance LLC may earn commission or revenue on some items through the links below.
A wise man once said, ""Change is the only constant in life."" Although it may sound counterintuiti A wise man once said, ""Change is the only constant in life."" Although it may sound counterintuitive, almost anyone who has made it to old age will tell you..."
2024-12-17 13:00:00+00:00,"Exclusive: Crypto startup BVNK raises $50 million at around $750 million valuation amid red-hot stablecoin interest As crypto prices soar to all-time highs, venture investors are pouring capital into a red-hot corner of the blockchain industry: infrastructure for stablecoins, which are cryptocurrencies designed to Stripe’s acquisition of the stablecoin company Bridge has created investor fervor around infrastructure providers."
2024-12-17 17:00:19+00:00,"Robert Kiyosaki Warns Baby Boomers Will Be 'Biggest Losers'– Suggests Kids 'Nudge' Parents To Sell Their Homes, Stocks And Bonds 'Now' Benzinga and Yahoo Finance LLC may earn commission or revenue on some items through the links below.
Robert Kiyosaki Warns Baby Boomers Will Be Biggest Losers' Suggest Kids Nudge' Parents To Sell Th Robert Kiyosaki Warns Baby Boomers Will Be ‘Biggest Losers'– Suggest Kids ‘Nudge' Parents To Sell Their Homes And Assets Before It's Too Late Robert Kiyosaki..."
2024-12-17 20:30:19+00:00,"Move Over 'Rage Applying' And 'Quiet Quitting,' 2025 Will Be The Year Of 'Revenge Quitting' Move Over 'Rage Applying' And 'Quiet Quitting,' 2025 Will Be The Year Of 'Revenge Quitting'
Over the past few years, peoples feelings about their jobs have changed dramatically. Initially, there was Over the past few years, people’s feelings about their jobs have changed dramatically. Initially, there was “rage applying,” where employees who were angry..."
2024-12-17 20:49:38+00:00,"Grubhub To Pay $25 Million Over Allegations Of Deceptive Practices CHICAGO Grubhub will pay $25 million to resolve allegations from the Federal Trade Commission and the Illinois Attorney General that the Chicago-based food delivery company engaged in deceptive and u Federal regulators alleged the Chicago-based delivery company hid fees, blocked accounts and listed restaurants without their approval."
2024-12-17 21:57:20+00:00,"Factbox-Corporate America pledges donations for Trump's inauguration (Reuters) - Companies ranging from finance majors to Silicon Valley behemoths are pledging donations to Donald Trump's inaugural fund as business leaders rush to ensure a favorable relationship with  Trump is set to take office in January and executives are hoping a positive rapport with his administration, such as the one Tesla boss Elon Musk has..."
2024-12-17 21:57:20+00:00,"Factbox-Corporate America pledges donations for Trump inauguration (Reuters) - Companies ranging from finance majors to Silicon Valley behemoths are pledging donations to Donald Trump's inaugural fund as business leaders rush to ensure a favorable relationship with  Trump is set to take office in January and executives are hoping a positive rapport with his administration, such as the one Tesla boss Elon Musk has..."
2024-12-18 10:00:01+00:00,"33 women in venture capital who made partner or higher at firms like Andreessen Horowitz and IVP in 2024 Zoe Perret, Yuri Lee, and Jennifer Li.Initialized Capital; IVP; Andreessen Horowitz
<ul><li>Women are gaining ground in venture capital, with more becoming partners in 2024.</li><li>In 2023, women h In 2024, venture capital heavyweights like Andreessen Horowitz, Insight Partners, and IVP elevated women investors to partner positions."
2024-12-18 11:00:40+00:00,"Big Tech is dominating the market once again — and that's probably just fine: Morning Brief This is The Takeaway from today's Morning Brief, which you can sign up to receive in your inbox every morning along with:
<ul><li>The chart of the day
</li><li>What we're watching
</li><li>What we December is shaping up to be a tale of two markets."
2024-12-18 15:44:13+00:00,"Expedia Stock Gains After Analyst Upgrade Sees Improving U.S. Travel Trends Expedia Group (EXPE) stock gained Wednesday morning after BofA Securities analysts boosted their outlook on the stock to buy from neutral.
BofA analyst Justin Post also raised his price target for E Expedia stock gained in morning trading Wednesday after analysts with BofA Securities boosted the stock to buy, citing travel trends."
2024-12-18 20:37:56+00:00,"The 13 best Airbnbs in Orlando from a romantic treehouse to a downtown condo When you buy through our links, Business Insider may earn an affiliate commission. Learn more
With more than 74 million travelers in 2023 alone, Orlando is the most visited city in the U.S. For many Orlando is the most visited city in the country, and staying there can be more affordable and enjoyable with an Airbnb."
2024-12-18 22:27:24+00:00,"China's getting a big electric car battery swapping boost in 2025. Would that work across the globe? Yahoo is using AI to generate takeaways from this article. This means the info may not always match what's in the article. Reporting mistakes helps us improve the experience.Generate Key Takeaways
D China will soon see a massive expansion of electric vehicle battery swapping, as global battery maker CATL said Wednesday it is investing heavily in stations..."
2024-12-19 04:55:43+00:00,"Here's what we know so far about who's working on DOGE President-elect Donald Trump tapped Elon Musk and Vivek Ramaswamy to lead the Department of Government Efficiency, or DOGE, in November.Brandon Bell via Getty Images
<ul><li>Elon Musk's DOGE has hir The commission said in an X post in November that applicants could send their CVs via direct message."
2024-12-20 12:54:28+00:00,"Uber Technologies, Inc. (UBER): Among Tiger Global Management’s Long-Term Stock Picks We recently compiled a list of the Tiger Global's 15 Long-Term Stock Picks. In this article, we are going to take a look at where Uber Technologies, Inc. (NYSE:UBER) stands against the other stock pi We recently compiled a list of the Tiger Global’s 15 Long-Term Stock Picks. In this article, we are going to take a look at where Uber Technologies, Inc..."
2024-12-20 17:32:23+00:00,"The market's top stocks need to keep winning to hold back a 'stealth correction,' Bank of America says With investors souring on the outlook for interest rates in 2025, it's up to the market's most dominant stocks to keep the party going and avoid sparking a correction, Bank of America said. 
Risk ap If the Magnificent Seven and Treasurys can hold at current levels, BofA says that recent lows following Wednesday's Fed meeting are a buying opportunity."
2024-12-20 18:42:32+00:00,"Darden Restaurants' Diversified Portfolio And Uber Delivery Partnership Offer Confidence In Overcoming Fine Dining Challenges: Analysts Darden Restaurants' Diversified Portfolio And Uber Delivery Partnership Offer Confidence In Overcoming Fine Dining Challenges: Analysts
Darden Restaurants, Inc. (NYSE:DRI) shares are trading relativ Darden Restaurants, Inc. (NYSE:DRI) shares are trading relatively flat on Friday. Yesterday, the company reported that the second quarter adjusted earnings..."
2024-12-20 19:20:25+00:00,Uber Investors Are Calling for More Transparency Into Driver Pay  
